VM,Powerstate,Name,Description,Date / time,Filename,Size MiB (vmsn),Size MiB (total),Quiesced,State,Annotation,Backup status,ClusterInvariantVMMId,Last backup,Datacenter,Cluster,Host,Folder,OS according to the configuration file,OS according to the VMware Tools,VM ID,VM UUID,VI SDK Server,VI SDK UUID
P-DLAB-01,,"P-DLAB-01 14/9/2025, 1:27:11",,2025-09-14T06:27:19.811126+00:00,,,,False,poweredOn,,,,,,,,,,,,,,
P-APP-ORPHEUS-01,,"P-APP-ORPHEUS-01 23/8/2025, 7:59:03",,2025-08-23T12:59:12.973588+00:00,,,,False,poweredOn,,,,,,,,,,,,,,
P-APP-ORPHEUS-01,,"P-APP-ORPHEUS-01 24/8/2025, 23:14:38",,2025-08-25T04:14:45.417918+00:00,,,,False,poweredOn,,,,,,,,,,,,,,
P-APP-ORPHEUS-01,,"P-APP-ORPHEUS-01 4/9/2025, 12:39:05",,2025-09-04T17:39:11.778734+00:00,,,,False,poweredOn,,,,,,,,,,,,,,
P-APP-ORPHEUS-01,,"P-APP-ORPHEUS-01 13/9/2025, 0:50:35",,2025-09-13T05:50:41.432401+00:00,,,,False,poweredOn,,,,,,,,,,,,,,
P-APP-ORPHEUS-01,,"P-APP-ORPHEUS-01 25/10/2025, 22:34:51",,2025-10-26T03:34:57.958499+00:00,,,,False,poweredOn,,,,,,,,,,,,,,
P-APP-ORPHEUS-01,,"P-APP-ORPHEUS-01 3/11/2025, 11:56:37",,2025-11-03T16:56:41.651909+00:00,,,,False,poweredOn,,,,,,,,,,,,,,
P-APP-LIB-01,,"P-APP-LIB-01 21/3/2025, 11:43:18",,2025-03-21T16:43:32.372018+00:00,,,,False,poweredOn,,,,,,,,,,,,,,
P-APP-LIB-01,,"P-APP-LIB-01 24/3/2025, 11:14:32",,2025-03-24T16:14:38.478781+00:00,,,,False,poweredOn,,,,,,,,,,,,,,
P-APP-LIB-01,,"P-APP-LIB-01 3/8/2025, 0:31:20",,2025-08-03T05:31:29.993795+00:00,,,,False,poweredOn,,,,,,,,,,,,,,
P-APP-LIB-01,,"P-APP-LIB-01 12/9/2025, 23:01:03",,2025-09-13T04:01:09.782828+00:00,,,,False,poweredOn,,,,,,,,,,,,,,
P-APP-LIB-01,,"P-APP-LIB-01 21%2f10%2f2025, 09:39:05",,2025-10-21T14:37:16.393662+00:00,,,,False,poweredOn,,,,,,,,,,,,,,
P-APP-LIB-01,,"P-APP-LIB-01 25/10/2025, 22:34:00",,2025-10-26T03:34:06.618288+00:00,,,,False,poweredOn,,,,,,,,,,,,,,
P-RADFS4-03,,P-RADFS4-03_vm-536_1,Snapshot generated by VMware vSphere Lifecycle Manager at 2024-11-18 17:43:06.887 (Lifecycle Manager local time). Snapshot will not be automatically deleted.,2024-11-18T17:43:10.051930+00:00,,,,False,poweredOff,,,,,,,,,,,,,,
P-RADFS4-03,,P-RADFS4-03_vm-536_1,Snapshot generated by VMware vSphere Lifecycle Manager at 2024-11-18 17:43:13.275 (Lifecycle Manager local time). Snapshot will not be automatically deleted.,2024-11-18T17:43:16.436172+00:00,,,,False,poweredOff,,,,,,,,,,,,,,
P-TRAPS-01,,P-TRAPS-01_vm-552_1,Snapshot generated by VMware vSphere Lifecycle Manager at 2024-11-17 03:33:12.545 (Lifecycle Manager local time). Snapshot will not be automatically deleted.,2024-11-17T03:33:16.116048+00:00,,,,False,poweredOff,,,,,,,,,,,,,,
P-PROOFPOINT-02,,P-PROOFPOINT-02_vm-503_1,Snapshot generated by VMware vSphere Lifecycle Manager at 2024-11-17 03:38:53.348 (Lifecycle Manager local time). Snapshot will not be automatically deleted.,2024-11-17T03:38:55.110597+00:00,,,,False,poweredOff,,,,,,,,,,,,,,
P-UCS-01,,"VM Snapshot 29%2f4%2f2024, 8:59:39",,2024-04-29T13:59:51.015079+00:00,,,,False,poweredOn,,,,,,,,,,,,,,
P-WORDPRESS-OL-02,,"P-WORDPRESS-OL-02 18/11/2024, 04:57:17",,2024-11-18T09:57:20.577236+00:00,,,,False,poweredOn,,,,,,,,,,,,,,
P-WORDPRESS-OL-02,,"P-WORDPRESS-OL-02 22/3/2025, 22:36:05",,2025-03-23T03:36:11.239037+00:00,,,,False,poweredOn,,,,,,,,,,,,,,
P-WORDPRESS-OL-02,,"P-WORDPRESS-OL-02 3/8/2025, 3:46:32",,2025-08-03T08:46:40.027704+00:00,,,,False,poweredOn,,,,,,,,,,,,,,
P-WORDPRESS-OL-02,,"P-WORDPRESS-OL-02 14/9/2025, 5:45:34",,2025-09-14T10:46:00.420252+00:00,,,,False,poweredOn,,,,,,,,,,,,,,
T-THALES-TKN-01,,T-THALES-TKN-01_vm-9034_1,Snapshot generated by VMware vSphere Lifecycle Manager at 2025-09-15 14:12:44.939 (Lifecycle Manager local time). Snapshot will not be automatically deleted.,2025-09-15T14:12:47.161049+00:00,,,,True,poweredOff,,,,,,,,,,,,,,
P-ZB-PROXY-02,,P-ZB-PROXY-02_vm-527_1,Snapshot generated by VMware vSphere Lifecycle Manager at 2024-11-17 02:39:07.484 (Lifecycle Manager local time). Snapshot will not be automatically deleted.,2024-11-17T02:39:10.942602+00:00,,,,False,poweredOff,,,,,,,,,,,,,,
P-NSS-02,,"Snapshot de máquina virtual 8/7/2025, 10:03:34",,2025-07-08T15:03:35.915704+00:00,,,,False,poweredOn,,,,,,,,,,,,,,
P-HUBI-PYTHON-OLNX-01,,"P-HUBI-PYTHON-OLNX-01 18/11/2024, 00:43:00",,2024-11-18T05:43:05.083148+00:00,,,,False,poweredOn,,,,,,,,,,,,,,
P-HUBI-PYTHON-OLNX-01,,"P-HUBI-PYTHON-OLNX-01 3/8/2025, 3:22:55",,2025-08-03T08:23:02.350416+00:00,,,,False,poweredOn,,,,,,,,,,,,,,
P-HUBI-PYTHON-OLNX-01,,"P-HUBI-PYTHON-OLNX-01 14/9/2025, 4:01:30",,2025-09-14T09:01:38.307703+00:00,,,,False,poweredOn,,,,,,,,,,,,,,
P-HUBI-PYTHON-OLNX-01,,"P-HUBI-PYTHON-OLNX-01 26/10/2025, 22:33:18",,2025-10-27T03:33:22.507930+00:00,,,,False,poweredOn,,,,,,,,,,,,,,
P-APP-INFOREDESTI-01,,"P-APP-INFOREDESTI-01 25/3/2025, 15:01:21",,2025-03-25T20:01:39.206024+00:00,,,,False,poweredOn,,,,,,,,,,,,,,
P-APP-INFOREDESTI-01,,"P-APP-INFOREDESTI-01 2/8/2025, 23:54:10",,2025-08-03T04:54:17.484624+00:00,,,,False,poweredOn,,,,,,,,,,,,,,
P-APP-INFOREDESTI-01,,"P-APP-INFOREDESTI-01 12/9/2025, 22:17:42",,2025-09-13T03:17:50.312261+00:00,,,,False,poweredOn,,,,,,,,,,,,,,
P-APP-INFOREDESTI-01,,"VM Snapshot 11/11/2025, 7:40:38 PM","Does a full system upgrade
Version locks docker-ce docker-ce-cli to 28.5.2 (documented)
Pulls latest CiCaDa (4053228) and PaginaWeb (cc13dff) commits",2025-11-11T19:42:47.821268+00:00,,,,False,poweredOn,,,,,,,,,,,,,,
P-ARBITRAJE-01,,"P-ARBITRAJE-01 3/8/2025, 1:18:22",,2025-08-03T06:18:28.849807+00:00,,,,False,poweredOn,,,,,,,,,,,,,,
P-ARBITRAJE-01,,"P-ARBITRAJE-01 13/9/2025, 5:47:26",,2025-09-13T10:47:32.918408+00:00,,,,False,poweredOn,,,,,,,,,,,,,,
P-ARBITRAJE-01,,"P-ARBITRAJE-01 3/11/2025, 11:55:54",,2025-11-03T16:56:00.525393+00:00,,,,False,poweredOn,,,,,,,,,,,,,,
P-WORDPRESS-OL-01,,"P-WORDPRESS-OL-01 18/11/2024, 04:14:31",,2024-11-18T09:14:32.179420+00:00,,,,False,poweredOn,,,,,,,,,,,,,,
P-WORDPRESS-OL-01,,"P-WORDPRESS-OL-01 22/3/2025, 14:50:53",,2025-03-22T19:51:06.636188+00:00,,,,False,poweredOn,,,,,,,,,,,,,,
P-WORDPRESS-OL-01,,"P-WORDPRESS-OL-01 3/8/2025, 3:43:25",,2025-08-03T08:43:33.133105+00:00,,,,False,poweredOn,,,,,,,,,,,,,,
P-WORDPRESS-OL-01,,"P-WORDPRESS-OL-01 14/9/2025, 5:45:23",,2025-09-14T10:45:30.544876+00:00,,,,False,poweredOn,,,,,,,,,,,,,,
P-ZB-PROXY-01,,P-ZB-PROXY-01_vm-1306_1,Snapshot generated by VMware vSphere Lifecycle Manager at 2024-11-17 02:39:16.700 (Lifecycle Manager local time). Snapshot will not be automatically deleted.,2024-11-17T02:39:19.294509+00:00,,,,False,poweredOff,,,,,,,,,,,,,,
P-BAN9-APP-04,,P-BAN9-APP-04_vm-3845_1,Snapshot generated by VMware vSphere Lifecycle Manager at 2024-10-28 15:06:22.973 (Lifecycle Manager local time). Snapshot will not be automatically deleted.,2024-10-28T15:06:22.992732+00:00,,,,False,poweredOff,,,,,,,,,,,,,,
P-BAN9-APP-04,,"P-BAN9-APP-04 3/11/2025, 12:21:36",,2025-11-03T17:21:42.306224+00:00,,,,False,poweredOn,,,,,,,,,,,,,,
T-APP-ORPHEUS-01,,"T-APP-ORPHEUS-01 5/6/2025, 10:12:35",,2025-06-05T15:12:43.699192+00:00,,,,False,poweredOn,,,,,,,,,,,,,,
T-APP-ORPHEUS-01,,"T-APP-ORPHEUS-01 9/6/2025, 13:00:24",,2025-06-09T18:00:39.324979+00:00,,,,False,poweredOn,,,,,,,,,,,,,,
T-APP-ORPHEUS-01,,"T-APP-ORPHEUS-01 HTTPD 1/7/2025, 9:53:32",,2025-07-01T14:53:49.015626+00:00,,,,False,poweredOn,,,,,,,,,,,,,,
T-APP-ORPHEUS-01,,"T-APP-ORPHEUS-01 16/7/2025, 14:55:38",,2025-07-16T19:55:50.397303+00:00,,,,False,poweredOn,,,,,,,,,,,,,,
T-APP-ORPHEUS-01,,"T-APP-ORPHEUS-01 16/7/2025, 17:29:25",,2025-07-16T22:29:42.759538+00:00,,,,False,poweredOn,,,,,,,,,,,,,,
T-APP-ORPHEUS-01,,"T-APP-ORPHEUS-01 5/8/2025, 11:06:34",,2025-08-05T16:06:41.486244+00:00,,,,False,poweredOn,,,,,,,,,,,,,,
T-APP-ORPHEUS-01,,"T-APP-ORPHEUS-01 13/9/2025, 1:22:14",,2025-09-13T06:22:21.399804+00:00,,,,False,poweredOn,,,,,,,,,,,,,,
T-APP-LIB-01,,"VM Snapshot 4/10/2025, 3:42:10 PM",,2025-04-10T20:42:11.467369+00:00,,,,False,poweredOn,,,,,,,,,,,,,,
P-QUALYS-02,,P-QUALYS-02_vm-7009_1,Snapshot generated by VMware vSphere Lifecycle Manager at 2025-09-15 14:10:30.652 (Lifecycle Manager local time). Snapshot will not be automatically deleted.,2025-09-15T14:10:31.045310+00:00,,,,False,poweredOff,,,,,,,,,,,,,,
P-BAN9-BEPBRIM-01,,"P-BAN9-BEPBRIM-01 3/11/2025, 12:22:13",,2025-11-03T17:22:18.822033+00:00,,,,False,poweredOn,,,,,,,,,,,,,,
P-KOVM-CLC-01-CLON,,"P-KOVM-CLC-01-CLON 28/11/2025, 19:48:50",,2025-11-29T00:48:56.683682+00:00,,,,False,poweredOn,,,,,,,,,,,,,,
T-THALES-CTM-01,,T-THALES-CTM-01_vm-9033_1,Snapshot generated by VMware vSphere Lifecycle Manager at 2025-09-15 14:12:40.577 (Lifecycle Manager local time). Snapshot will not be automatically deleted.,2025-09-15T14:12:42.840726+00:00,,,,True,poweredOff,,,,,,,,,,,,,,
P-NESSUS-01,,P-NESSUS-01_vm-510_1,Snapshot generated by VMware vSphere Lifecycle Manager at 2024-11-17 03:55:57.911 (Lifecycle Manager local time). Snapshot will not be automatically deleted.,2024-11-17T03:56:00.521447+00:00,,,,False,poweredOff,,,,,,,,,,,,,,
P-ENGINE-GIZ-01,,"P-ENGINE-GIZ-01-10 22/5/2025, 14:15:11",,2025-05-22T19:15:29.770796+00:00,,,,False,poweredOn,,,,,,,,,,,,,,
P-ZB-GRAFANA-01,,P-ZB-GRAFANA-01_vm-531_1,Snapshot generated by VMware vSphere Lifecycle Manager at 2024-11-17 02:40:35.893 (Lifecycle Manager local time). Snapshot will not be automatically deleted.,2024-11-17T02:40:39.442551+00:00,,,,False,poweredOff,,,,,,,,,,,,,,
P-ZB-GRAFANA-01,,"VM Snapshot 5/12/2025, 3:18:35 PM",Pre-env implementation,2025-05-12T20:18:51.242686+00:00,,,,False,poweredOn,,,,,,,,,,,,,,
P-ZB-GRAFANA-01,,"VM Snapshot 5/12/2025, 3:41:58 PM",Implements sourcing secrets from env file,2025-05-12T20:42:26.975733+00:00,,,,False,poweredOn,,,,,,,,,,,,,,
P-ZB-GRAFANA-01,,"VM Snapshot 5/12/2025, 5:40:48 PM",Changes publication DNS and hardens security,2025-05-12T22:41:05.142049+00:00,,,,False,poweredOn,,,,,,,,,,,,,,
P-BAN9-BATCH-01,,P-BAN9-BATCH-01_vm-3732_1,Snapshot generated by VMware vSphere Lifecycle Manager at 2024-10-24 16:46:45.283 (Lifecycle Manager local time). Snapshot will not be automatically deleted.,2024-10-24T16:46:47.376593+00:00,,,,True,poweredOff,,,,,,,,,,,,,,
P-BAN9-BATCH-01,,"P-BAN9-BATCH-01 3/11/2025, 12:22:00",,2025-11-03T17:22:04.684738+00:00,,,,False,poweredOn,,,,,,,,,,,,,,
P-BAN9-APP-03,,P-BAN9-APP-03_vm-3726_1,Snapshot generated by VMware vSphere Lifecycle Manager at 2024-10-24 16:47:57.185 (Lifecycle Manager local time). Snapshot will not be automatically deleted.,2024-10-24T16:47:59.498800+00:00,,,,True,poweredOff,,,,,,,,,,,,,,
P-BAN9-APP-03,,"P-BAN9-APP-03 3/11/2025, 12:21:26",,2025-11-03T17:21:31.586673+00:00,,,,False,poweredOn,,,,,,,,,,,,,,
P-BAN9-ETHOS-01,,P-BAN9-ETHOS-01_vm-3718_1,Snapshot generated by VMware vSphere Lifecycle Manager at 2024-10-24 16:47:21.838 (Lifecycle Manager local time). Snapshot will not be automatically deleted.,2024-10-24T16:47:24.098700+00:00,,,,True,poweredOff,,,,,,,,,,,,,,
P-BAN9-ETHOS-01,,"P-BAN9-ETHOS-01 1/9/2025, 17:32:59",,2025-09-01T22:33:07.088947+00:00,,,,False,poweredOn,,,,,,,,,,,,,,
P-BAN9-ETHOS-01,,"P-BAN9-ETHOS-01 3/11/2025, 12:22:24",,2025-11-03T17:22:29.046657+00:00,,,,False,poweredOn,,,,,,,,,,,,,,
P-RADIUS-02,,"Snapshot de máquina virtual 9/1/2025, 12:11:47 PM",,2025-09-01T17:11:49.667010+00:00,,,,False,poweredOn,,,,,,,,,,,,,,
P-BIBREPO-OLNX-01,,"P-BIPREPO-OLNX-01 17/11/2024, 05:20:43",,2024-11-17T10:20:52.610222+00:00,,,,False,poweredOn,,,,,,,,,,,,,,
P-BIBREPO-OLNX-01,,"P-BIBREPO-OLNX-01 13/9/2025, 22:13:19",,2025-09-14T03:13:25.898271+00:00,,,,False,poweredOn,,,,,,,,,,,,,,
P-BIBREPO-OLNX-01,,"P-BIBREPO-OLNX-01 26/10/2025, 21:32:24",,2025-10-27T02:32:29.810326+00:00,,,,False,poweredOn,,,,,,,,,,,,,,
P-BIBREPO-OLNX-01,,"P-BIBREPO-OLNX-01 3/11/2025, 12:19:40",,2025-11-03T17:19:46.048763+00:00,,,,False,poweredOn,,,,,,,,,,,,,,
P-DB-GALERA-OL9-02,,"P-DB-GALERA-OL9-02 22/3/2025, 17:39:16",,2025-03-22T22:39:20.946043+00:00,,,,False,poweredOn,,,,,,,,,,,,,,
P-DB-GALERA-OL9-02,,"P-DB-GALERA-OL9-02 22/8/2025, 21:01:50",,2025-08-23T02:02:00.642690+00:00,,,,False,poweredOn,,,,,,,,,,,,,,
P-DB-GALERA-OL9-02,,"P-DB-GALERA-OL9-02 25/10/2025, 21:33:58",,2025-10-26T02:34:08.072580+00:00,,,,False,poweredOn,,,,,,,,,,,,,,
P-DB-GALERA-OL9-03,,"P-DB-GALERA-OL9-03 22/3/2025, 18:02:10",,2025-03-22T23:02:15.343337+00:00,,,,False,poweredOn,,,,,,,,,,,,,,
P-DB-GALERA-OL9-03,,"P-DB-GALERA-OL9-03 22/8/2025, 21:02:04",,2025-08-23T02:02:12.684524+00:00,,,,False,poweredOn,,,,,,,,,,,,,,
P-DB-GALERA-OL9-03,,"P-DB-GALERA-OL9-03 25/10/2025, 21:34:11",,2025-10-26T02:34:18.841385+00:00,,,,False,poweredOn,,,,,,,,,,,,,,
P-VC-01,,"VM Snapshot 15/7/2025, 9:33:23",,2025-07-15T07:33:25.895279+00:00,,,,False,poweredOn,,,,,,,,,,,,,,
P-MOODLE-OL-03,,"P-MOODLE-OL-03 18/11/2024, 01:42:25",,2024-11-18T06:42:28.681794+00:00,,,,False,poweredOn,,,,,,,,,,,,,,
P-MOODLE-OL-03,,"P-MOODLE-OL-03 22/3/2025, 18:20:00",,2025-03-22T23:20:07.151362+00:00,,,,False,poweredOn,,,,,,,,,,,,,,
P-MOODLE-OL-03,,"P-MOODLE-OL-03 14/9/2025, 4:44:58",,2025-09-14T09:45:07.338469+00:00,,,,False,poweredOn,,,,,,,,,,,,,,
P-MOODLE-OL-03,,"P-MOODLE-OL-03 26/10/2025, 23:10:04",,2025-10-27T04:10:10.745500+00:00,,,,False,poweredOn,,,,,,,,,,,,,,
P-AD-DS-06,,Acronis_Mon Dec 22 18:00:33 2025,,2025-12-22T23:00:59.920207+00:00,,,,True,poweredOff,,,,,,,,,,,,,,
P-BAN9-APP-05,,P-BAN9-APP-05_vm-3728_1,Snapshot generated by VMware vSphere Lifecycle Manager at 2024-10-24 16:46:26.157 (Lifecycle Manager local time). Snapshot will not be automatically deleted.,2024-10-24T16:46:28.377704+00:00,,,,True,poweredOff,,,,,,,,,,,,,,
P-BAN9-APP-05,,"P-BAN9-APP-05 3/11/2025, 12:21:47",,2025-11-03T17:21:53.309327+00:00,,,,False,poweredOn,,,,,,,,,,,,,,
P-IMP-DBF-01,,P-IMP-DBF-01_vm-8062_1,Snapshot generated by VMware vSphere Lifecycle Manager at 2025-08-01 15:39:50.749 (Lifecycle Manager local time). Snapshot will not be automatically deleted.,2025-08-01T15:39:53.126711+00:00,,,,False,poweredOff,,,,,,,,,,,,,,
P-MINEMELDPA-01,,P-MINEMELDPA-01_vm-498_1,Snapshot generated by VMware vSphere Lifecycle Manager at 2024-11-19 13:57:10.620 (Lifecycle Manager local time). Snapshot will not be automatically deleted.,2024-11-19T13:57:15.292981+00:00,,,,False,poweredOff,,,,,,,,,,,,,,
P-DB-GALERA-OL9-01,,"P-DB-GALERA-OL9-01 22/3/2025, 15:20:34",,2025-03-22T20:20:40.167536+00:00,,,,False,poweredOn,,,,,,,,,,,,,,
P-DB-GALERA-OL9-01,,"P-DB-GALERA-OL9-01 22/8/2025, 21:01:35",,2025-08-23T02:01:45.309679+00:00,,,,False,poweredOn,,,,,,,,,,,,,,
P-DB-GALERA-OL9-01,,"P-DB-GALERA-OL9-01 25/10/2025, 21:33:39",,2025-10-26T02:33:48.778277+00:00,,,,False,poweredOn,,,,,,,,,,,,,,
P-DB-GALERA-OL9-01,,"P-DB-GALERA-OL9-01 3/11/2025, 12:19:57",,2025-11-03T17:20:03.116171+00:00,,,,False,poweredOn,,,,,,,,,,,,,,
P-APP-PASEC-OLN-01,,"P-APP-PASEC-OLN-01 3/8/2025, 0:48:49",,2025-08-03T05:48:54.954437+00:00,,,,False,poweredOn,,,,,,,,,,,,,,
P-APP-PASEC-OLN-01,,"P-APP-PASEC-OLN-01 13/9/2025, 3:46:25",,2025-09-13T08:46:30.771166+00:00,,,,False,poweredOn,,,,,,,,,,,,,,
P-APP-PASEC-OLN-01,,"P-APP-PASEC-OLN-01 25/10/2025, 22:35:05",,2025-10-26T03:35:11.311547+00:00,,,,False,poweredOn,,,,,,,,,,,,,,
P-APP-PASEC-OLN-01,,"P-APP-PASEC-OLN-01 3/11/2025, 11:56:24",,2025-11-03T16:56:31.021868+00:00,,,,False,poweredOn,,,,,,,,,,,,,,
P-APP-PASEC-OLN-01,,"P-APP-PASEC-OLN-01 3/11/2025, 12:22:59",,2025-11-03T17:23:03.704633+00:00,,,,False,poweredOn,,,,,,,,,,,,,,
P-APP-REDCAP-OLN-01,,"P-APP-REDCAP-OLN-01 23/3/2025, 10:59:22",,2025-03-23T15:59:29.890058+00:00,,,,False,poweredOn,,,,,,,,,,,,,,
P-APP-REDCAP-OLN-01,,"P-APP-REDCAP-OLN-01 3/8/2025, 1:02:23",,2025-08-03T06:02:28.819674+00:00,,,,False,poweredOn,,,,,,,,,,,,,,
P-APP-REDCAP-OLN-01,,"P-APP-REDCAP-OLN-01 13/9/2025, 4:32:39",,2025-09-13T09:32:45.839119+00:00,,,,False,poweredOn,,,,,,,,,,,,,,
P-APP-REDCAP-OLN-01,,"P-APP-REDCAP-OLN-01 25/10/2025, 22:35:19",,2025-10-26T03:35:26.576828+00:00,,,,False,poweredOn,,,,,,,,,,,,,,
P-APP-REDCAP-OLN-01,,"P-APP-REDCAP-OLN-01 3/11/2025, 11:56:13",,2025-11-03T16:56:19.589737+00:00,,,,False,poweredOn,,,,,,,,,,,,,,
P-APP-REDCAP-OLN-01,,"P-APP-REDCAP-OLN-01 24/11/2025, 14:23:19",,2025-11-24T19:23:25.279103+00:00,,,,False,poweredOn,,,,,,,,,,,,,,
P-GITLAB-OLNX-01,,P-GITLAB-OLNX-01_vm-1311_1,Snapshot generated by VMware vSphere Lifecycle Manager at 2024-11-17 03:44:59.985 (Lifecycle Manager local time). Snapshot will not be automatically deleted.,2024-11-17T03:45:03.457798+00:00,,,,False,poweredOff,,,,,,,,,,,,,,
P-GITLAB-OLNX-01,,"P-GITLAB-OLNX-01 17/11/2024, 22:45:28",,2024-11-18T03:45:37.011762+00:00,,,,False,poweredOn,,,,,,,,,,,,,,
P-GITLAB-OLNX-01,,"P-GITLAB-OLNX-01 10/3/2025, 11:58:25",,2025-03-10T16:58:38.250383+00:00,,,,False,poweredOn,,,,,,,,,,,,,,
P-GITLAB-OLNX-01,,"P-GITLAB-OLNX-01 3/8/2025, 3:07:30",,2025-08-03T08:07:37.418540+00:00,,,,False,poweredOn,,,,,,,,,,,,,,
P-GITLAB-OLNX-01,,"P-GITLAB-OLNX-01 3/8/2025, 3:22:00",,2025-08-03T08:22:06.407489+00:00,,,,False,poweredOn,,,,,,,,,,,,,,
P-GITLAB-OLNX-01,,"P-GITLAB-OLNX-01 23/9/2025, 20:03:49",,2025-09-24T01:03:56.300597+00:00,,,,False,poweredOn,,,,,,,,,,,,,,
P-GITLAB-OLNX-01,,"P-GITLAB-OLNX-01 26/10/2025, 22:33:36",,2025-10-27T03:33:42.921541+00:00,,,,False,poweredOn,,,,,,,,,,,,,,
P-GITLAB-OLNX-01,,"P-GITLAB-OLNX-01 3/11/2025, 11:58:50",,2025-11-03T16:58:55.427902+00:00,,,,False,poweredOn,,,,,,,,,,,,,,
P-GEOCENTRO-OLNX-01,,"P-GEOCENTRO-OLNX-01 17/11/2024, 21:10:31",,2024-11-18T02:10:39.634768+00:00,,,,False,poweredOn,,,,,,,,,,,,,,
P-GEOCENTRO-OLNX-01,,"P-GEOCENTRO-OLNX-01 23/3/2025, 10:58:51",,2025-03-23T15:58:57.100541+00:00,,,,False,poweredOn,,,,,,,,,,,,,,
P-GEOCENTRO-OLNX-01,,"P-GEOCENTRO-OLNX-01 3/8/2025, 3:06:05",,2025-08-03T08:06:11.398067+00:00,,,,False,poweredOn,,,,,,,,,,,,,,
P-GEOCENTRO-OLNX-01,,"P-GEOCENTRO-OLNX-01 14/9/2025, 2:48:51",,2025-09-14T07:48:56.483610+00:00,,,,False,poweredOn,,,,,,,,,,,,,,
P-GEOCENTRO-OLNX-01,,"P-GEOCENTRO-OLNX-01 26/10/2025, 22:10:51",,2025-10-27T03:10:59.382570+00:00,,,,False,poweredOn,,,,,,,,,,,,,,
P-GEOCENTRO-OLNX-01,,"P-GEOCENTRO-OLNX-01 3/11/2025, 12:23:31",,2025-11-03T17:23:37.253494+00:00,,,,False,poweredOn,,,,,,,,,,,,,,
P-IMP-MX-DBF-01,,"Snapshot de máquina virtual 31/3/2025, 11:13:15",,2025-03-31T16:13:17.685150+00:00,,,,False,poweredOn,,,,,,,,,,,,,,
P-IMP-MX-DBF-01,,"Snapshot de máquina virtual 8/22/2025, 9:22:16 AM",,2025-08-22T14:22:20.339647+00:00,,,,False,poweredOn,,,,,,,,,,,,,,
P-GI-01,,"VM Snapshot 12/13/2025, 8:31:15 AM",,2025-12-13T13:31:19.729447+00:00,,,,False,poweredOn,,,,,,,,,,,,,,
P-ZB-FE-01,,P-ZB-FE-01_vm-528_1,Snapshot generated by VMware vSphere Lifecycle Manager at 2024-11-17 02:40:42.583 (Lifecycle Manager local time). Snapshot will not be automatically deleted.,2024-11-17T02:40:44.331487+00:00,,,,False,poweredOff,,,,,,,,,,,,,,
P-HUBI-LNX-01,,P-HUBI-LNX-01_vm-1318_1,Snapshot generated by VMware vSphere Lifecycle Manager at 2024-11-17 03:57:30.963 (Lifecycle Manager local time). Snapshot will not be automatically deleted.,2024-11-17T03:57:34.441661+00:00,,,,False,poweredOff,,,,,,,,,,,,,,
P-HUBI-LNX-01,,"P-HUBI-LNX-01 25/8/2025, 7:52:51",,2025-08-25T12:52:56.720794+00:00,,,,False,poweredOn,,,,,,,,,,,,,,
P-HUBI-LNX-01,,"P-HUBI-LNX-01 3/11/2025, 12:28:22",,2025-11-03T17:28:27.840948+00:00,,,,False,poweredOn,,,,,,,,,,,,,,
P-HUBI-LNX-01,,"P-HUBI-LNX-01 20/11/2025, 10:20:53",,2025-11-20T15:21:07.175922+00:00,,,,False,poweredOn,,,,,,,,,,,,,,
P-BAN9-ADMP-01,,P-BAN9-ADMP-01_vm-3720_1,Snapshot generated by VMware vSphere Lifecycle Manager at 2024-10-24 16:45:11.214 (Lifecycle Manager local time). Snapshot will not be automatically deleted.,2024-10-24T16:45:13.467265+00:00,,,,True,poweredOff,,,,,,,,,,,,,,
P-BAN9-ADMP-01,,"P-BAN9-ADMP-01 3/11/2025, 12:20:53",,2025-11-03T17:20:58.548320+00:00,,,,False,poweredOn,,,,,,,,,,,,,,
P-RADIUS-01,,P-RADIUS-01_vm-506_1,Snapshot generated by VMware vSphere Lifecycle Manager at 2024-11-17 01:33:49.294 (Lifecycle Manager local time). Snapshot will not be automatically deleted.,2024-11-17T01:33:52.725478+00:00,,,,False,poweredOff,,,,,,,,,,,,,,
P-BAN9-APP-02,,P-BAN9-APP-02_vm-3843_1,Snapshot generated by VMware vSphere Lifecycle Manager at 2024-10-28 15:06:12.659 (Lifecycle Manager local time). Snapshot will not be automatically deleted.,2024-10-28T15:06:12.667256+00:00,,,,False,poweredOff,,,,,,,,,,,,,,
P-BAN9-APP-02,,"P-BAN9-APP-02 3/11/2025, 12:21:13",,2025-11-03T17:21:18.528562+00:00,,,,False,poweredOn,,,,,,,,,,,,,,
T-APP-INFOREDESTI-01,,"T-APP-INFOREDESTI-01 3/9/2025, 11:28:30",,2025-09-03T16:28:36.093157+00:00,,,,False,poweredOn,,,,,,,,,,,,,,
P-WEBWORK-01,,"VM Snapshot 1/8/2025, 11:04:02 AM",,2025-01-08T16:03:59.003053+00:00,,,,False,poweredOn,,,,,,,,,,,,,,
P-WEBWORK-01,,"P-WEBWORK-01 15/9/2025, 4:05:11",,2025-09-15T09:05:17.572450+00:00,,,,False,poweredOn,,,,,,,,,,,,,,
P-WEBWORK-01,,"P-WEBWORK-01 3/11/2025, 10:44:24",,2025-11-03T15:44:29.628580+00:00,,,,False,poweredOn,,,,,,,,,,,,,,
P-APP-ANSIBLE-OL9-01,,"P-APP-ANSIBLE-OL9-01 28/5/2025, 12:28:41",,2025-05-28T17:28:59.956050+00:00,,,,False,poweredOn,,,,,,,,,,,,,,
P-APP-ANSIBLE-OL9-01,,"P-APP-ANSIBLE-OL9-01 29/7/2025, 10:45:58",,2025-07-29T15:46:15.403176+00:00,,,,False,poweredOn,,,,,,,,,,,,,,
P-APP-ANSIBLE-OL9-01,,"VM Snapshot 11/10/2025, 12:21:55 PM","(temporal snapshot for testing, will be removed in the near future)",2025-11-10T12:22:31.150346+00:00,,,,False,poweredOn,,,,,,,,,,,,,,
P-APP-ANSIBLE-OL9-01,,"VM Snapshot 11/12/2025, 7:01:54 PM","(temporal snapshot II for testing, will be removed in the near future)",2025-11-12T19:02:14.669509+00:00,,,,False,poweredOn,,,,,,,,,,,,,,
P-BAN9-APP-01,,P-BAN9-APP-01_vm-3724_1,Snapshot generated by VMware vSphere Lifecycle Manager at 2024-10-24 16:45:54.577 (Lifecycle Manager local time). Snapshot will not be automatically deleted.,2024-10-24T16:45:56.853535+00:00,,,,True,poweredOff,,,,,,,,,,,,,,
P-BAN9-APP-01,,"P-BAN9-APP-01 3/11/2025, 12:21:04",,2025-11-03T17:21:09.471324+00:00,,,,False,poweredOn,,,,,,,,,,,,,,
P-FIN-MS-01,,"P-FIN-MS-01 17/11/2024, 13:49:20",,2024-11-17T18:49:18.239163+00:00,,,,False,poweredOn,,,,,,,,,,,,,,
P-FIN-MS-01,,"P-FIN-MS-01 14/9/2025, 2:04:31",,2025-09-14T07:04:44.580005+00:00,,,,False,poweredOn,,,,,,,,,,,,,,
P-FIN-MS-01,,"P-FIN-MS-01 26/10/2025, 22:11:10",,2025-10-27T03:11:16.905321+00:00,,,,False,poweredOn,,,,,,,,,,,,,,
P-EDUROAM-01,,"P-EDUROAM-01 3/11/2025, 12:48:11",,2025-11-03T17:48:15.411081+00:00,,,,False,poweredOn,,,,,,,,,,,,,,
P-WWW4-OL-01,,P-WWW4-OL-01_vm-557_1,Snapshot generated by VMware vSphere Lifecycle Manager at 2024-11-17 03:33:27.502 (Lifecycle Manager local time). Snapshot will not be automatically deleted.,2024-11-17T03:33:30.971517+00:00,,,,False,poweredOff,,,,,,,,,,,,,,
P-BAN9-SSB-01,,P-BAN9-SSB-01_vm-3722_1,Snapshot generated by VMware vSphere Lifecycle Manager at 2024-10-24 16:47:35.678 (Lifecycle Manager local time). Snapshot will not be automatically deleted.,2024-10-24T16:47:38.147220+00:00,,,,True,poweredOff,,,,,,,,,,,,,,
P-BAN9-SSB-01,,"P-BAN9-SSB-01 3/11/2025, 12:22:34",,2025-11-03T17:22:40.285675+00:00,,,,False,poweredOn,,,,,,,,,,,,,,
P-WS-EXT-02,,"Snapshot de máquina virtual 15/2/2025, 14:50:51",,2025-02-15T19:50:58.430997+00:00,,,,False,poweredOn,,,,,,,,,,,,,,
P-WS-EXT-02,,"Snapshot de máquina virtual 15/3/2025, 18:45:11",,2025-03-15T23:45:14.102832+00:00,,,,False,poweredOn,,,,,,,,,,,,,,
P-WS-EXT-02,,P-WS-EXT-02_vm-550_1,Snapshot generated by VMware vSphere Lifecycle Manager at 2025-03-15 23:45:29.417 (Lifecycle Manager local time). Snapshot will not be automatically deleted.,2025-03-15T23:48:42.211760+00:00,,,,True,poweredOff,,,,,,,,,,,,,,
P-EXPEDITION-PA-01,,P-EXPEDITION-PA-01_vm-485_1,Snapshot generated by VMware vSphere Lifecycle Manager at 2024-11-19 13:41:23.045 (Lifecycle Manager local time). Snapshot will not be automatically deleted.,2024-11-19T13:41:27.708980+00:00,,,,False,poweredOff,,,,,,,,,,,,,,
P-QUALYS-SCAN-01,,P-QUALYS-SCAN-01_vm-505_1,Snapshot generated by VMware vSphere Lifecycle Manager at 2024-11-19 14:15:56.263 (Lifecycle Manager local time). Snapshot will not be automatically deleted.,2024-11-19T14:16:00.937885+00:00,,,,False,poweredOff,,,,,,,,,,,,,,
P-CUSTOM-OLNX-01,,"P-CUSTOM-OLNX-01 3/8/2025, 1:49:55",,2025-08-03T06:50:01.559526+00:00,,,,False,poweredOn,,,,,,,,,,,,,,
P-CUSTOM-OLNX-01,,"P-CUSTOM-OLNX-01 14/9/2025, 0:29:33",,2025-09-14T05:29:39.524945+00:00,,,,False,poweredOn,,,,,,,,,,,,,,
P-CUSTOM-OLNX-01,,"P-CUSTOM-OLNX-01 26/10/2025, 21:54:10",,2025-10-27T02:54:16.465168+00:00,,,,False,poweredOn,,,,,,,,,,,,,,
P-CUSTOM-OLNX-01,,"P-CUSTOM-OLNX-01 3/11/2025, 12:19:25",,2025-11-03T17:19:31.780930+00:00,,,,False,poweredOn,,,,,,,,,,,,,,
P-ZB-DB-01,,P-ZB-DB-01_vm-556_1,Snapshot generated by VMware vSphere Lifecycle Manager at 2024-11-17 02:40:50.904 (Lifecycle Manager local time). Snapshot will not be automatically deleted.,2024-11-17T02:40:53.496821+00:00,,,,False,poweredOff,,,,,,,,,,,,,,
S-ACR-CLOUD-01,,"Snapshot de máquina virtual 15/5/2025, 9:19:17",,2025-05-15T07:19:19.476495+00:00,,,,False,poweredOn,,,,,,,,,,,,,,
T-BAN-APP-04,,"T-BAN-APP-04 4/8/2025, 1:21:35",,2025-08-04T06:21:46.178835+00:00,,,,False,poweredOn,,,,,,,,,,,,,,
T-BAN-BEPBRIM-01,,"T-BAN-BEPBRIM-01 4/8/2025, 1:22:54",,2025-08-04T06:23:06.362106+00:00,,,,False,poweredOn,,,,,,,,,,,,,,
T-BAN-BEPBRIM-01,,"T-BAN-BEPBRIM-01 3/11/2025, 10:43:06",,2025-11-03T15:43:10.801780+00:00,,,,False,poweredOn,,,,,,,,,,,,,,
D-CUSTOM-01,,"D-CUSTOM-01 21/3/2025, 11:46:07",,2025-03-21T16:46:21.079789+00:00,,,,False,poweredOn,,,,,,,,,,,,,,
D-CUSTOM-01,,"D-CUSTOM-01 30/10/2025, 8:17:38",,2025-10-30T13:17:43.881910+00:00,,,,False,poweredOn,,,,,,,,,,,,,,
D-CUSTOM-01,,"D-CUSTOM-01 3/11/2025, 10:09:41",,2025-11-03T15:09:47.835160+00:00,,,,False,poweredOn,,,,,,,,,,,,,,
T-FIN-MS-01,,T-FIN-MS-01_vm-199_1,Snapshot generated by VMware vSphere Lifecycle Manager at 2024-10-17 14:45:34.501 (Lifecycle Manager local time). Snapshot will not be automatically deleted.,2024-10-17T14:45:18.202602+00:00,,,,False,poweredOff,,,,,,,,,,,,,,
T-FIN-MS-01,,"T-FIN-MS-01 21/3/2025, 11:34:15",,2025-03-21T16:34:25.279734+00:00,,,,False,poweredOn,,,,,,,,,,,,,,
T-FIN-MS-01,,"T-FIN-MS-01 29/5/2025, 12:46:23",,2025-05-29T17:46:29.614307+00:00,,,,False,poweredOn,,,,,,,,,,,,,,
T-FIN-MS-01,,"T-FIN-MS-01 9/6/2025, 14:27:26",,2025-06-09T19:27:40.711527+00:00,,,,False,poweredOn,,,,,,,,,,,,,,
T-BAN-APP-05,,"T-BAN-APP-05 4/8/2025, 1:21:53",,2025-08-04T06:22:03.400742+00:00,,,,False,poweredOn,,,,,,,,,,,,,,
P-ANS-01,,P-ANS-01_vm-469_1,Snapshot generated by VMware vSphere Lifecycle Manager at 2024-12-30 00:21:37.649 (Lifecycle Manager local time). Snapshot will not be automatically deleted.,2024-12-30T00:23:01.779371+00:00,,,,False,poweredOff,,,,,,,,,,,,,,
T-BAN-ADMP-01,,"T-BAN-ADMP-01 4/8/2025, 1:20:16",,2025-08-04T06:20:23.821301+00:00,,,,False,poweredOn,,,,,,,,,,,,,,
T-BAN-ADMP-01,,"T-BAN-ADMP-01 3/11/2025, 10:43:46",,2025-11-03T15:43:52.140830+00:00,,,,False,poweredOn,,,,,,,,,,,,,,
T-BAN-SSB-01,,"T-BAN-SSB-01 4/8/2025, 1:24:05",,2025-08-04T06:24:13.333676+00:00,,,,False,poweredOn,,,,,,,,,,,,,,
T-BAN-SSB-01,,"T-BAN-SSB-01 3/11/2025, 10:42:37",,2025-11-03T15:42:42.185964+00:00,,,,False,poweredOn,,,,,,,,,,,,,,
T-BAN-APP-06,,"T-BAN-APP-06 4/8/2025, 1:22:07",,2025-08-04T06:22:16.965340+00:00,,,,False,poweredOn,,,,,,,,,,,,,,
D-HUBI-LNX-02,,"D-HUBI-LNX-02 13/5/2025, 14:49:34",,2025-05-13T19:49:51.015304+00:00,,,,False,poweredOn,,,,,,,,,,,,,,
D-HUBI-LNX-02,,"D-HUBI-LNX-02 20/5/2025, 9:11:07",,2025-05-20T14:11:23.225241+00:00,,,,False,poweredOn,,,,,,,,,,,,,,
D-HUBI-LNX-02,,"D-HUBI-LNX-02 3/11/2025, 10:05:16",,2025-11-03T15:05:26.126306+00:00,,,,False,poweredOn,,,,,,,,,,,,,,
T-BAN-BATCH-01,,T-BAN-BATCH-01_vm-214_1,Snapshot generated by VMware vSphere Lifecycle Manager at 2024-12-30 00:19:17.422 (Lifecycle Manager local time). Snapshot will not be automatically deleted.,2024-12-30T00:07:49.317295+00:00,,,,False,poweredOff,,,,,,,,,,,,,,
T-BAN-BATCH-01,,"T-BAN-BATCH-01 4/8/2025, 1:22:37",,2025-08-04T06:22:45.809790+00:00,,,,False,poweredOn,,,,,,,,,,,,,,
T-BAN-APP-02,,T-BAN-APP-02_vm-198_1,Snapshot generated by VMware vSphere Lifecycle Manager at 2024-12-30 00:18:41.958 (Lifecycle Manager local time). Snapshot will not be automatically deleted.,2024-12-30T00:07:19.428781+00:00,,,,False,poweredOff,,,,,,,,,,,,,,
T-BAN-APP-02,,"T-BAN-APP-02 4/8/2025, 1:20:55",,2025-08-04T06:21:06.176462+00:00,,,,False,poweredOn,,,,,,,,,,,,,,
T-BAN-APP-02,,"T-BAN-APP-02 7/10/2025, 10:36:22",,2025-10-07T15:36:30.965269+00:00,,,,False,poweredOn,,,,,,,,,,,,,,
T-BAN-APP-01,,"T-BAN-APP-01 4/8/2025, 1:20:36",,2025-08-04T06:20:47.018237+00:00,,,,False,poweredOn,,,,,,,,,,,,,,
T-BAN-APP-03,,"T-BAN-APP-03 4/8/2025, 1:21:10",,2025-08-04T06:21:30.981371+00:00,,,,False,poweredOn,,,,,,,,,,,,,,
P-WIN-ADM-01,,P-WIN-ADM-01_vm-1389_1,Snapshot generated by VMware vSphere Lifecycle Manager at 2024-11-20 15:43:59.411 (Lifecycle Manager local time). Snapshot will not be automatically deleted.,2024-11-20T15:46:52.067762+00:00,,,,False,poweredOff,,,,,,,,,,,,,,
T-BAN-ETHOS-01,,"T-BAN-ETHOS-01 4/8/2025, 1:23:43",,2025-08-04T06:23:51.891985+00:00,,,,False,poweredOn,,,,,,,,,,,,,,
T-BAN-ETHOS-01,,"T-BAN-ETHOS-01 3/11/2025, 10:42:23",,2025-11-03T15:42:28.435296+00:00,,,,False,poweredOn,,,,,,,,,,,,,,
T-RESERVAS-C7-01,,"T-RESERVAS-C7-01 23/12/2024, 04:07:59",,2024-12-23T09:10:01.222433+00:00,,,,False,poweredOn,,,,,,,,,,,,,,
T-RESERVAS-C7-01,,"T-RESERVAS-C7-01 10/2/2025, 10:19:17",,2025-02-10T15:18:29.533605+00:00,,,,False,poweredOn,,,,,,,,,,,,,,
T-RESERVAS-C7-01,,"T-RESERVAS-C7-01 21/3/2025, 11:36:32",,2025-03-21T16:38:30.522215+00:00,,,,False,poweredOn,,,,,,,,,,,,,,
T-BAN-ESM-01,,"T-BAN-ESM-01 4/8/2025, 1:23:28",,2025-08-04T06:23:35.987149+00:00,,,,False,poweredOn,,,,,,,,,,,,,,
T-BAN-ESM-01,,"T-BAN-ESM-01 3/11/2025, 10:42:52",,2025-11-03T15:42:57.080119+00:00,,,,False,poweredOn,,,,,,,,,,,,,,
T-APP-REDCAP-OLN-01,,T-APP-REDCAP-OLN-01_vm-169_1,Snapshot generated by VMware vSphere Lifecycle Manager at 2024-10-14 19:16:18.938 (Lifecycle Manager local time). Snapshot will not be automatically deleted.,2024-10-14T19:16:18.959471+00:00,,,,False,poweredOff,,,,,,,,,,,,,,
T-APP-REDCAP-OLN-01,,"T-APP-REDCAP-OLN-01 24/11/2025, 14:27:19",,2025-11-24T19:27:24.860396+00:00,,,,False,poweredOn,,,,,,,,,,,,,,
T-HUBI-PYTHON-OLNX-01,,T-HUBI-PYTHON-OLNX-01_vm-188_1,Snapshot generated by VMware vSphere Lifecycle Manager at 2024-10-17 14:45:02.062 (Lifecycle Manager local time). Snapshot will not be automatically deleted.,2024-10-17T14:44:35.479081+00:00,,,,False,poweredOff,,,,,,,,,,,,,,
T-HUBI-PYTHON-OLNX-01,,"T-HUBI-PYTHON-OLNX-01 10/11/2024, 09:58:54",,2024-11-10T14:55:09.998699+00:00,,,,False,poweredOn,,,,,,,,,,,,,,
T-HUBI-PYTHON-OLNX-01,,"T-HUBI-PYTHOM-OLNX-01 23/12/2024, 02:36:56",,2024-12-23T07:26:52.251459+00:00,,,,False,poweredOn,,,,,,,,,,,,,,
