VM,Powerstate,Name,Description,Date / time,Filename,Size MiB (vmsn),Size MiB (total),Quiesced,State,Annotation,Backup status,ClusterInvariantVMMId,Last backup,Datacenter,Cluster,Host,Folder,OS according to the configuration file,OS according to the VMware Tools,VM ID,VM UUID,VI SDK Server,VI SDK UUID
P-DLAB-01,poweredOn,"P-DLAB-01 14/9/2025, 1:27:11",,2025-09-14T06:27:19.811126+00:00,[FS1-P-ESX-VM-04] P-DLAB-01-17/P-DLAB-01-17-Snapshot33.vmem,4096.0,31638.13885498047,False,poweredOn,,OK,5006cb2d-452a-135c-be2d-74aebde77228,2025-12-19 16:03:52,USFQ,USFQ-PRODUCCION,p-esx-03.usfq.edu.ec,/USFQ/vm,SUSE Linux Enterprise 10 (64-bit),CentOS 7 (64-bit),vm-11028,4206d5f7-66b4-adef-4ce5-3bdd63464b18,p-vc-01.usfq.edu.ec,b4509789-2388-4298-aee8-97cf83caf1ba
P-APP-ORPHEUS-01,poweredOn,"P-APP-ORPHEUS-01 23/8/2025, 7:59:03",,2025-08-23T12:59:12.973588+00:00,[FS1-P-ESX-VM-04] P-APP-ORPHEUS-01/P-APP-ORPHEUS-01-Snapshot2.vmem,8192.0,79879.53943634033,False,poweredOn,,OK,50062432-df5c-33d8-27e8-4aad04e72d59,2025-12-19 22:02:11,USFQ,USFQ-PRODUCCION,p-esx-01.usfq.edu.ec,/USFQ/vm,Oracle Linux 9 (64-bit),Oracle Linux 9 (64-bit),vm-13340,42062b3f-8dda-1718-f176-3c6bcdecaf42,p-vc-01.usfq.edu.ec,b4509789-2388-4298-aee8-97cf83caf1ba
P-APP-ORPHEUS-01,poweredOn,"P-APP-ORPHEUS-01 24/8/2025, 23:14:38",,2025-08-25T04:14:45.417918+00:00,[FS1-P-ESX-VM-04] P-APP-ORPHEUS-01/P-APP-ORPHEUS-01-Snapshot3.vmem,8192.0,81160.53874969482,False,poweredOn,,OK,50062432-df5c-33d8-27e8-4aad04e72d59,2025-12-19 22:02:11,USFQ,USFQ-PRODUCCION,p-esx-01.usfq.edu.ec,/USFQ/vm,Oracle Linux 9 (64-bit),Oracle Linux 9 (64-bit),vm-13340,42062b3f-8dda-1718-f176-3c6bcdecaf42,p-vc-01.usfq.edu.ec,b4509789-2388-4298-aee8-97cf83caf1ba
P-APP-ORPHEUS-01,poweredOn,"P-APP-ORPHEUS-01 4/9/2025, 12:39:05",,2025-09-04T17:39:11.778734+00:00,[FS1-P-ESX-VM-04] P-APP-ORPHEUS-01/P-APP-ORPHEUS-01-Snapshot5.vmem,8192.0,88668.54026889801,False,poweredOn,,OK,50062432-df5c-33d8-27e8-4aad04e72d59,2025-12-19 22:02:11,USFQ,USFQ-PRODUCCION,p-esx-01.usfq.edu.ec,/USFQ/vm,Oracle Linux 9 (64-bit),Oracle Linux 9 (64-bit),vm-13340,42062b3f-8dda-1718-f176-3c6bcdecaf42,p-vc-01.usfq.edu.ec,b4509789-2388-4298-aee8-97cf83caf1ba
P-APP-ORPHEUS-01,poweredOn,"P-APP-ORPHEUS-01 13/9/2025, 0:50:35",,2025-09-13T05:50:41.432401+00:00,[FS1-P-ESX-VM-04] P-APP-ORPHEUS-01/P-APP-ORPHEUS-01-Snapshot8.vmem,8192.0,92678.54061508179,False,poweredOn,,OK,50062432-df5c-33d8-27e8-4aad04e72d59,2025-12-19 22:02:11,USFQ,USFQ-PRODUCCION,p-esx-01.usfq.edu.ec,/USFQ/vm,Oracle Linux 9 (64-bit),Oracle Linux 9 (64-bit),vm-13340,42062b3f-8dda-1718-f176-3c6bcdecaf42,p-vc-01.usfq.edu.ec,b4509789-2388-4298-aee8-97cf83caf1ba
P-APP-ORPHEUS-01,poweredOn,"P-APP-ORPHEUS-01 25/10/2025, 22:34:51",,2025-10-26T03:34:57.958499+00:00,[FS1-P-ESX-VM-04] P-APP-ORPHEUS-01/P-APP-ORPHEUS-01-Snapshot18.vmem,8192.0,103840.54172897339,False,poweredOn,,OK,50062432-df5c-33d8-27e8-4aad04e72d59,2025-12-19 22:02:11,USFQ,USFQ-PRODUCCION,p-esx-01.usfq.edu.ec,/USFQ/vm,Oracle Linux 9 (64-bit),Oracle Linux 9 (64-bit),vm-13340,42062b3f-8dda-1718-f176-3c6bcdecaf42,p-vc-01.usfq.edu.ec,b4509789-2388-4298-aee8-97cf83caf1ba
P-APP-ORPHEUS-01,poweredOn,"P-APP-ORPHEUS-01 3/11/2025, 11:56:37",,2025-11-03T16:56:41.651909+00:00,[FS1-P-ESX-VM-04] P-APP-ORPHEUS-01/P-APP-ORPHEUS-01-Snapshot23.vmem,8192.0,108651.54234600067,False,poweredOn,,OK,50062432-df5c-33d8-27e8-4aad04e72d59,2025-12-19 22:02:11,USFQ,USFQ-PRODUCCION,p-esx-01.usfq.edu.ec,/USFQ/vm,Oracle Linux 9 (64-bit),Oracle Linux 9 (64-bit),vm-13340,42062b3f-8dda-1718-f176-3c6bcdecaf42,p-vc-01.usfq.edu.ec,b4509789-2388-4298-aee8-97cf83caf1ba
P-APP-LIB-01,poweredOn,"P-APP-LIB-01 21/3/2025, 11:43:18",,2025-03-21T16:43:32.372018+00:00,[FS1-P-ESX-VM-03] P-APP-LIB-01/P-APP-LIB-01-Snapshot2.vmem,4096.0,65547.48891925812,False,poweredOn,,OK,5006ba79-0d39-88c2-6f03-997898cb4b3a,2025-12-19 16:04:00,USFQ,USFQ-PRODUCCION,p-esx-01.usfq.edu.ec,/USFQ/vm,Oracle Linux 9 (64-bit),Oracle Linux 9 (64-bit),vm-8112,4206672d-5230-7c90-8c07-b97ad62ae16d,p-vc-01.usfq.edu.ec,b4509789-2388-4298-aee8-97cf83caf1ba
P-APP-LIB-01,poweredOn,"P-APP-LIB-01 24/3/2025, 11:14:32",,2025-03-24T16:14:38.478781+00:00,[FS1-P-ESX-VM-03] P-APP-LIB-01/P-APP-LIB-01-Snapshot3.vmem,4096.0,74919.48924732208,False,poweredOn,,OK,5006ba79-0d39-88c2-6f03-997898cb4b3a,2025-12-19 16:04:00,USFQ,USFQ-PRODUCCION,p-esx-01.usfq.edu.ec,/USFQ/vm,Oracle Linux 9 (64-bit),Oracle Linux 9 (64-bit),vm-8112,4206672d-5230-7c90-8c07-b97ad62ae16d,p-vc-01.usfq.edu.ec,b4509789-2388-4298-aee8-97cf83caf1ba
P-APP-LIB-01,poweredOn,"P-APP-LIB-01 3/8/2025, 0:31:20",,2025-08-03T05:31:29.993795+00:00,[FS1-P-ESX-VM-03] P-APP-LIB-01/P-APP-LIB-01-Snapshot19.vmem,4096.0,99894.48109722137,False,poweredOn,,OK,5006ba79-0d39-88c2-6f03-997898cb4b3a,2025-12-19 16:04:00,USFQ,USFQ-PRODUCCION,p-esx-01.usfq.edu.ec,/USFQ/vm,Oracle Linux 9 (64-bit),Oracle Linux 9 (64-bit),vm-8112,4206672d-5230-7c90-8c07-b97ad62ae16d,p-vc-01.usfq.edu.ec,b4509789-2388-4298-aee8-97cf83caf1ba
P-APP-LIB-01,poweredOn,"P-APP-LIB-01 12/9/2025, 23:01:03",,2025-09-13T04:01:09.782828+00:00,[FS1-P-ESX-VM-03] P-APP-LIB-01/P-APP-LIB-01-Snapshot27.vmem,4096.0,110197.48148345947,False,poweredOn,,OK,5006ba79-0d39-88c2-6f03-997898cb4b3a,2025-12-19 16:04:00,USFQ,USFQ-PRODUCCION,p-esx-01.usfq.edu.ec,/USFQ/vm,Oracle Linux 9 (64-bit),Oracle Linux 9 (64-bit),vm-8112,4206672d-5230-7c90-8c07-b97ad62ae16d,p-vc-01.usfq.edu.ec,b4509789-2388-4298-aee8-97cf83caf1ba
P-APP-LIB-01,poweredOn,"P-APP-LIB-01 21%2f10%2f2025, 09:39:05",,2025-10-21T14:37:16.393662+00:00,[FS1-P-ESX-VM-03] P-APP-LIB-01/P-APP-LIB-01-Snapshot33.vmem,8192.0,127908.52091693878,False,poweredOn,,OK,5006ba79-0d39-88c2-6f03-997898cb4b3a,2025-12-19 16:04:00,USFQ,USFQ-PRODUCCION,p-esx-01.usfq.edu.ec,/USFQ/vm,Oracle Linux 9 (64-bit),Oracle Linux 9 (64-bit),vm-8112,4206672d-5230-7c90-8c07-b97ad62ae16d,p-vc-01.usfq.edu.ec,b4509789-2388-4298-aee8-97cf83caf1ba
P-APP-LIB-01,poweredOn,"P-APP-LIB-01 25/10/2025, 22:34:00",,2025-10-26T03:34:06.618288+00:00,[FS1-P-ESX-VM-03] P-APP-LIB-01/P-APP-LIB-01-Snapshot35.vmem,8192.0,130381.52116966248,False,poweredOn,,OK,5006ba79-0d39-88c2-6f03-997898cb4b3a,2025-12-19 16:04:00,USFQ,USFQ-PRODUCCION,p-esx-01.usfq.edu.ec,/USFQ/vm,Oracle Linux 9 (64-bit),Oracle Linux 9 (64-bit),vm-8112,4206672d-5230-7c90-8c07-b97ad62ae16d,p-vc-01.usfq.edu.ec,b4509789-2388-4298-aee8-97cf83caf1ba
P-RADFS4-03,poweredOff,P-RADFS4-03_vm-536_1,Snapshot generated by VMware vSphere Lifecycle Manager at 2024-11-18 17:43:06.887 (Lifecycle Manager local time). Snapshot will not be automatically deleted.,2024-11-18T17:43:10.051930+00:00,[FS1-P-ESX-VM-01] P-RADFS4-03/P-RADFS4-03-Snapshot106.vmsn,0.2785310745239258,129359.27912139893,False,poweredOff,"Disks=000000010000000000000000,52 54 d8 32 a5 2d 97 b6-37 38 52 5e e3 d2 ee 51/1,\archpit(2078A5F2446CDFBDCA7D1DBE8BCD9472)\disk1_part1,2048,1021952,\archpit(2078A5F2446CDFBDCA7D1DBE8BCD9472)\disk1_part2,1024000,202752,\archpit(2078A5F2446CDFBDCA7D1DBE8BCD9472)\disk1_part3,1259520,265076736;
SliceId=2078A5F2-DFBD-446C-BE1D-7DCA7294CD8B
SourceArchive=C24D5E09-B3A3-5A8C-C8A2-DA838E1CFE35
",OK,52cb731e-11d7-d942-d5a9-3337a573da8c,2025-12-19 21:01:09,USFQ,USFQ-PRODUCCION,p-esx-04.usfq.edu.ec,/USFQ/vm/SEGURIDAD-VM-PRODUCCION,Microsoft Windows Server 2016 (64-bit),Microsoft Windows Server 2016 (64-bit),vm-536,564d2f3a-b024-1df0-dcfb-d3f2f257cda2,p-vc-01.usfq.edu.ec,b4509789-2388-4298-aee8-97cf83caf1ba
P-RADFS4-03,poweredOff,P-RADFS4-03_vm-536_1,Snapshot generated by VMware vSphere Lifecycle Manager at 2024-11-18 17:43:13.275 (Lifecycle Manager local time). Snapshot will not be automatically deleted.,2024-11-18T17:43:16.436172+00:00,[FS1-P-ESX-VM-01] P-RADFS4-03/P-RADFS4-03-Snapshot107.vmsn,0.2785310745239258,129360.27951431274,False,poweredOff,"Disks=000000010000000000000000,52 54 d8 32 a5 2d 97 b6-37 38 52 5e e3 d2 ee 51/1,\archpit(2078A5F2446CDFBDCA7D1DBE8BCD9472)\disk1_part1,2048,1021952,\archpit(2078A5F2446CDFBDCA7D1DBE8BCD9472)\disk1_part2,1024000,202752,\archpit(2078A5F2446CDFBDCA7D1DBE8BCD9472)\disk1_part3,1259520,265076736;
SliceId=2078A5F2-DFBD-446C-BE1D-7DCA7294CD8B
SourceArchive=C24D5E09-B3A3-5A8C-C8A2-DA838E1CFE35
",OK,52cb731e-11d7-d942-d5a9-3337a573da8c,2025-12-19 21:01:09,USFQ,USFQ-PRODUCCION,p-esx-04.usfq.edu.ec,/USFQ/vm/SEGURIDAD-VM-PRODUCCION,Microsoft Windows Server 2016 (64-bit),Microsoft Windows Server 2016 (64-bit),vm-536,564d2f3a-b024-1df0-dcfb-d3f2f257cda2,p-vc-01.usfq.edu.ec,b4509789-2388-4298-aee8-97cf83caf1ba
P-TRAPS-01,poweredOff,P-TRAPS-01_vm-552_1,Snapshot generated by VMware vSphere Lifecycle Manager at 2024-11-17 03:33:12.545 (Lifecycle Manager local time). Snapshot will not be automatically deleted.,2024-11-17T03:33:16.116048+00:00,[FS1-P-ESX-VM-01] P-TRAPS-01/P-TRAPS-01-Snapshot4.vmsn,0.01972198486328125,563200.0208530426,False,poweredOff,,OK,50342064-8b91-b138-5c9e-137f46d57bbe,2025-12-20 22:01:57,USFQ,USFQ-PRODUCCION,p-esx-04.usfq.edu.ec,/USFQ/vm,CentOS 4/5 (64-bit),,vm-8072,4234c290-b79a-8f56-c9ef-1c5b382c3ccf,p-vc-01.usfq.edu.ec,b4509789-2388-4298-aee8-97cf83caf1ba
P-PROOFPOINT-02,poweredOff,P-PROOFPOINT-02_vm-503_1,Snapshot generated by VMware vSphere Lifecycle Manager at 2024-11-17 03:38:53.348 (Lifecycle Manager local time). Snapshot will not be automatically deleted.,2024-11-17T03:38:55.110597+00:00,[FS1-P-ESX-VM-04] P-PROOFPOINT-02/P-PROOFPOINT-02-Snapshot14.vmsn,0.019937515258789062,115157.02053546906,False,poweredOff,Proofpoint Enterprise Protection,OK,5215eb2a-4094-ae35-ee88-1b0fffbc0438,2025-12-20 22:01:09,USFQ,USFQ-PRODUCCION,p-esx-04.usfq.edu.ec,/USFQ/vm/SEGURIDAD-VM-PRODUCCION,CentOS 7 (64-bit),,vm-8067,564d2a30-c0b6-6b41-5d49-5abb4932dce9,p-vc-01.usfq.edu.ec,b4509789-2388-4298-aee8-97cf83caf1ba
P-UCS-01,poweredOn,"VM Snapshot 29%2f4%2f2024, 8:59:39",,2024-04-29T13:59:51.015079+00:00,[FS1-P-ESX-VM-01] P-UCS-01/P-UCS-01-Snapshot12.vmem,10384.0,49051.102478027344,False,poweredOn," Cisco UCS Central manages multiple Cisco UCS instances across globally distributed data centers, allowing IT departments to enjoy the benefits of simplified,unified management of compute, network, and storage access resource.
      ",OK,52bf2b32-bf68-41f5-5100-225df275d702,2025-12-14 01:06:31,USFQ,USFQ-PRODUCCION,p-esx-04.usfq.edu.ec,/USFQ/vm,CentOS 4/5 (64-bit),CentOS 4/5 (64-bit),vm-8031,564d28ce-1d3b-aaaf-36d4-275c31b3e209,p-vc-01.usfq.edu.ec,b4509789-2388-4298-aee8-97cf83caf1ba
P-WORDPRESS-OL-02,poweredOn,"P-WORDPRESS-OL-02 18/11/2024, 04:57:17",,2024-11-18T09:57:20.577236+00:00,[FS1-P-ESX-VM-04] P-WORDPRESS-OL-02/P-WORDPRESS-OL-02-Snapshot38.vmem,16384.0,25184.2544631958,False,poweredOn,,OK,5034733e-11f1-b8f3-fc94-d39edc6e2697,2025-12-06 06:02:53,USFQ,USFQ-PRODUCCION,p-esx-04.usfq.edu.ec,/USFQ/vm/SEGURIDAD-VM-PRODUCCION,Red Hat Enterprise Linux 7 (64-bit),CentOS 8 (64-bit),vm-8076,423414c0-d2fd-6610-0b97-5225cade89ec,p-vc-01.usfq.edu.ec,b4509789-2388-4298-aee8-97cf83caf1ba
P-WORDPRESS-OL-02,poweredOn,"P-WORDPRESS-OL-02 22/3/2025, 22:36:05",,2025-03-23T03:36:11.239037+00:00,[FS1-P-ESX-VM-04] P-WORDPRESS-OL-02/P-WORDPRESS-OL-02-Snapshot43.vmem,16384.0,29619.304644584656,False,poweredOn,,OK,5034733e-11f1-b8f3-fc94-d39edc6e2697,2025-12-06 06:02:53,USFQ,USFQ-PRODUCCION,p-esx-04.usfq.edu.ec,/USFQ/vm/SEGURIDAD-VM-PRODUCCION,Red Hat Enterprise Linux 7 (64-bit),CentOS 8 (64-bit),vm-8076,423414c0-d2fd-6610-0b97-5225cade89ec,p-vc-01.usfq.edu.ec,b4509789-2388-4298-aee8-97cf83caf1ba
P-WORDPRESS-OL-02,poweredOn,"P-WORDPRESS-OL-02 3/8/2025, 3:46:32",,2025-08-03T08:46:40.027704+00:00,[FS1-P-ESX-VM-04] P-WORDPRESS-OL-02/P-WORDPRESS-OL-02-Snapshot50.vmem,16384.0,32319.25417137146,False,poweredOn,,OK,5034733e-11f1-b8f3-fc94-d39edc6e2697,2025-12-06 06:02:53,USFQ,USFQ-PRODUCCION,p-esx-04.usfq.edu.ec,/USFQ/vm/SEGURIDAD-VM-PRODUCCION,Red Hat Enterprise Linux 7 (64-bit),CentOS 8 (64-bit),vm-8076,423414c0-d2fd-6610-0b97-5225cade89ec,p-vc-01.usfq.edu.ec,b4509789-2388-4298-aee8-97cf83caf1ba
P-WORDPRESS-OL-02,poweredOn,"P-WORDPRESS-OL-02 14/9/2025, 5:45:34",,2025-09-14T10:46:00.420252+00:00,[FS1-P-ESX-VM-04] P-WORDPRESS-OL-02/P-WORDPRESS-OL-02-Snapshot52.vmem,16384.0,34064.2577085495,False,poweredOn,,OK,5034733e-11f1-b8f3-fc94-d39edc6e2697,2025-12-06 06:02:53,USFQ,USFQ-PRODUCCION,p-esx-04.usfq.edu.ec,/USFQ/vm/SEGURIDAD-VM-PRODUCCION,Red Hat Enterprise Linux 7 (64-bit),CentOS 8 (64-bit),vm-8076,423414c0-d2fd-6610-0b97-5225cade89ec,p-vc-01.usfq.edu.ec,b4509789-2388-4298-aee8-97cf83caf1ba
T-THALES-TKN-01,poweredOn,T-THALES-TKN-01_vm-9034_1,Snapshot generated by VMware vSphere Lifecycle Manager at 2025-09-15 14:12:44.939 (Lifecycle Manager local time). Snapshot will not be automatically deleted.,2025-09-15T14:12:47.161049+00:00,[FS1-P-ESX-VM-04] T-THALES-TKN-01/T-THALES-TKN-01-Snapshot3.vmsn,0.019957542419433594,102400.02053070068,True,poweredOff,,OK,500650da-53b8-5fc8-ed56-36aa6cbb5dd7,2025-05-22 13:46:30,USFQ,USFQ-PRODUCCION,p-esx-04.usfq.edu.ec,/USFQ/vm/SEGURIDAD-VM-TEST,Ubuntu Linux (64-bit),Ubuntu Linux (64-bit),vm-9034,4206bee6-d678-1533-368a-c78371f0f883,p-vc-01.usfq.edu.ec,b4509789-2388-4298-aee8-97cf83caf1ba
P-ZB-PROXY-02,poweredOn,P-ZB-PROXY-02_vm-527_1,Snapshot generated by VMware vSphere Lifecycle Manager at 2024-11-17 02:39:07.484 (Lifecycle Manager local time). Snapshot will not be automatically deleted.,2024-11-17T02:39:10.942602+00:00,[FS1-P-ESX-VM-05] P-ZB-PROXY-02/P-ZB-PROXY-02-Snapshot3.vmsn,0.2883005142211914,11211.288892745972,False,poweredOff,,OK,50341208-47f5-5baa-1c12-74480fc0692b,2025-12-15 15:41:35,USFQ,USFQ-PRODUCCION,p-esx-04.usfq.edu.ec,/USFQ/vm/SEGURIDAD-VM-PRODUCCION,Other 2.6.x Linux (64-bit),Oracle Linux 8 (64-bit),vm-527,42344a6d-e340-979d-d1b5-f8ba1d8e7c1f,p-vc-01.usfq.edu.ec,b4509789-2388-4298-aee8-97cf83caf1ba
P-NSS-02,poweredOn,"Snapshot de máquina virtual 8/7/2025, 10:03:34",,2025-07-08T15:03:35.915704+00:00,[FS1-P-ESX-VM-04] P-NSS-02/P-NSS-02-Snapshot48.vmem,16384.0,30956.28693008423,False,poweredOn,,OK,5034aa2b-1197-3c11-388e-27ff34d8f64c,2025-12-15 23:01:15,USFQ,USFQ-PRODUCCION,p-esx-04.usfq.edu.ec,/USFQ/vm,Other 2.6.x Linux (64-bit),Oracle Linux 7 (64-bit),vm-8037,4234c5b7-cce9-39bd-49c0-c48b725c6288,p-vc-01.usfq.edu.ec,b4509789-2388-4298-aee8-97cf83caf1ba
P-HUBI-PYTHON-OLNX-01,poweredOn,"P-HUBI-PYTHON-OLNX-01 18/11/2024, 00:43:00",,2024-11-18T05:43:05.083148+00:00,[FS1-P-ESX-VM-08] P-HUBI-PYTHON-OLNX-01/P-HUBI-PYTHON-OLNX-01-Snapshot8.vmem,8192.0,36942.202456474304,False,poweredOn,,OK,5034e5c2-6ef5-62f7-9165-5df9e8425add,2025-12-19 22:02:19,USFQ,USFQ-PRODUCCION,p-esx-04.usfq.edu.ec,/USFQ/vm/Discovered virtual machine,Other 2.6.x Linux (64-bit),Oracle Linux 8 (64-bit),vm-1323,423475c2-6231-63ea-61fc-de07f8acd46b,p-vc-01.usfq.edu.ec,b4509789-2388-4298-aee8-97cf83caf1ba
P-HUBI-PYTHON-OLNX-01,poweredOn,"P-HUBI-PYTHON-OLNX-01 3/8/2025, 3:22:55",,2025-08-03T08:23:02.350416+00:00,[FS1-P-ESX-VM-08] P-HUBI-PYTHON-OLNX-01/P-HUBI-PYTHON-OLNX-01-Snapshot46.vmem,8192.0,59949.24671173096,False,poweredOn,,OK,5034e5c2-6ef5-62f7-9165-5df9e8425add,2025-12-19 22:02:19,USFQ,USFQ-PRODUCCION,p-esx-04.usfq.edu.ec,/USFQ/vm/Discovered virtual machine,Other 2.6.x Linux (64-bit),Oracle Linux 8 (64-bit),vm-1323,423475c2-6231-63ea-61fc-de07f8acd46b,p-vc-01.usfq.edu.ec,b4509789-2388-4298-aee8-97cf83caf1ba
P-HUBI-PYTHON-OLNX-01,poweredOn,"P-HUBI-PYTHON-OLNX-01 14/9/2025, 4:01:30",,2025-09-14T09:01:38.307703+00:00,[FS1-P-ESX-VM-08] P-HUBI-PYTHON-OLNX-01/P-HUBI-PYTHON-OLNX-01-Snapshot56.vmem,8192.0,74949.24715042114,False,poweredOn,,OK,5034e5c2-6ef5-62f7-9165-5df9e8425add,2025-12-19 22:02:19,USFQ,USFQ-PRODUCCION,p-esx-04.usfq.edu.ec,/USFQ/vm/Discovered virtual machine,Other 2.6.x Linux (64-bit),Oracle Linux 8 (64-bit),vm-1323,423475c2-6231-63ea-61fc-de07f8acd46b,p-vc-01.usfq.edu.ec,b4509789-2388-4298-aee8-97cf83caf1ba
P-HUBI-PYTHON-OLNX-01,poweredOn,"P-HUBI-PYTHON-OLNX-01 26/10/2025, 22:33:18",,2025-10-27T03:33:22.507930+00:00,[FS1-P-ESX-VM-08] P-HUBI-PYTHON-OLNX-01/P-HUBI-PYTHON-OLNX-01-Snapshot63.vmem,8192.0,87851.24821186066,False,poweredOn,,OK,5034e5c2-6ef5-62f7-9165-5df9e8425add,2025-12-19 22:02:19,USFQ,USFQ-PRODUCCION,p-esx-04.usfq.edu.ec,/USFQ/vm/Discovered virtual machine,Other 2.6.x Linux (64-bit),Oracle Linux 8 (64-bit),vm-1323,423475c2-6231-63ea-61fc-de07f8acd46b,p-vc-01.usfq.edu.ec,b4509789-2388-4298-aee8-97cf83caf1ba
P-APP-INFOREDESTI-01,poweredOn,"P-APP-INFOREDESTI-01 25/3/2025, 15:01:21",,2025-03-25T20:01:39.206024+00:00,[FS1-P-ESX-VM-04] P-APP-INFOREDESTI-01/P-APP-INFOREDESTI-01-Snapshot3.vmem,3072.0,44043.48207473755,False,poweredOn,,OK,5006edce-bde2-6923-63e0-572cde33a6aa,2025-11-29 22:03:16,USFQ,USFQ-PRODUCCION,p-esx-04.usfq.edu.ec,/USFQ/vm,Oracle Linux 9 (64-bit),Oracle Linux 9 (64-bit),vm-8110,42063c2f-cc64-78cc-6e78-ca4ddb6fdde7,p-vc-01.usfq.edu.ec,b4509789-2388-4298-aee8-97cf83caf1ba
P-APP-INFOREDESTI-01,poweredOn,"P-APP-INFOREDESTI-01 2/8/2025, 23:54:10",,2025-08-03T04:54:17.484624+00:00,[FS1-P-ESX-VM-04] P-APP-INFOREDESTI-01/P-APP-INFOREDESTI-01-Snapshot13.vmem,3072.0,64189.48198413849,False,poweredOn,,OK,5006edce-bde2-6923-63e0-572cde33a6aa,2025-11-29 22:03:16,USFQ,USFQ-PRODUCCION,p-esx-04.usfq.edu.ec,/USFQ/vm,Oracle Linux 9 (64-bit),Oracle Linux 9 (64-bit),vm-8110,42063c2f-cc64-78cc-6e78-ca4ddb6fdde7,p-vc-01.usfq.edu.ec,b4509789-2388-4298-aee8-97cf83caf1ba
P-APP-INFOREDESTI-01,poweredOn,"P-APP-INFOREDESTI-01 12/9/2025, 22:17:42",,2025-09-13T03:17:50.312261+00:00,[FS1-P-ESX-VM-04] P-APP-INFOREDESTI-01/P-APP-INFOREDESTI-01-Snapshot16.vmem,3072.0,78372.4803390503,False,poweredOn,,OK,5006edce-bde2-6923-63e0-572cde33a6aa,2025-11-29 22:03:16,USFQ,USFQ-PRODUCCION,p-esx-04.usfq.edu.ec,/USFQ/vm,Oracle Linux 9 (64-bit),Oracle Linux 9 (64-bit),vm-8110,42063c2f-cc64-78cc-6e78-ca4ddb6fdde7,p-vc-01.usfq.edu.ec,b4509789-2388-4298-aee8-97cf83caf1ba
P-APP-INFOREDESTI-01,poweredOn,"VM Snapshot 11/11/2025, 7:40:38 PM","Does a full system upgrade
Version locks docker-ce docker-ce-cli to 28.5.2 (documented)
Pulls latest CiCaDa (4053228) and PaginaWeb (cc13dff) commits",2025-11-11T19:42:47.821268+00:00,[FS1-P-ESX-VM-04] P-APP-INFOREDESTI-01/P-APP-INFOREDESTI-01-Snapshot26.vmem,3072.0,86675.48421287537,False,poweredOn,,OK,5006edce-bde2-6923-63e0-572cde33a6aa,2025-11-29 22:03:16,USFQ,USFQ-PRODUCCION,p-esx-04.usfq.edu.ec,/USFQ/vm,Oracle Linux 9 (64-bit),Oracle Linux 9 (64-bit),vm-8110,42063c2f-cc64-78cc-6e78-ca4ddb6fdde7,p-vc-01.usfq.edu.ec,b4509789-2388-4298-aee8-97cf83caf1ba
P-ARBITRAJE-01,poweredOn,"P-ARBITRAJE-01 3/8/2025, 1:18:22",,2025-08-03T06:18:28.849807+00:00,[FS1-P-ESX-VM-03] P-ARBITRAJE-01/P-ARBITRAJE-01-Snapshot26.vmem,8192.0,89408.18692779541,False,poweredOn,,OK,50342e44-7afe-f353-6fa9-b7b22c75a3bc,2025-12-09 17:06:54,USFQ,USFQ-PRODUCCION,p-esx-04.usfq.edu.ec,/USFQ/vm,CentOS 4/5 (64-bit),CentOS 7 (64-bit),vm-8063,423415d5-b36f-5b03-fc23-4452b4fb995c,p-vc-01.usfq.edu.ec,b4509789-2388-4298-aee8-97cf83caf1ba
P-ARBITRAJE-01,poweredOn,"P-ARBITRAJE-01 13/9/2025, 5:47:26",,2025-09-13T10:47:32.918408+00:00,[FS1-P-ESX-VM-03] P-ARBITRAJE-01/P-ARBITRAJE-01-Snapshot31.vmem,8192.0,102164.1912355423,False,poweredOn,,OK,50342e44-7afe-f353-6fa9-b7b22c75a3bc,2025-12-09 17:06:54,USFQ,USFQ-PRODUCCION,p-esx-04.usfq.edu.ec,/USFQ/vm,CentOS 4/5 (64-bit),CentOS 7 (64-bit),vm-8063,423415d5-b36f-5b03-fc23-4452b4fb995c,p-vc-01.usfq.edu.ec,b4509789-2388-4298-aee8-97cf83caf1ba
P-ARBITRAJE-01,poweredOn,"P-ARBITRAJE-01 3/11/2025, 11:55:54",,2025-11-03T16:56:00.525393+00:00,[FS1-P-ESX-VM-03] P-ARBITRAJE-01/P-ARBITRAJE-01-Snapshot33.vmem,8192.0,111790.1916437149,False,poweredOn,,OK,50342e44-7afe-f353-6fa9-b7b22c75a3bc,2025-12-09 17:06:54,USFQ,USFQ-PRODUCCION,p-esx-04.usfq.edu.ec,/USFQ/vm,CentOS 4/5 (64-bit),CentOS 7 (64-bit),vm-8063,423415d5-b36f-5b03-fc23-4452b4fb995c,p-vc-01.usfq.edu.ec,b4509789-2388-4298-aee8-97cf83caf1ba
P-WORDPRESS-OL-01,poweredOn,"P-WORDPRESS-OL-01 18/11/2024, 04:14:31",,2024-11-18T09:14:32.179420+00:00,[FS1-P-ESX-VM-03] P-WORDPRESS-OL-01/P-WORDPRESS-OL-01-Snapshot4.vmem,8192.0,29517.203037261963,False,poweredOn,,OK,5034b711-1de6-b8e6-16b7-eeb5264af375,2025-12-06 06:04:00,USFQ,USFQ-PRODUCCION,p-esx-04.usfq.edu.ec,/USFQ/vm/SEGURIDAD-VM-PRODUCCION,Other 2.6.x Linux (64-bit),Oracle Linux 8 (64-bit),vm-8043,42344140-da18-e992-b982-9d5079604230,p-vc-01.usfq.edu.ec,b4509789-2388-4298-aee8-97cf83caf1ba
P-WORDPRESS-OL-01,poweredOn,"P-WORDPRESS-OL-01 22/3/2025, 14:50:53",,2025-03-22T19:51:06.636188+00:00,[FS1-P-ESX-VM-03] P-WORDPRESS-OL-01/P-WORDPRESS-OL-01-Snapshot9.vmem,8192.0,45515.2445268631,False,poweredOn,,OK,5034b711-1de6-b8e6-16b7-eeb5264af375,2025-12-06 06:04:00,USFQ,USFQ-PRODUCCION,p-esx-04.usfq.edu.ec,/USFQ/vm/SEGURIDAD-VM-PRODUCCION,Other 2.6.x Linux (64-bit),Oracle Linux 8 (64-bit),vm-8043,42344140-da18-e992-b982-9d5079604230,p-vc-01.usfq.edu.ec,b4509789-2388-4298-aee8-97cf83caf1ba
P-WORDPRESS-OL-01,poweredOn,"P-WORDPRESS-OL-01 3/8/2025, 3:43:25",,2025-08-03T08:43:33.133105+00:00,[FS1-P-ESX-VM-03] P-WORDPRESS-OL-01/P-WORDPRESS-OL-01-Snapshot16.vmem,8192.0,61004.24868297577,False,poweredOn,,OK,5034b711-1de6-b8e6-16b7-eeb5264af375,2025-12-06 06:04:00,USFQ,USFQ-PRODUCCION,p-esx-04.usfq.edu.ec,/USFQ/vm/SEGURIDAD-VM-PRODUCCION,Other 2.6.x Linux (64-bit),Oracle Linux 8 (64-bit),vm-8043,42344140-da18-e992-b982-9d5079604230,p-vc-01.usfq.edu.ec,b4509789-2388-4298-aee8-97cf83caf1ba
P-WORDPRESS-OL-01,poweredOn,"P-WORDPRESS-OL-01 14/9/2025, 5:45:23",,2025-09-14T10:45:30.544876+00:00,[FS1-P-ESX-VM-03] P-WORDPRESS-OL-01/P-WORDPRESS-OL-01-Snapshot18.vmem,8192.0,72558.24521160126,False,poweredOn,,OK,5034b711-1de6-b8e6-16b7-eeb5264af375,2025-12-06 06:04:00,USFQ,USFQ-PRODUCCION,p-esx-04.usfq.edu.ec,/USFQ/vm/SEGURIDAD-VM-PRODUCCION,Other 2.6.x Linux (64-bit),Oracle Linux 8 (64-bit),vm-8043,42344140-da18-e992-b982-9d5079604230,p-vc-01.usfq.edu.ec,b4509789-2388-4298-aee8-97cf83caf1ba
P-ZB-PROXY-01,poweredOn,P-ZB-PROXY-01_vm-1306_1,Snapshot generated by VMware vSphere Lifecycle Manager at 2024-11-17 02:39:16.700 (Lifecycle Manager local time). Snapshot will not be automatically deleted.,2024-11-17T02:39:19.294509+00:00,[FS1-P-ESX-VM-04] P-ZB-PROXY-01/P-ZB-PROXY-01-Snapshot3.vmsn,0.28509998321533203,12142.285692214966,False,poweredOff,,OK,50348937-ecf3-568d-a70e-5645dcd02218,2025-12-15 15:33:13,USFQ,USFQ-PRODUCCION,p-esx-04.usfq.edu.ec,/USFQ/vm/SEGURIDAD-VM-PRODUCCION,Other 2.6.x Linux (64-bit),Oracle Linux 8 (64-bit),vm-1306,423480a9-b418-490f-7ee3-658fccfaf05c,p-vc-01.usfq.edu.ec,b4509789-2388-4298-aee8-97cf83caf1ba
P-BAN9-APP-04,poweredOn,P-BAN9-APP-04_vm-3845_1,Snapshot generated by VMware vSphere Lifecycle Manager at 2024-10-28 15:06:22.973 (Lifecycle Manager local time). Snapshot will not be automatically deleted.,2024-10-28T15:06:22.992732+00:00,[FS1-P-ESX-VM-04] P-BAN9-APP-04/P-BAN9-APP-04-Snapshot1.vmsn,0.2808113098144531,163840.28195285797,False,poweredOff,,OK,50065739-67d2-24ba-23e2-89f73432d509,2025-12-10 01:05:06,USFQ,USFQ-PRODUCCION,p-esx-04.usfq.edu.ec,/USFQ/vm/INFRA-VM-PRODUCCION-BANNER,Oracle Linux 8 (64-bit),Oracle Linux 8 (64-bit),vm-3845,4206aefb-ab92-1593-0d5a-71d53f690314,p-vc-01.usfq.edu.ec,b4509789-2388-4298-aee8-97cf83caf1ba
P-BAN9-APP-04,poweredOn,"P-BAN9-APP-04 3/11/2025, 12:21:36",,2025-11-03T17:21:42.306224+00:00,[FS1-P-ESX-VM-04] P-BAN9-APP-04/P-BAN9-APP-04-Snapshot40.vmem,16384.0,307949.61849594116,False,poweredOn,,OK,50065739-67d2-24ba-23e2-89f73432d509,2025-12-10 01:05:06,USFQ,USFQ-PRODUCCION,p-esx-04.usfq.edu.ec,/USFQ/vm/INFRA-VM-PRODUCCION-BANNER,Oracle Linux 8 (64-bit),Oracle Linux 8 (64-bit),vm-3845,4206aefb-ab92-1593-0d5a-71d53f690314,p-vc-01.usfq.edu.ec,b4509789-2388-4298-aee8-97cf83caf1ba
T-APP-ORPHEUS-01,poweredOn,"T-APP-ORPHEUS-01 5/6/2025, 10:12:35",,2025-06-05T15:12:43.699192+00:00,[FS1-P-ESX-VM-05] T-APP-ORPHEUS-01/T-APP-ORPHEUS-01-Snapshot1.vmem,7734.0,79425.53174591064,False,poweredOn,,OK,5006c9f6-f7ad-ef24-e08a-9d74b3bdce07,2025-12-19 16:03:43,USFQ,USFQ-PRODUCCION,p-esx-04.usfq.edu.ec,/USFQ/vm,Oracle Linux 9 (64-bit),Oracle Linux 9 (64-bit),vm-11203,4206ee32-c614-dd01-911c-3ac0c491754e,p-vc-01.usfq.edu.ec,b4509789-2388-4298-aee8-97cf83caf1ba
T-APP-ORPHEUS-01,poweredOn,"T-APP-ORPHEUS-01 9/6/2025, 13:00:24",,2025-06-09T18:00:39.324979+00:00,[FS1-P-ESX-VM-05] T-APP-ORPHEUS-01/T-APP-ORPHEUS-01-Snapshot3.vmem,7702.0,80306.5313501358,False,poweredOn,,OK,5006c9f6-f7ad-ef24-e08a-9d74b3bdce07,2025-12-19 16:03:43,USFQ,USFQ-PRODUCCION,p-esx-04.usfq.edu.ec,/USFQ/vm,Oracle Linux 9 (64-bit),Oracle Linux 9 (64-bit),vm-11203,4206ee32-c614-dd01-911c-3ac0c491754e,p-vc-01.usfq.edu.ec,b4509789-2388-4298-aee8-97cf83caf1ba
T-APP-ORPHEUS-01,poweredOn,"T-APP-ORPHEUS-01 HTTPD 1/7/2025, 9:53:32",,2025-07-01T14:53:49.015626+00:00,[FS1-P-ESX-VM-05] T-APP-ORPHEUS-01/T-APP-ORPHEUS-01-Snapshot9.vmem,7722.0,81351.53887081146,False,poweredOn,,OK,5006c9f6-f7ad-ef24-e08a-9d74b3bdce07,2025-12-19 16:03:43,USFQ,USFQ-PRODUCCION,p-esx-04.usfq.edu.ec,/USFQ/vm,Oracle Linux 9 (64-bit),Oracle Linux 9 (64-bit),vm-11203,4206ee32-c614-dd01-911c-3ac0c491754e,p-vc-01.usfq.edu.ec,b4509789-2388-4298-aee8-97cf83caf1ba
T-APP-ORPHEUS-01,poweredOn,"T-APP-ORPHEUS-01 16/7/2025, 14:55:38",,2025-07-16T19:55:50.397303+00:00,[FS1-P-ESX-VM-05] T-APP-ORPHEUS-01/T-APP-ORPHEUS-01-Snapshot12.vmem,7688.0,84632.58064079285,False,poweredOn,,OK,5006c9f6-f7ad-ef24-e08a-9d74b3bdce07,2025-12-19 16:03:43,USFQ,USFQ-PRODUCCION,p-esx-04.usfq.edu.ec,/USFQ/vm,Oracle Linux 9 (64-bit),Oracle Linux 9 (64-bit),vm-11203,4206ee32-c614-dd01-911c-3ac0c491754e,p-vc-01.usfq.edu.ec,b4509789-2388-4298-aee8-97cf83caf1ba
T-APP-ORPHEUS-01,poweredOn,"T-APP-ORPHEUS-01 16/7/2025, 17:29:25",,2025-07-16T22:29:42.759538+00:00,[FS1-P-ESX-VM-05] T-APP-ORPHEUS-01/T-APP-ORPHEUS-01-Snapshot13.vmem,7554.0,86821.53234291077,False,poweredOn,,OK,5006c9f6-f7ad-ef24-e08a-9d74b3bdce07,2025-12-19 16:03:43,USFQ,USFQ-PRODUCCION,p-esx-04.usfq.edu.ec,/USFQ/vm,Oracle Linux 9 (64-bit),Oracle Linux 9 (64-bit),vm-11203,4206ee32-c614-dd01-911c-3ac0c491754e,p-vc-01.usfq.edu.ec,b4509789-2388-4298-aee8-97cf83caf1ba
T-APP-ORPHEUS-01,poweredOn,"T-APP-ORPHEUS-01 5/8/2025, 11:06:34",,2025-08-05T16:06:41.486244+00:00,[FS1-P-ESX-VM-05] T-APP-ORPHEUS-01/T-APP-ORPHEUS-01-Snapshot20.vmem,7436.0,89479.5417175293,False,poweredOn,,OK,5006c9f6-f7ad-ef24-e08a-9d74b3bdce07,2025-12-19 16:03:43,USFQ,USFQ-PRODUCCION,p-esx-04.usfq.edu.ec,/USFQ/vm,Oracle Linux 9 (64-bit),Oracle Linux 9 (64-bit),vm-11203,4206ee32-c614-dd01-911c-3ac0c491754e,p-vc-01.usfq.edu.ec,b4509789-2388-4298-aee8-97cf83caf1ba
T-APP-ORPHEUS-01,poweredOn,"T-APP-ORPHEUS-01 13/9/2025, 1:22:14",,2025-09-13T06:22:21.399804+00:00,[FS1-P-ESX-VM-05] T-APP-ORPHEUS-01/T-APP-ORPHEUS-01-Snapshot27.vmem,7694.0,96633.54208564758,False,poweredOn,,OK,5006c9f6-f7ad-ef24-e08a-9d74b3bdce07,2025-12-19 16:03:43,USFQ,USFQ-PRODUCCION,p-esx-04.usfq.edu.ec,/USFQ/vm,Oracle Linux 9 (64-bit),Oracle Linux 9 (64-bit),vm-11203,4206ee32-c614-dd01-911c-3ac0c491754e,p-vc-01.usfq.edu.ec,b4509789-2388-4298-aee8-97cf83caf1ba
T-APP-LIB-01,poweredOn,"VM Snapshot 4/10/2025, 3:42:10 PM",,2025-04-10T20:42:11.467369+00:00,[FS1-P-ESX-VM-05] T-APP-LIB-01/T-APP-LIB-01-Snapshot1.vmem,4096.0,65547.51407814026,False,poweredOn,,OK,5006c559-ad71-c7c5-088d-6f97a4a31258,2025-12-19 16:03:15,USFQ,USFQ-PRODUCCION,p-esx-04.usfq.edu.ec,/USFQ/vm,Oracle Linux 9 (64-bit),Oracle Linux 9 (64-bit),vm-9059,42061960-81e7-8b25-c368-825b61edc0fe,p-vc-01.usfq.edu.ec,b4509789-2388-4298-aee8-97cf83caf1ba
P-QUALYS-02,poweredOn,P-QUALYS-02_vm-7009_1,Snapshot generated by VMware vSphere Lifecycle Manager at 2025-09-15 14:10:30.652 (Lifecycle Manager local time). Snapshot will not be automatically deleted.,2025-09-15T14:10:31.045310+00:00,[FS1-P-ESX-VM-03] P-QUALYS-02/P-QUALYS-02-Snapshot13.vmsn,0.02705860137939453,57344.027627944946,False,poweredOff,"Qualys Virtual Scanner Appliance - VMware vSphere vApp, build:qVSA.x86_64-3.10.89-2.vApp",OK,5006c1c2-539f-d02c-61b0-5973d9c5f75f,2025-12-06 22:10:56,USFQ,USFQ-PRODUCCION,p-esx-04.usfq.edu.ec,/USFQ/vm/SEGURIDAD-VM-PRODUCCION,Red Hat Enterprise Linux 7 (64-bit),Other Linux (64-bit),vm-7009,4206a35b-2b6b-83dc-65c0-829fdb244fe3,p-vc-01.usfq.edu.ec,b4509789-2388-4298-aee8-97cf83caf1ba
P-BAN9-BEPBRIM-01,poweredOn,"P-BAN9-BEPBRIM-01 3/11/2025, 12:22:13",,2025-11-03T17:22:18.822033+00:00,[FS1-P-ESX-VM-04] P-BAN9-BEPBRIM-01/P-BAN9-BEPBRIM-01-Snapshot44.vmem,16384.0,262151.5895996094,False,poweredOn,,OK,50063a01-4c90-b7b6-6462-4c90f55baeac,2025-12-10 01:04:44,USFQ,USFQ-PRODUCCION,p-esx-04.usfq.edu.ec,/USFQ/vm/INFRA-VM-PRODUCCION-BANNER,Oracle Linux 8 (64-bit),Oracle Linux 8 (64-bit),vm-3730,42068edb-1241-e6a5-c38d-50f77eb006d9,p-vc-01.usfq.edu.ec,b4509789-2388-4298-aee8-97cf83caf1ba
P-KOVM-CLC-01-CLON,poweredOn,"P-KOVM-CLC-01-CLON 28/11/2025, 19:48:50",,2025-11-29T00:48:56.683682+00:00,[FS1-P-ESX-VM-08] P-KOVM-CLC-01-CLON/P-KOVM-CLC-01-CLON-Snapshot1.vmem,24576.0,282901.42188835144,False,poweredOn,,OK,50064aeb-9879-534c-e44e-376c6bef7ae7,2025-12-23 02:08:22,USFQ,USFQ-PRODUCCION,p-esx-04.usfq.edu.ec,/USFQ/vm,Other 2.6.x Linux (64-bit),Oracle Linux 8 (64-bit),vm-16177,42061de5-e99f-04ae-e6c0-559980db876b,p-vc-01.usfq.edu.ec,b4509789-2388-4298-aee8-97cf83caf1ba
T-THALES-CTM-01,poweredOn,T-THALES-CTM-01_vm-9033_1,Snapshot generated by VMware vSphere Lifecycle Manager at 2025-09-15 14:12:40.577 (Lifecycle Manager local time). Snapshot will not be automatically deleted.,2025-09-15T14:12:42.840726+00:00,[FS1-P-ESX-VM-03] T-THALES-CTM-01/T-THALES-CTM-01-Snapshot3.vmsn,0.019163131713867188,61440.019735336304,True,poweredOff,,OK,50067120-4abd-36f7-3e43-e375bf995ec5,2025-05-22 13:46:18,USFQ,USFQ-PRODUCCION,p-esx-04.usfq.edu.ec,/USFQ/vm/SEGURIDAD-VM-TEST,Ubuntu Linux (64-bit),Ubuntu Linux (64-bit),vm-9033,420609a0-7bc5-5db1-f042-b6c1b6d2aaa8,p-vc-01.usfq.edu.ec,b4509789-2388-4298-aee8-97cf83caf1ba
P-NESSUS-01,poweredOn,P-NESSUS-01_vm-510_1,Snapshot generated by VMware vSphere Lifecycle Manager at 2024-11-17 03:55:57.911 (Lifecycle Manager local time). Snapshot will not be automatically deleted.,2024-11-17T03:56:00.521447+00:00,[FS1-P-ESX-VM-06] P-NESSUS-01/P-NESSUS-01-Snapshot2.vmsn,0.03547191619873047,102400.03603744507,False,poweredOff,,OK,503417a5-96d5-4c3a-7e8e-b51ecc65d044,2025-12-06 22:06:07,USFQ,USFQ-PRODUCCION,p-esx-04.usfq.edu.ec,/USFQ/vm,Ubuntu Linux (64-bit),Ubuntu Linux (64-bit),vm-510,4234ab0c-d0fd-4a67-7d42-8fca303d055c,p-vc-01.usfq.edu.ec,b4509789-2388-4298-aee8-97cf83caf1ba
P-ENGINE-GIZ-01,poweredOn,"P-ENGINE-GIZ-01-10 22/5/2025, 14:15:11",,2025-05-22T19:15:29.770796+00:00,[FS1-P-ESX-VM-04] P-ENGINE-GIZ-01-10/P-ENGINE-GIZ-01-10-Snapshot1.vmem,12288.0,36625.19840621948,False,poweredOn,,OK,50063d33-a993-418e-4458-2c5b32b83cb6,2025-12-19 16:04:41,USFQ,USFQ-PRODUCCION,p-esx-04.usfq.edu.ec,/USFQ/vm,Other 2.6.x Linux (64-bit),Oracle Linux 8 (64-bit),vm-10223,4206a461-79e7-d5fb-a50e-f1d43415a037,p-vc-01.usfq.edu.ec,b4509789-2388-4298-aee8-97cf83caf1ba
P-ZB-GRAFANA-01,poweredOn,P-ZB-GRAFANA-01_vm-531_1,Snapshot generated by VMware vSphere Lifecycle Manager at 2024-11-17 02:40:35.893 (Lifecycle Manager local time). Snapshot will not be automatically deleted.,2024-11-17T02:40:39.442551+00:00,[FS1-P-ESX-VM-02] P-ZB-GRAFANA-01/P-ZB-GRAFANA-01-Snapshot3.vmsn,0.27765750885009766,72712.27825546265,False,poweredOff,,OK,5034c0d4-d2ca-da58-7bef-f20bfb2e6c4b,2025-12-15 15:43:00,USFQ,USFQ-PRODUCCION,p-esx-04.usfq.edu.ec,/USFQ/vm/SEGURIDAD-VM-PRODUCCION,Other 2.6.x Linux (64-bit),Oracle Linux 8 (64-bit),vm-8074,4234b213-3440-d970-aeef-fdaae1bf7e90,p-vc-01.usfq.edu.ec,b4509789-2388-4298-aee8-97cf83caf1ba
P-ZB-GRAFANA-01,poweredOn,"VM Snapshot 5/12/2025, 3:18:35 PM",Pre-env implementation,2025-05-12T20:18:51.242686+00:00,[FS1-P-ESX-VM-02] P-ZB-GRAFANA-01/P-ZB-GRAFANA-01-Snapshot14.vmem,12288.0,99624.51354789734,False,poweredOn,,OK,5034c0d4-d2ca-da58-7bef-f20bfb2e6c4b,2025-12-15 15:43:00,USFQ,USFQ-PRODUCCION,p-esx-04.usfq.edu.ec,/USFQ/vm/SEGURIDAD-VM-PRODUCCION,Other 2.6.x Linux (64-bit),Oracle Linux 8 (64-bit),vm-8074,4234b213-3440-d970-aeef-fdaae1bf7e90,p-vc-01.usfq.edu.ec,b4509789-2388-4298-aee8-97cf83caf1ba
P-ZB-GRAFANA-01,poweredOn,"VM Snapshot 5/12/2025, 3:41:58 PM",Implements sourcing secrets from env file,2025-05-12T20:42:26.975733+00:00,[FS1-P-ESX-VM-02] P-ZB-GRAFANA-01/P-ZB-GRAFANA-01-Snapshot15.vmem,12288.0,99649.51395893097,False,poweredOn,,OK,5034c0d4-d2ca-da58-7bef-f20bfb2e6c4b,2025-12-15 15:43:00,USFQ,USFQ-PRODUCCION,p-esx-04.usfq.edu.ec,/USFQ/vm/SEGURIDAD-VM-PRODUCCION,Other 2.6.x Linux (64-bit),Oracle Linux 8 (64-bit),vm-8074,4234b213-3440-d970-aeef-fdaae1bf7e90,p-vc-01.usfq.edu.ec,b4509789-2388-4298-aee8-97cf83caf1ba
P-ZB-GRAFANA-01,poweredOn,"VM Snapshot 5/12/2025, 5:40:48 PM",Changes publication DNS and hardens security,2025-05-12T22:41:05.142049+00:00,[FS1-P-ESX-VM-02] P-ZB-GRAFANA-01/P-ZB-GRAFANA-01-Snapshot16.vmem,12288.0,99723.51423549652,False,poweredOn,,OK,5034c0d4-d2ca-da58-7bef-f20bfb2e6c4b,2025-12-15 15:43:00,USFQ,USFQ-PRODUCCION,p-esx-04.usfq.edu.ec,/USFQ/vm/SEGURIDAD-VM-PRODUCCION,Other 2.6.x Linux (64-bit),Oracle Linux 8 (64-bit),vm-8074,4234b213-3440-d970-aeef-fdaae1bf7e90,p-vc-01.usfq.edu.ec,b4509789-2388-4298-aee8-97cf83caf1ba
P-BAN9-BATCH-01,poweredOn,P-BAN9-BATCH-01_vm-3732_1,Snapshot generated by VMware vSphere Lifecycle Manager at 2024-10-24 16:46:45.283 (Lifecycle Manager local time). Snapshot will not be automatically deleted.,2024-10-24T16:46:47.376593+00:00,[FS1-P-ESX-VM-02] P-BAN9-BATCH-01/P-BAN9-BATCH-01-Snapshot1.vmsn,0.2818593978881836,307200.28288173676,True,poweredOff,,OK,50069a60-b221-9a57-f45d-282cb78efddc,2025-12-10 04:18:30,USFQ,USFQ-PRODUCCION,p-esx-04.usfq.edu.ec,/USFQ/vm/INFRA-VM-PRODUCCION-BANNER,Oracle Linux 8 (64-bit),Oracle Linux 8 (64-bit),vm-3732,42068928-62d1-cc0d-faf2-5064b42de985,p-vc-01.usfq.edu.ec,b4509789-2388-4298-aee8-97cf83caf1ba
P-BAN9-BATCH-01,poweredOn,"P-BAN9-BATCH-01 3/11/2025, 12:22:00",,2025-11-03T17:22:04.684738+00:00,[FS1-P-ESX-VM-02] P-BAN9-BATCH-01/P-BAN9-BATCH-01-Snapshot35.vmem,16384.0,457104.59589862823,False,poweredOn,,OK,50069a60-b221-9a57-f45d-282cb78efddc,2025-12-10 04:18:30,USFQ,USFQ-PRODUCCION,p-esx-04.usfq.edu.ec,/USFQ/vm/INFRA-VM-PRODUCCION-BANNER,Oracle Linux 8 (64-bit),Oracle Linux 8 (64-bit),vm-3732,42068928-62d1-cc0d-faf2-5064b42de985,p-vc-01.usfq.edu.ec,b4509789-2388-4298-aee8-97cf83caf1ba
P-BAN9-APP-03,poweredOn,P-BAN9-APP-03_vm-3726_1,Snapshot generated by VMware vSphere Lifecycle Manager at 2024-10-24 16:47:57.185 (Lifecycle Manager local time). Snapshot will not be automatically deleted.,2024-10-24T16:47:59.498800+00:00,[FS1-P-ESX-VM-03] P-BAN9-APP-03/P-BAN9-APP-03-Snapshot1.vmsn,0.28123950958251953,163840.28238105774,True,poweredOff,,OK,50067745-0027-e5df-18ae-7661c48240f0,2025-12-10 01:05:48,USFQ,USFQ-PRODUCCION,p-esx-04.usfq.edu.ec,/USFQ/vm/INFRA-VM-PRODUCCION-BANNER,Oracle Linux 8 (64-bit),Oracle Linux 8 (64-bit),vm-3726,4206159c-e572-a6c4-19f2-9ab58eeb3251,p-vc-01.usfq.edu.ec,b4509789-2388-4298-aee8-97cf83caf1ba
P-BAN9-APP-03,poweredOn,"P-BAN9-APP-03 3/11/2025, 12:21:26",,2025-11-03T17:21:31.586673+00:00,[FS1-P-ESX-VM-03] P-BAN9-APP-03/P-BAN9-APP-03-Snapshot35.vmem,16384.0,320510.56882476807,False,poweredOn,,OK,50067745-0027-e5df-18ae-7661c48240f0,2025-12-10 01:05:48,USFQ,USFQ-PRODUCCION,p-esx-04.usfq.edu.ec,/USFQ/vm/INFRA-VM-PRODUCCION-BANNER,Oracle Linux 8 (64-bit),Oracle Linux 8 (64-bit),vm-3726,4206159c-e572-a6c4-19f2-9ab58eeb3251,p-vc-01.usfq.edu.ec,b4509789-2388-4298-aee8-97cf83caf1ba
P-BAN9-ETHOS-01,poweredOn,P-BAN9-ETHOS-01_vm-3718_1,Snapshot generated by VMware vSphere Lifecycle Manager at 2024-10-24 16:47:21.838 (Lifecycle Manager local time). Snapshot will not be automatically deleted.,2024-10-24T16:47:24.098700+00:00,[FS1-P-ESX-VM-02] P-BAN9-ETHOS-01/P-BAN9-ETHOS-01-Snapshot1.vmsn,0.2825660705566406,163840.2837152481,True,poweredOff,,OK,50069bf8-d1af-5145-f484-250d66cee39a,2025-12-10 01:05:00,USFQ,USFQ-PRODUCCION,p-esx-04.usfq.edu.ec,/USFQ/vm/INFRA-VM-PRODUCCION-BANNER,Oracle Linux 8 (64-bit),Oracle Linux 8 (64-bit),vm-3718,4206c8fc-70ed-2b8b-5411-1889611998de,p-vc-01.usfq.edu.ec,b4509789-2388-4298-aee8-97cf83caf1ba
P-BAN9-ETHOS-01,poweredOn,"P-BAN9-ETHOS-01 1/9/2025, 17:32:59",,2025-09-01T22:33:07.088947+00:00,[FS1-P-ESX-VM-02] P-BAN9-ETHOS-01/P-BAN9-ETHOS-01-Snapshot31.vmem,16384.0,307755.60750198364,False,poweredOn,,OK,50069bf8-d1af-5145-f484-250d66cee39a,2025-12-10 01:05:00,USFQ,USFQ-PRODUCCION,p-esx-04.usfq.edu.ec,/USFQ/vm/INFRA-VM-PRODUCCION-BANNER,Oracle Linux 8 (64-bit),Oracle Linux 8 (64-bit),vm-3718,4206c8fc-70ed-2b8b-5411-1889611998de,p-vc-01.usfq.edu.ec,b4509789-2388-4298-aee8-97cf83caf1ba
P-BAN9-ETHOS-01,poweredOn,"P-BAN9-ETHOS-01 3/11/2025, 12:22:24",,2025-11-03T17:22:29.046657+00:00,[FS1-P-ESX-VM-02] P-BAN9-ETHOS-01/P-BAN9-ETHOS-01-Snapshot36.vmem,16384.0,346397.61153125763,False,poweredOn,,OK,50069bf8-d1af-5145-f484-250d66cee39a,2025-12-10 01:05:00,USFQ,USFQ-PRODUCCION,p-esx-04.usfq.edu.ec,/USFQ/vm/INFRA-VM-PRODUCCION-BANNER,Oracle Linux 8 (64-bit),Oracle Linux 8 (64-bit),vm-3718,4206c8fc-70ed-2b8b-5411-1889611998de,p-vc-01.usfq.edu.ec,b4509789-2388-4298-aee8-97cf83caf1ba
P-RADIUS-02,poweredOn,"Snapshot de máquina virtual 9/1/2025, 12:11:47 PM",,2025-09-01T17:11:49.667010+00:00,[FS1-P-ESX-VM-01] P-RADIUS-02/P-RADIUS-02-Snapshot24.vmem,16384.0,62469.32256984711,False,poweredOn,,OK,5034298d-7413-3d6f-ab24-99807cb1bd9d,2025-11-29 22:04:08,USFQ,USFQ-PRODUCCION,p-esx-04.usfq.edu.ec,/USFQ/vm/SEGURIDAD-VM-PRODUCCION,Ubuntu Linux (64-bit),Ubuntu Linux (64-bit),vm-1338,42342688-eacb-51ae-8501-47cdf5171af8,p-vc-01.usfq.edu.ec,b4509789-2388-4298-aee8-97cf83caf1ba
P-BIBREPO-OLNX-01,poweredOn,"P-BIPREPO-OLNX-01 17/11/2024, 05:20:43",,2024-11-17T10:20:52.610222+00:00,[FS1-P-ESX-VM-06] P-BIBREPO-OLNX-01/P-BIBREPO-OLNX-01-Snapshot40.vmem,8192.0,318526.2134542465,False,poweredOn,,OK,50349c2b-c09f-606e-807b-466d076cd75f,2025-12-05 02:09:32,USFQ,USFQ-PRODUCCION,p-esx-04.usfq.edu.ec,/USFQ/vm,Other 2.6.x Linux (64-bit),Oracle Linux 8 (64-bit),vm-8053,42342276-bbaa-d496-4625-f853a87f533a,p-vc-01.usfq.edu.ec,b4509789-2388-4298-aee8-97cf83caf1ba
P-BIBREPO-OLNX-01,poweredOn,"P-BIBREPO-OLNX-01 13/9/2025, 22:13:19",,2025-09-14T03:13:25.898271+00:00,[FS1-P-ESX-VM-06] P-BIBREPO-OLNX-01/P-BIBREPO-OLNX-01-Snapshot55.vmem,8192.0,514381.2515439987,False,poweredOn,,OK,50349c2b-c09f-606e-807b-466d076cd75f,2025-12-05 02:09:32,USFQ,USFQ-PRODUCCION,p-esx-04.usfq.edu.ec,/USFQ/vm,Other 2.6.x Linux (64-bit),Oracle Linux 8 (64-bit),vm-8053,42342276-bbaa-d496-4625-f853a87f533a,p-vc-01.usfq.edu.ec,b4509789-2388-4298-aee8-97cf83caf1ba
P-BIBREPO-OLNX-01,poweredOn,"P-BIBREPO-OLNX-01 26/10/2025, 21:32:24",,2025-10-27T02:32:29.810326+00:00,[FS1-P-ESX-VM-06] P-BIBREPO-OLNX-01/P-BIBREPO-OLNX-01-Snapshot57.vmem,8192.0,592785.2523403168,False,poweredOn,,OK,50349c2b-c09f-606e-807b-466d076cd75f,2025-12-05 02:09:32,USFQ,USFQ-PRODUCCION,p-esx-04.usfq.edu.ec,/USFQ/vm,Other 2.6.x Linux (64-bit),Oracle Linux 8 (64-bit),vm-8053,42342276-bbaa-d496-4625-f853a87f533a,p-vc-01.usfq.edu.ec,b4509789-2388-4298-aee8-97cf83caf1ba
P-BIBREPO-OLNX-01,poweredOn,"P-BIBREPO-OLNX-01 3/11/2025, 12:19:40",,2025-11-03T17:19:46.048763+00:00,[FS1-P-ESX-VM-06] P-BIBREPO-OLNX-01/P-BIBREPO-OLNX-01-Snapshot58.vmem,8192.0,624128.2535037994,False,poweredOn,,OK,50349c2b-c09f-606e-807b-466d076cd75f,2025-12-05 02:09:32,USFQ,USFQ-PRODUCCION,p-esx-04.usfq.edu.ec,/USFQ/vm,Other 2.6.x Linux (64-bit),Oracle Linux 8 (64-bit),vm-8053,42342276-bbaa-d496-4625-f853a87f533a,p-vc-01.usfq.edu.ec,b4509789-2388-4298-aee8-97cf83caf1ba
P-DB-GALERA-OL9-02,poweredOn,"P-DB-GALERA-OL9-02 22/3/2025, 17:39:16",,2025-03-22T22:39:20.946043+00:00,[FS1-P-ESX-VM-03] P-DB-GALERA-OL9-02/P-DB-GALERA-OL9-02-Snapshot13.vmem,8192.0,69639.58363437653,False,poweredOn,,OK,5006e27a-ee09-6ae9-4ce1-d9c569927778,2025-12-23 15:01:37,USFQ,USFQ-PRODUCCION,p-esx-04.usfq.edu.ec,/USFQ/vm,Oracle Linux 9 (64-bit),Oracle Linux 9 (64-bit),vm-8111,42061b30-b42a-95ea-ca9c-78b6bc7cc44c,p-vc-01.usfq.edu.ec,b4509789-2388-4298-aee8-97cf83caf1ba
P-DB-GALERA-OL9-02,poweredOn,"P-DB-GALERA-OL9-02 22/8/2025, 21:01:50",,2025-08-23T02:02:00.642690+00:00,[FS1-P-ESX-VM-03] P-DB-GALERA-OL9-02/P-DB-GALERA-OL9-02-Snapshot152.vmem,8192.0,100527.58301353455,False,poweredOn,,OK,5006e27a-ee09-6ae9-4ce1-d9c569927778,2025-12-23 15:01:37,USFQ,USFQ-PRODUCCION,p-esx-04.usfq.edu.ec,/USFQ/vm,Oracle Linux 9 (64-bit),Oracle Linux 9 (64-bit),vm-8111,42061b30-b42a-95ea-ca9c-78b6bc7cc44c,p-vc-01.usfq.edu.ec,b4509789-2388-4298-aee8-97cf83caf1ba
P-DB-GALERA-OL9-02,poweredOn,"P-DB-GALERA-OL9-02 25/10/2025, 21:33:58",,2025-10-26T02:34:08.072580+00:00,[FS1-P-ESX-VM-03] P-DB-GALERA-OL9-02/P-DB-GALERA-OL9-02-Snapshot209.vmem,8192.0,114637.58421325684,False,poweredOn,,OK,5006e27a-ee09-6ae9-4ce1-d9c569927778,2025-12-23 15:01:37,USFQ,USFQ-PRODUCCION,p-esx-04.usfq.edu.ec,/USFQ/vm,Oracle Linux 9 (64-bit),Oracle Linux 9 (64-bit),vm-8111,42061b30-b42a-95ea-ca9c-78b6bc7cc44c,p-vc-01.usfq.edu.ec,b4509789-2388-4298-aee8-97cf83caf1ba
P-DB-GALERA-OL9-03,poweredOn,"P-DB-GALERA-OL9-03 22/3/2025, 18:02:10",,2025-03-22T23:02:15.343337+00:00,[FS1-P-ESX-VM-06] P-DB-GALERA-OL9-03/P-DB-GALERA-OL9-03-Snapshot13.vmem,8192.0,69639.58345508575,False,poweredOn,,OK,5006f685-6343-70b0-07f7-9f7f3eb52760,2025-12-23 15:01:49,USFQ,USFQ-PRODUCCION,p-esx-04.usfq.edu.ec,/USFQ/vm,Oracle Linux 9 (64-bit),Oracle Linux 9 (64-bit),vm-7352,420605d8-5021-f2eb-0ee7-e7865fac5a3f,p-vc-01.usfq.edu.ec,b4509789-2388-4298-aee8-97cf83caf1ba
P-DB-GALERA-OL9-03,poweredOn,"P-DB-GALERA-OL9-03 22/8/2025, 21:02:04",,2025-08-23T02:02:12.684524+00:00,[FS1-P-ESX-VM-06] P-DB-GALERA-OL9-03/P-DB-GALERA-OL9-03-Snapshot182.vmem,8192.0,98921.58279418945,False,poweredOn,,OK,5006f685-6343-70b0-07f7-9f7f3eb52760,2025-12-23 15:01:49,USFQ,USFQ-PRODUCCION,p-esx-04.usfq.edu.ec,/USFQ/vm,Oracle Linux 9 (64-bit),Oracle Linux 9 (64-bit),vm-7352,420605d8-5021-f2eb-0ee7-e7865fac5a3f,p-vc-01.usfq.edu.ec,b4509789-2388-4298-aee8-97cf83caf1ba
P-DB-GALERA-OL9-03,poweredOn,"P-DB-GALERA-OL9-03 25/10/2025, 21:34:11",,2025-10-26T02:34:18.841385+00:00,[FS1-P-ESX-VM-06] P-DB-GALERA-OL9-03/P-DB-GALERA-OL9-03-Snapshot241.vmem,8192.0,115133.58419513702,False,poweredOn,,OK,5006f685-6343-70b0-07f7-9f7f3eb52760,2025-12-23 15:01:49,USFQ,USFQ-PRODUCCION,p-esx-04.usfq.edu.ec,/USFQ/vm,Oracle Linux 9 (64-bit),Oracle Linux 9 (64-bit),vm-7352,420605d8-5021-f2eb-0ee7-e7865fac5a3f,p-vc-01.usfq.edu.ec,b4509789-2388-4298-aee8-97cf83caf1ba
P-VC-01,poweredOn,"VM Snapshot 15/7/2025, 9:33:23",,2025-07-15T07:33:25.895279+00:00,[FS1-P-ESX-VM-05] P-VC-01/P-VC-01-Snapshot14.vmsn,21505.221133232117,146498.23108673096,False,poweredOn,VMware vCenter Server Appliance,OK,500fcfdc-e218-df89-a964-ab35579c4c90,2025-12-13 22:11:39,USFQ,USFQ-PRODUCCION,p-esx-02.usfq.edu.ec,/USFQ/vm/SEGURIDAD-VM-PRODUCCION,Other 3.x or later Linux (64-bit),VMware Photon OS (64-bit),vm-8103,420f5874-50bb-5069-8c0f-d4704f6a5a41,p-vc-01.usfq.edu.ec,b4509789-2388-4298-aee8-97cf83caf1ba
P-MOODLE-OL-03,poweredOn,"P-MOODLE-OL-03 18/11/2024, 01:42:25",,2024-11-18T06:42:28.681794+00:00,[FS1-P-ESX-VM-02] P-MOODLE-OL-03/P-MOODLE-OL-03-Snapshot4.vmem,32768.0,277641.24158000946,False,poweredOn,,OK,5034be36-ba82-7108-0894-ab20daf7407a,2025-12-11 01:01:44,USFQ,USFQ-PRODUCCION,p-esx-02.usfq.edu.ec,/USFQ/vm/SEGURIDAD-VM-PRODUCCION,CentOS 7 (64-bit),CentOS 7 (64-bit),vm-8026,42347f03-a164-85c1-9567-b53146c313ee,p-vc-01.usfq.edu.ec,b4509789-2388-4298-aee8-97cf83caf1ba
P-MOODLE-OL-03,poweredOn,"P-MOODLE-OL-03 22/3/2025, 18:20:00",,2025-03-22T23:20:07.151362+00:00,[FS1-P-ESX-VM-02] P-MOODLE-OL-03/P-MOODLE-OL-03-Snapshot9.vmem,32768.0,286229.24984550476,False,poweredOn,,OK,5034be36-ba82-7108-0894-ab20daf7407a,2025-12-11 01:01:44,USFQ,USFQ-PRODUCCION,p-esx-02.usfq.edu.ec,/USFQ/vm/SEGURIDAD-VM-PRODUCCION,CentOS 7 (64-bit),CentOS 7 (64-bit),vm-8026,42347f03-a164-85c1-9567-b53146c313ee,p-vc-01.usfq.edu.ec,b4509789-2388-4298-aee8-97cf83caf1ba
P-MOODLE-OL-03,poweredOn,"P-MOODLE-OL-03 14/9/2025, 4:44:58",,2025-09-14T09:45:07.338469+00:00,[FS1-P-ESX-VM-02] P-MOODLE-OL-03/P-MOODLE-OL-03-Snapshot18.vmem,32768.0,292012.25415992737,False,poweredOn,,OK,5034be36-ba82-7108-0894-ab20daf7407a,2025-12-11 01:01:44,USFQ,USFQ-PRODUCCION,p-esx-02.usfq.edu.ec,/USFQ/vm/SEGURIDAD-VM-PRODUCCION,CentOS 7 (64-bit),CentOS 7 (64-bit),vm-8026,42347f03-a164-85c1-9567-b53146c313ee,p-vc-01.usfq.edu.ec,b4509789-2388-4298-aee8-97cf83caf1ba
P-MOODLE-OL-03,poweredOn,"P-MOODLE-OL-03 26/10/2025, 23:10:04",,2025-10-27T04:10:10.745500+00:00,[FS1-P-ESX-VM-02] P-MOODLE-OL-03/P-MOODLE-OL-03-Snapshot20.vmem,32768.0,297090.25066185,False,poweredOn,,OK,5034be36-ba82-7108-0894-ab20daf7407a,2025-12-11 01:01:44,USFQ,USFQ-PRODUCCION,p-esx-02.usfq.edu.ec,/USFQ/vm/SEGURIDAD-VM-PRODUCCION,CentOS 7 (64-bit),CentOS 7 (64-bit),vm-8026,42347f03-a164-85c1-9567-b53146c313ee,p-vc-01.usfq.edu.ec,b4509789-2388-4298-aee8-97cf83caf1ba
P-BAN9-APP-05,poweredOn,P-BAN9-APP-05_vm-3728_1,Snapshot generated by VMware vSphere Lifecycle Manager at 2024-10-24 16:46:26.157 (Lifecycle Manager local time). Snapshot will not be automatically deleted.,2024-10-24T16:46:28.377704+00:00,[FS1-P-ESX-VM-05] P-BAN9-APP-05/P-BAN9-APP-05-Snapshot1.vmsn,0.2812061309814453,163840.28234767914,True,poweredOff,,OK,50069afc-5f05-78cf-3a1d-d49d0787d3ce,2025-12-10 01:03:28,USFQ,USFQ-PRODUCCION,p-esx-02.usfq.edu.ec,/USFQ/vm,Oracle Linux 8 (64-bit),Oracle Linux 8 (64-bit),vm-8088,4206a7b7-f27d-4cc2-3e2c-605ae6e79335,p-vc-01.usfq.edu.ec,b4509789-2388-4298-aee8-97cf83caf1ba
P-BAN9-APP-05,poweredOn,"P-BAN9-APP-05 3/11/2025, 12:21:47",,2025-11-03T17:21:53.309327+00:00,[FS1-P-ESX-VM-05] P-BAN9-APP-05/P-BAN9-APP-05-Snapshot36.vmem,16384.0,306568.5656051636,False,poweredOn,,OK,50069afc-5f05-78cf-3a1d-d49d0787d3ce,2025-12-10 01:03:28,USFQ,USFQ-PRODUCCION,p-esx-02.usfq.edu.ec,/USFQ/vm,Oracle Linux 8 (64-bit),Oracle Linux 8 (64-bit),vm-8088,4206a7b7-f27d-4cc2-3e2c-605ae6e79335,p-vc-01.usfq.edu.ec,b4509789-2388-4298-aee8-97cf83caf1ba
P-IMP-DBF-01,poweredOn,P-IMP-DBF-01_vm-8062_1,Snapshot generated by VMware vSphere Lifecycle Manager at 2025-08-01 15:39:50.749 (Lifecycle Manager local time). Snapshot will not be automatically deleted.,2025-08-01T15:39:53.126711+00:00,[FS1-P-ESX-VM-03] P-IMP-DBF-01/P-IMP-DBF-01-Snapshot32.vmsn,0.02060413360595703,545719.0217933655,False,poweredOff,,OK,50340a4a-4540-9d1a-c993-957f935b5949,2025-12-20 06:20:11,USFQ,USFQ-PRODUCCION,p-esx-02.usfq.edu.ec,/USFQ/vm/SEGURIDAD-VM-PRODUCCION,Red Hat Enterprise Linux 6 (64-bit),Other 3.x Linux (64-bit),vm-8062,42343d77-0841-b858-a618-d9fe5c72cbc1,p-vc-01.usfq.edu.ec,b4509789-2388-4298-aee8-97cf83caf1ba
P-MINEMELDPA-01,poweredOn,P-MINEMELDPA-01_vm-498_1,Snapshot generated by VMware vSphere Lifecycle Manager at 2024-11-19 13:57:10.620 (Lifecycle Manager local time). Snapshot will not be automatically deleted.,2024-11-19T13:57:15.292981+00:00,[FS1-P-ESX-VM-06] P-MINEMELDPA-01/P-MINEMELDPA-01-Snapshot2.vmsn,0.019926071166992188,21247.020524024963,False,poweredOff,,OK,5034c88c-415b-057e-57e9-bfa586bb5053,2025-12-06 22:03:03,USFQ,USFQ-PRODUCCION,p-esx-02.usfq.edu.ec,/USFQ/vm/SEGURIDAD-VM-PRODUCCION,Other 2.6.x Linux (64-bit),Oracle Linux 8 (64-bit),vm-8035,4234f950-35d8-3012-5ab0-db8a6d5e3e6f,p-vc-01.usfq.edu.ec,b4509789-2388-4298-aee8-97cf83caf1ba
P-DB-GALERA-OL9-01,poweredOn,"P-DB-GALERA-OL9-01 22/3/2025, 15:20:34",,2025-03-22T20:20:40.167536+00:00,[FS1-P-ESX-VM-03] P-DB-GALERA-OL9-01/P-DB-GALERA-OL9-01-Snapshot14.vmem,8192.0,69639.58136081696,False,poweredOn,,OK,500694b4-a643-ceb7-c632-dc0e37d74576,2025-12-23 15:01:40,USFQ,USFQ-PRODUCCION,p-esx-02.usfq.edu.ec,/USFQ/vm,Oracle Linux 9 (64-bit),Oracle Linux 9 (64-bit),vm-8090,4206b465-aa07-99d6-72dc-ebac45e67101,p-vc-01.usfq.edu.ec,b4509789-2388-4298-aee8-97cf83caf1ba
P-DB-GALERA-OL9-01,poweredOn,"P-DB-GALERA-OL9-01 22/8/2025, 21:01:35",,2025-08-23T02:01:45.309679+00:00,[FS1-P-ESX-VM-03] P-DB-GALERA-OL9-01/P-DB-GALERA-OL9-01-Snapshot155.vmem,8192.0,103178.58231830597,False,poweredOn,,OK,500694b4-a643-ceb7-c632-dc0e37d74576,2025-12-23 15:01:40,USFQ,USFQ-PRODUCCION,p-esx-02.usfq.edu.ec,/USFQ/vm,Oracle Linux 9 (64-bit),Oracle Linux 9 (64-bit),vm-8090,4206b465-aa07-99d6-72dc-ebac45e67101,p-vc-01.usfq.edu.ec,b4509789-2388-4298-aee8-97cf83caf1ba
P-DB-GALERA-OL9-01,poweredOn,"P-DB-GALERA-OL9-01 25/10/2025, 21:33:39",,2025-10-26T02:33:48.778277+00:00,[FS1-P-ESX-VM-03] P-DB-GALERA-OL9-01/P-DB-GALERA-OL9-01-Snapshot210.vmem,8192.0,122447.58403968811,False,poweredOn,,OK,500694b4-a643-ceb7-c632-dc0e37d74576,2025-12-23 15:01:40,USFQ,USFQ-PRODUCCION,p-esx-02.usfq.edu.ec,/USFQ/vm,Oracle Linux 9 (64-bit),Oracle Linux 9 (64-bit),vm-8090,4206b465-aa07-99d6-72dc-ebac45e67101,p-vc-01.usfq.edu.ec,b4509789-2388-4298-aee8-97cf83caf1ba
P-DB-GALERA-OL9-01,poweredOn,"P-DB-GALERA-OL9-01 3/11/2025, 12:19:57",,2025-11-03T17:20:03.116171+00:00,[FS1-P-ESX-VM-03] P-DB-GALERA-OL9-01/P-DB-GALERA-OL9-01-Snapshot219.vmem,8192.0,129186.58462524414,False,poweredOn,,OK,500694b4-a643-ceb7-c632-dc0e37d74576,2025-12-23 15:01:40,USFQ,USFQ-PRODUCCION,p-esx-02.usfq.edu.ec,/USFQ/vm,Oracle Linux 9 (64-bit),Oracle Linux 9 (64-bit),vm-8090,4206b465-aa07-99d6-72dc-ebac45e67101,p-vc-01.usfq.edu.ec,b4509789-2388-4298-aee8-97cf83caf1ba
P-APP-PASEC-OLN-01,poweredOn,"P-APP-PASEC-OLN-01 3/8/2025, 0:48:49",,2025-08-03T05:48:54.954437+00:00,[FS1-P-ESX-VM-01] P-APP-PASEC-OLN-01/P-APP-PASEC-OLN-01-Snapshot56.vmem,4096.0,65543.54656887054,False,poweredOn,,OK,50344691-b065-308c-9774-dad440728f33,2025-12-19 16:03:26,USFQ,USFQ-PRODUCCION,p-esx-02.usfq.edu.ec,/USFQ/vm,Oracle Linux 8 (64-bit),Oracle Linux 8 (64-bit),vm-8039,42346642-bb33-a022-d534-3acfe74d6527,p-vc-01.usfq.edu.ec,b4509789-2388-4298-aee8-97cf83caf1ba
P-APP-PASEC-OLN-01,poweredOn,"P-APP-PASEC-OLN-01 13/9/2025, 3:46:25",,2025-09-13T08:46:30.771166+00:00,[FS1-P-ESX-VM-01] P-APP-PASEC-OLN-01/P-APP-PASEC-OLN-01-Snapshot63.vmem,4096.0,79637.5468120575,False,poweredOn,,OK,50344691-b065-308c-9774-dad440728f33,2025-12-19 16:03:26,USFQ,USFQ-PRODUCCION,p-esx-02.usfq.edu.ec,/USFQ/vm,Oracle Linux 8 (64-bit),Oracle Linux 8 (64-bit),vm-8039,42346642-bb33-a022-d534-3acfe74d6527,p-vc-01.usfq.edu.ec,b4509789-2388-4298-aee8-97cf83caf1ba
P-APP-PASEC-OLN-01,poweredOn,"P-APP-PASEC-OLN-01 25/10/2025, 22:35:05",,2025-10-26T03:35:11.311547+00:00,[FS1-P-ESX-VM-01] P-APP-PASEC-OLN-01/P-APP-PASEC-OLN-01-Snapshot70.vmem,4096.0,93556.54724502563,False,poweredOn,,OK,50344691-b065-308c-9774-dad440728f33,2025-12-19 16:03:26,USFQ,USFQ-PRODUCCION,p-esx-02.usfq.edu.ec,/USFQ/vm,Oracle Linux 8 (64-bit),Oracle Linux 8 (64-bit),vm-8039,42346642-bb33-a022-d534-3acfe74d6527,p-vc-01.usfq.edu.ec,b4509789-2388-4298-aee8-97cf83caf1ba
P-APP-PASEC-OLN-01,poweredOn,"P-APP-PASEC-OLN-01 3/11/2025, 11:56:24",,2025-11-03T16:56:31.021868+00:00,[FS1-P-ESX-VM-01] P-APP-PASEC-OLN-01/P-APP-PASEC-OLN-01-Snapshot72.vmem,4096.0,99490.54766464233,False,poweredOn,,OK,50344691-b065-308c-9774-dad440728f33,2025-12-19 16:03:26,USFQ,USFQ-PRODUCCION,p-esx-02.usfq.edu.ec,/USFQ/vm,Oracle Linux 8 (64-bit),Oracle Linux 8 (64-bit),vm-8039,42346642-bb33-a022-d534-3acfe74d6527,p-vc-01.usfq.edu.ec,b4509789-2388-4298-aee8-97cf83caf1ba
P-APP-PASEC-OLN-01,poweredOn,"P-APP-PASEC-OLN-01 3/11/2025, 12:22:59",,2025-11-03T17:23:03.704633+00:00,[FS1-P-ESX-VM-01] P-APP-PASEC-OLN-01/P-APP-PASEC-OLN-01-Snapshot73.vmem,4096.0,99548.54808425903,False,poweredOn,,OK,50344691-b065-308c-9774-dad440728f33,2025-12-19 16:03:26,USFQ,USFQ-PRODUCCION,p-esx-02.usfq.edu.ec,/USFQ/vm,Oracle Linux 8 (64-bit),Oracle Linux 8 (64-bit),vm-8039,42346642-bb33-a022-d534-3acfe74d6527,p-vc-01.usfq.edu.ec,b4509789-2388-4298-aee8-97cf83caf1ba
P-APP-REDCAP-OLN-01,poweredOn,"P-APP-REDCAP-OLN-01 23/3/2025, 10:59:22",,2025-03-23T15:59:29.890058+00:00,[FS1-P-ESX-VM-02] P-APP-REDCAP-OLN-01/P-APP-REDCAP-OLN-01-Snapshot59.vmem,4096.0,106503.61529922485,False,poweredOn,,OK,5034cfa2-b6dd-0855-e55d-9ee1689ffe32,2025-12-19 16:03:45,USFQ,USFQ-PRODUCCION,p-esx-02.usfq.edu.ec,/USFQ/vm,Oracle Linux 8 (64-bit),Oracle Linux 8 (64-bit),vm-8057,42347d24-890b-44ec-c338-97eea492b889,p-vc-01.usfq.edu.ec,b4509789-2388-4298-aee8-97cf83caf1ba
P-APP-REDCAP-OLN-01,poweredOn,"P-APP-REDCAP-OLN-01 3/8/2025, 1:02:23",,2025-08-03T06:02:28.819674+00:00,[FS1-P-ESX-VM-02] P-APP-REDCAP-OLN-01/P-APP-REDCAP-OLN-01-Snapshot84.vmem,4096.0,129123.52837753296,False,poweredOn,,OK,5034cfa2-b6dd-0855-e55d-9ee1689ffe32,2025-12-19 16:03:45,USFQ,USFQ-PRODUCCION,p-esx-02.usfq.edu.ec,/USFQ/vm,Oracle Linux 8 (64-bit),Oracle Linux 8 (64-bit),vm-8057,42347d24-890b-44ec-c338-97eea492b889,p-vc-01.usfq.edu.ec,b4509789-2388-4298-aee8-97cf83caf1ba
P-APP-REDCAP-OLN-01,poweredOn,"P-APP-REDCAP-OLN-01 13/9/2025, 4:32:39",,2025-09-13T09:32:45.839119+00:00,[FS1-P-ESX-VM-02] P-APP-REDCAP-OLN-01/P-APP-REDCAP-OLN-01-Snapshot91.vmem,4096.0,149591.5287027359,False,poweredOn,,OK,5034cfa2-b6dd-0855-e55d-9ee1689ffe32,2025-12-19 16:03:45,USFQ,USFQ-PRODUCCION,p-esx-02.usfq.edu.ec,/USFQ/vm,Oracle Linux 8 (64-bit),Oracle Linux 8 (64-bit),vm-8057,42347d24-890b-44ec-c338-97eea492b889,p-vc-01.usfq.edu.ec,b4509789-2388-4298-aee8-97cf83caf1ba
P-APP-REDCAP-OLN-01,poweredOn,"P-APP-REDCAP-OLN-01 25/10/2025, 22:35:19",,2025-10-26T03:35:26.576828+00:00,[FS1-P-ESX-VM-02] P-APP-REDCAP-OLN-01/P-APP-REDCAP-OLN-01-Snapshot98.vmem,4096.0,168088.52912521362,False,poweredOn,,OK,5034cfa2-b6dd-0855-e55d-9ee1689ffe32,2025-12-19 16:03:45,USFQ,USFQ-PRODUCCION,p-esx-02.usfq.edu.ec,/USFQ/vm,Oracle Linux 8 (64-bit),Oracle Linux 8 (64-bit),vm-8057,42347d24-890b-44ec-c338-97eea492b889,p-vc-01.usfq.edu.ec,b4509789-2388-4298-aee8-97cf83caf1ba
P-APP-REDCAP-OLN-01,poweredOn,"P-APP-REDCAP-OLN-01 3/11/2025, 11:56:13",,2025-11-03T16:56:19.589737+00:00,[FS1-P-ESX-VM-02] P-APP-REDCAP-OLN-01/P-APP-REDCAP-OLN-01-Snapshot100.vmem,4096.0,175569.52954769135,False,poweredOn,,OK,5034cfa2-b6dd-0855-e55d-9ee1689ffe32,2025-12-19 16:03:45,USFQ,USFQ-PRODUCCION,p-esx-02.usfq.edu.ec,/USFQ/vm,Oracle Linux 8 (64-bit),Oracle Linux 8 (64-bit),vm-8057,42347d24-890b-44ec-c338-97eea492b889,p-vc-01.usfq.edu.ec,b4509789-2388-4298-aee8-97cf83caf1ba
P-APP-REDCAP-OLN-01,poweredOn,"P-APP-REDCAP-OLN-01 24/11/2025, 14:23:19",,2025-11-24T19:23:25.279103+00:00,[FS1-P-ESX-VM-02] P-APP-REDCAP-OLN-01/P-APP-REDCAP-OLN-01-Snapshot110.vmem,4096.0,189154.52998447418,False,poweredOn,,OK,5034cfa2-b6dd-0855-e55d-9ee1689ffe32,2025-12-19 16:03:45,USFQ,USFQ-PRODUCCION,p-esx-02.usfq.edu.ec,/USFQ/vm,Oracle Linux 8 (64-bit),Oracle Linux 8 (64-bit),vm-8057,42347d24-890b-44ec-c338-97eea492b889,p-vc-01.usfq.edu.ec,b4509789-2388-4298-aee8-97cf83caf1ba
P-GITLAB-OLNX-01,poweredOn,P-GITLAB-OLNX-01_vm-1311_1,Snapshot generated by VMware vSphere Lifecycle Manager at 2024-11-17 03:44:59.985 (Lifecycle Manager local time). Snapshot will not be automatically deleted.,2024-11-17T03:45:03.457798+00:00,[FS1-P-ESX-VM-05] P-GITLAB-OLNX-01/P-GITLAB-OLNX-01-Snapshot120.vmsn,0.027968406677246094,46146.02856826782,False,poweredOff,,OK,503464cc-19a5-e730-6ab6-0d66b3591375,2025-12-23 01:02:57,USFQ,USFQ-PRODUCCION,p-esx-02.usfq.edu.ec,/USFQ/vm/Discovered virtual machine,CentOS 4/5 (64-bit),CentOS 7 (64-bit),vm-1311,42349bc8-3ece-807e-377d-c28bafe293cf,p-vc-01.usfq.edu.ec,b4509789-2388-4298-aee8-97cf83caf1ba
P-GITLAB-OLNX-01,poweredOn,"P-GITLAB-OLNX-01 17/11/2024, 22:45:28",,2024-11-18T03:45:37.011762+00:00,[FS1-P-ESX-VM-05] P-GITLAB-OLNX-01/P-GITLAB-OLNX-01-Snapshot121.vmem,7950.0,59700.14620780945,False,poweredOn,,OK,503464cc-19a5-e730-6ab6-0d66b3591375,2025-12-23 01:02:57,USFQ,USFQ-PRODUCCION,p-esx-02.usfq.edu.ec,/USFQ/vm/Discovered virtual machine,CentOS 4/5 (64-bit),CentOS 7 (64-bit),vm-1311,42349bc8-3ece-807e-377d-c28bafe293cf,p-vc-01.usfq.edu.ec,b4509789-2388-4298-aee8-97cf83caf1ba
P-GITLAB-OLNX-01,poweredOn,"P-GITLAB-OLNX-01 10/3/2025, 11:58:25",,2025-03-10T16:58:38.250383+00:00,[FS1-P-ESX-VM-05] P-GITLAB-OLNX-01/P-GITLAB-OLNX-01-Snapshot142.vmem,7974.0,81115.14469718933,False,poweredOn,,OK,503464cc-19a5-e730-6ab6-0d66b3591375,2025-12-23 01:02:57,USFQ,USFQ-PRODUCCION,p-esx-02.usfq.edu.ec,/USFQ/vm/Discovered virtual machine,CentOS 4/5 (64-bit),CentOS 7 (64-bit),vm-1311,42349bc8-3ece-807e-377d-c28bafe293cf,p-vc-01.usfq.edu.ec,b4509789-2388-4298-aee8-97cf83caf1ba
P-GITLAB-OLNX-01,poweredOn,"P-GITLAB-OLNX-01 3/8/2025, 3:07:30",,2025-08-03T08:07:37.418540+00:00,[FS1-P-ESX-VM-05] P-GITLAB-OLNX-01/P-GITLAB-OLNX-01-Snapshot168.vmem,7972.0,102771.14890003204,False,poweredOn,,OK,503464cc-19a5-e730-6ab6-0d66b3591375,2025-12-23 01:02:57,USFQ,USFQ-PRODUCCION,p-esx-02.usfq.edu.ec,/USFQ/vm/Discovered virtual machine,CentOS 4/5 (64-bit),CentOS 7 (64-bit),vm-1311,42349bc8-3ece-807e-377d-c28bafe293cf,p-vc-01.usfq.edu.ec,b4509789-2388-4298-aee8-97cf83caf1ba
P-GITLAB-OLNX-01,poweredOn,"P-GITLAB-OLNX-01 3/8/2025, 3:22:00",,2025-08-03T08:22:06.407489+00:00,[FS1-P-ESX-VM-05] P-GITLAB-OLNX-01/P-GITLAB-OLNX-01-Snapshot169.vmem,7972.0,102966.1493396759,False,poweredOn,,OK,503464cc-19a5-e730-6ab6-0d66b3591375,2025-12-23 01:02:57,USFQ,USFQ-PRODUCCION,p-esx-02.usfq.edu.ec,/USFQ/vm/Discovered virtual machine,CentOS 4/5 (64-bit),CentOS 7 (64-bit),vm-1311,42349bc8-3ece-807e-377d-c28bafe293cf,p-vc-01.usfq.edu.ec,b4509789-2388-4298-aee8-97cf83caf1ba
P-GITLAB-OLNX-01,poweredOn,"P-GITLAB-OLNX-01 23/9/2025, 20:03:49",,2025-09-24T01:03:56.300597+00:00,[FS1-P-ESX-VM-05] P-GITLAB-OLNX-01/P-GITLAB-OLNX-01-Snapshot178.vmem,7972.0,119613.14977931976,False,poweredOn,,OK,503464cc-19a5-e730-6ab6-0d66b3591375,2025-12-23 01:02:57,USFQ,USFQ-PRODUCCION,p-esx-02.usfq.edu.ec,/USFQ/vm/Discovered virtual machine,CentOS 4/5 (64-bit),CentOS 7 (64-bit),vm-1311,42349bc8-3ece-807e-377d-c28bafe293cf,p-vc-01.usfq.edu.ec,b4509789-2388-4298-aee8-97cf83caf1ba
P-GITLAB-OLNX-01,poweredOn,"P-GITLAB-OLNX-01 26/10/2025, 22:33:36",,2025-10-27T03:33:42.921541+00:00,[FS1-P-ESX-VM-05] P-GITLAB-OLNX-01/P-GITLAB-OLNX-01-Snapshot183.vmem,8192.0,131264.13847446442,False,poweredOn,,OK,503464cc-19a5-e730-6ab6-0d66b3591375,2025-12-23 01:02:57,USFQ,USFQ-PRODUCCION,p-esx-02.usfq.edu.ec,/USFQ/vm/Discovered virtual machine,CentOS 4/5 (64-bit),CentOS 7 (64-bit),vm-1311,42349bc8-3ece-807e-377d-c28bafe293cf,p-vc-01.usfq.edu.ec,b4509789-2388-4298-aee8-97cf83caf1ba
P-GITLAB-OLNX-01,poweredOn,"P-GITLAB-OLNX-01 3/11/2025, 11:58:50",,2025-11-03T16:58:55.427902+00:00,[FS1-P-ESX-VM-05] P-GITLAB-OLNX-01/P-GITLAB-OLNX-01-Snapshot185.vmem,8192.0,141995.13888835907,False,poweredOn,,OK,503464cc-19a5-e730-6ab6-0d66b3591375,2025-12-23 01:02:57,USFQ,USFQ-PRODUCCION,p-esx-02.usfq.edu.ec,/USFQ/vm/Discovered virtual machine,CentOS 4/5 (64-bit),CentOS 7 (64-bit),vm-1311,42349bc8-3ece-807e-377d-c28bafe293cf,p-vc-01.usfq.edu.ec,b4509789-2388-4298-aee8-97cf83caf1ba
P-GEOCENTRO-OLNX-01,poweredOn,"P-GEOCENTRO-OLNX-01 17/11/2024, 21:10:31",,2024-11-18T02:10:39.634768+00:00,[FS1-P-ESX-VM-05] P-GEOCENTRO-OLNX-01/P-GEOCENTRO-OLNX-01-Snapshot12.vmem,9446.0,45334.151101112366,False,poweredOn,,OK,5034c0d7-39ab-1ed7-b638-4d82ed275b9c,2025-12-09 20:01:59,USFQ,USFQ-PRODUCCION,p-esx-02.usfq.edu.ec,/USFQ/vm,Other 2.6.x Linux (64-bit),Oracle Linux 8 (64-bit),vm-490,4234110d-5aea-ff7b-db23-5b02e76c1cac,p-vc-01.usfq.edu.ec,b4509789-2388-4298-aee8-97cf83caf1ba
P-GEOCENTRO-OLNX-01,poweredOn,"P-GEOCENTRO-OLNX-01 23/3/2025, 10:58:51",,2025-03-23T15:58:57.100541+00:00,[FS1-P-ESX-VM-05] P-GEOCENTRO-OLNX-01/P-GEOCENTRO-OLNX-01-Snapshot17.vmem,11902.0,68825.19279289246,False,poweredOn,,OK,5034c0d7-39ab-1ed7-b638-4d82ed275b9c,2025-12-09 20:01:59,USFQ,USFQ-PRODUCCION,p-esx-02.usfq.edu.ec,/USFQ/vm,Other 2.6.x Linux (64-bit),Oracle Linux 8 (64-bit),vm-490,4234110d-5aea-ff7b-db23-5b02e76c1cac,p-vc-01.usfq.edu.ec,b4509789-2388-4298-aee8-97cf83caf1ba
P-GEOCENTRO-OLNX-01,poweredOn,"P-GEOCENTRO-OLNX-01 3/8/2025, 3:06:05",,2025-08-03T08:06:11.398067+00:00,[FS1-P-ESX-VM-05] P-GEOCENTRO-OLNX-01/P-GEOCENTRO-OLNX-01-Snapshot22.vmem,11922.0,89190.19233894348,False,poweredOn,,OK,5034c0d7-39ab-1ed7-b638-4d82ed275b9c,2025-12-09 20:01:59,USFQ,USFQ-PRODUCCION,p-esx-02.usfq.edu.ec,/USFQ/vm,Other 2.6.x Linux (64-bit),Oracle Linux 8 (64-bit),vm-490,4234110d-5aea-ff7b-db23-5b02e76c1cac,p-vc-01.usfq.edu.ec,b4509789-2388-4298-aee8-97cf83caf1ba
P-GEOCENTRO-OLNX-01,poweredOn,"P-GEOCENTRO-OLNX-01 14/9/2025, 2:48:51",,2025-09-14T07:48:56.483610+00:00,[FS1-P-ESX-VM-05] P-GEOCENTRO-OLNX-01/P-GEOCENTRO-OLNX-01-Snapshot25.vmem,11954.0,106105.19282341003,False,poweredOn,,OK,5034c0d7-39ab-1ed7-b638-4d82ed275b9c,2025-12-09 20:01:59,USFQ,USFQ-PRODUCCION,p-esx-02.usfq.edu.ec,/USFQ/vm,Other 2.6.x Linux (64-bit),Oracle Linux 8 (64-bit),vm-490,4234110d-5aea-ff7b-db23-5b02e76c1cac,p-vc-01.usfq.edu.ec,b4509789-2388-4298-aee8-97cf83caf1ba
P-GEOCENTRO-OLNX-01,poweredOn,"P-GEOCENTRO-OLNX-01 26/10/2025, 22:10:51",,2025-10-27T03:10:59.382570+00:00,[FS1-P-ESX-VM-05] P-GEOCENTRO-OLNX-01/P-GEOCENTRO-OLNX-01-Snapshot27.vmem,12288.0,121312.1932811737,False,poweredOn,,OK,5034c0d7-39ab-1ed7-b638-4d82ed275b9c,2025-12-09 20:01:59,USFQ,USFQ-PRODUCCION,p-esx-02.usfq.edu.ec,/USFQ/vm,Other 2.6.x Linux (64-bit),Oracle Linux 8 (64-bit),vm-490,4234110d-5aea-ff7b-db23-5b02e76c1cac,p-vc-01.usfq.edu.ec,b4509789-2388-4298-aee8-97cf83caf1ba
P-GEOCENTRO-OLNX-01,poweredOn,"P-GEOCENTRO-OLNX-01 3/11/2025, 12:23:31",,2025-11-03T17:23:37.253494+00:00,[FS1-P-ESX-VM-05] P-GEOCENTRO-OLNX-01/P-GEOCENTRO-OLNX-01-Snapshot28.vmem,12288.0,127647.19379043579,False,poweredOn,,OK,5034c0d7-39ab-1ed7-b638-4d82ed275b9c,2025-12-09 20:01:59,USFQ,USFQ-PRODUCCION,p-esx-02.usfq.edu.ec,/USFQ/vm,Other 2.6.x Linux (64-bit),Oracle Linux 8 (64-bit),vm-490,4234110d-5aea-ff7b-db23-5b02e76c1cac,p-vc-01.usfq.edu.ec,b4509789-2388-4298-aee8-97cf83caf1ba
P-IMP-MX-DBF-01,poweredOn,"Snapshot de máquina virtual 31/3/2025, 11:13:15",,2025-03-31T16:13:17.685150+00:00,[FS1-P-ESX-VM-04] P-IMP-MX-DBF-01/P-IMP-MX-DBF-01-Snapshot28.vmsn,24589.048545837402,165098.04914569855,False,poweredOn,,OK,50345801-6143-7cba-120c-13b2522f7d83,2025-12-23 02:02:57,USFQ,USFQ-PRODUCCION,p-esx-02.usfq.edu.ec,/USFQ/vm/SEGURIDAD-VM-PRODUCCION,Red Hat Enterprise Linux 7 (64-bit),Other 3.x Linux (64-bit),vm-1309,4234fa28-5a79-ae96-6353-082316ed465d,p-vc-01.usfq.edu.ec,b4509789-2388-4298-aee8-97cf83caf1ba
P-IMP-MX-DBF-01,poweredOn,"Snapshot de máquina virtual 8/22/2025, 9:22:16 AM",,2025-08-22T14:22:20.339647+00:00,[FS1-P-ESX-VM-04] P-IMP-MX-DBF-01/P-IMP-MX-DBF-01-Snapshot218.vmem,24576.0,245055.23465251923,False,poweredOn,,OK,50345801-6143-7cba-120c-13b2522f7d83,2025-12-23 02:02:57,USFQ,USFQ-PRODUCCION,p-esx-02.usfq.edu.ec,/USFQ/vm/SEGURIDAD-VM-PRODUCCION,Red Hat Enterprise Linux 7 (64-bit),Other 3.x Linux (64-bit),vm-1309,4234fa28-5a79-ae96-6353-082316ed465d,p-vc-01.usfq.edu.ec,b4509789-2388-4298-aee8-97cf83caf1ba
P-GI-01,poweredOn,"VM Snapshot 12/13/2025, 8:31:15 AM",,2025-12-13T13:31:19.729447+00:00,[FS1-P-ESX-VM-08] P-GI-01/P-GI-01-Snapshot51.vmem,24576.0,1073161.5945987701,False,poweredOn,,OK,50349907-09c2-18c0-0c6d-31b8f4769afc,2025-12-12 14:48:36,USFQ,USFQ-PRODUCCION,p-esx-02.usfq.edu.ec,/USFQ/vm/SEGURIDAD-VM-PRODUCCION,Red Hat Enterprise Linux 8 (64-bit),Red Hat Enterprise Linux 8 (64-bit),vm-8071,42346820-bc40-399b-8ee6-84e5d9f39a19,p-vc-01.usfq.edu.ec,b4509789-2388-4298-aee8-97cf83caf1ba
P-ZB-FE-01,poweredOn,P-ZB-FE-01_vm-528_1,Snapshot generated by VMware vSphere Lifecycle Manager at 2024-11-17 02:40:42.583 (Lifecycle Manager local time). Snapshot will not be automatically deleted.,2024-11-17T02:40:44.331487+00:00,[FS1-P-ESX-VM-01] P-ZB-FE-01/P-ZB-FE-01-Snapshot3.vmsn,0.2912254333496094,34772.2918138504,False,poweredOff,,OK,5034d155-867e-fd43-319c-0c5410e3da38,2025-12-15 15:46:19,USFQ,USFQ-PRODUCCION,p-esx-02.usfq.edu.ec,/USFQ/vm/SEGURIDAD-VM-PRODUCCION,Other 2.6.x Linux (64-bit),Oracle Linux 8 (64-bit),vm-528,42349136-e9a5-8622-b8b3-44294dc25d5c,p-vc-01.usfq.edu.ec,b4509789-2388-4298-aee8-97cf83caf1ba
P-HUBI-LNX-01,poweredOn,P-HUBI-LNX-01_vm-1318_1,Snapshot generated by VMware vSphere Lifecycle Manager at 2024-11-17 03:57:30.963 (Lifecycle Manager local time). Snapshot will not be automatically deleted.,2024-11-17T03:57:34.441661+00:00,[FS1-P-ESX-VM-02] P-HUBI-LNX-01/P-HUBI-LNX-01-Snapshot10.vmsn,0.01987934112548828,167025.0204744339,False,poweredOff,,OK,5034aaee-6c36-2744-0d20-7ef9de3e35d2,2025-12-19 22:02:24,USFQ,USFQ-PRODUCCION,p-esx-02.usfq.edu.ec,/USFQ/vm/Discovered virtual machine,Other 2.6.x Linux (64-bit),Oracle Linux 7 (64-bit),vm-1318,4234a791-3340-609c-f99d-0479534d44b3,p-vc-01.usfq.edu.ec,b4509789-2388-4298-aee8-97cf83caf1ba
P-HUBI-LNX-01,poweredOn,"P-HUBI-LNX-01 25/8/2025, 7:52:51",,2025-08-25T12:52:56.720794+00:00,[FS1-P-ESX-VM-02] P-HUBI-LNX-01/P-HUBI-LNX-01-Snapshot54.vmem,28672.0,231540.25963306427,False,poweredOn,,OK,5034aaee-6c36-2744-0d20-7ef9de3e35d2,2025-12-19 22:02:24,USFQ,USFQ-PRODUCCION,p-esx-02.usfq.edu.ec,/USFQ/vm/Discovered virtual machine,Other 2.6.x Linux (64-bit),Oracle Linux 7 (64-bit),vm-1318,4234a791-3340-609c-f99d-0479534d44b3,p-vc-01.usfq.edu.ec,b4509789-2388-4298-aee8-97cf83caf1ba
P-HUBI-LNX-01,poweredOn,"P-HUBI-LNX-01 3/11/2025, 12:28:22",,2025-11-03T17:28:27.840948+00:00,[FS1-P-ESX-VM-02] P-HUBI-LNX-01/P-HUBI-LNX-01-Snapshot65.vmem,28672.0,241528.2790145874,False,poweredOn,,OK,5034aaee-6c36-2744-0d20-7ef9de3e35d2,2025-12-19 22:02:24,USFQ,USFQ-PRODUCCION,p-esx-02.usfq.edu.ec,/USFQ/vm/Discovered virtual machine,Other 2.6.x Linux (64-bit),Oracle Linux 7 (64-bit),vm-1318,4234a791-3340-609c-f99d-0479534d44b3,p-vc-01.usfq.edu.ec,b4509789-2388-4298-aee8-97cf83caf1ba
P-HUBI-LNX-01,poweredOn,"P-HUBI-LNX-01 20/11/2025, 10:20:53",,2025-11-20T15:21:07.175922+00:00,[FS1-P-ESX-VM-02] P-HUBI-LNX-01/P-HUBI-LNX-01-Snapshot70.vmem,28672.0,247915.25641345978,False,poweredOn,,OK,5034aaee-6c36-2744-0d20-7ef9de3e35d2,2025-12-19 22:02:24,USFQ,USFQ-PRODUCCION,p-esx-02.usfq.edu.ec,/USFQ/vm/Discovered virtual machine,Other 2.6.x Linux (64-bit),Oracle Linux 7 (64-bit),vm-1318,4234a791-3340-609c-f99d-0479534d44b3,p-vc-01.usfq.edu.ec,b4509789-2388-4298-aee8-97cf83caf1ba
P-BAN9-ADMP-01,poweredOn,P-BAN9-ADMP-01_vm-3720_1,Snapshot generated by VMware vSphere Lifecycle Manager at 2024-10-24 16:45:11.214 (Lifecycle Manager local time). Snapshot will not be automatically deleted.,2024-10-24T16:45:13.467265+00:00,[FS1-P-ESX-VM-05] P-BAN9-ADMP-01/P-BAN9-ADMP-01-Snapshot1.vmsn,0.2813425064086914,163840.28248786926,True,poweredOff,,OK,5006be36-cc1c-8207-a82a-9214a3751cb1,2025-12-10 04:15:32,USFQ,USFQ-PRODUCCION,p-esx-02.usfq.edu.ec,/USFQ/vm/INFRA-VM-PRODUCCION-BANNER,Oracle Linux 8 (64-bit),Oracle Linux 8 (64-bit),vm-3720,4206dade-20c5-cc89-1188-0de06b0a3be8,p-vc-01.usfq.edu.ec,b4509789-2388-4298-aee8-97cf83caf1ba
P-BAN9-ADMP-01,poweredOn,"P-BAN9-ADMP-01 3/11/2025, 12:20:53",,2025-11-03T17:20:58.548320+00:00,[FS1-P-ESX-VM-05] P-BAN9-ADMP-01/P-BAN9-ADMP-01-Snapshot31.vmem,16384.0,316054.55989456177,False,poweredOn,,OK,5006be36-cc1c-8207-a82a-9214a3751cb1,2025-12-10 04:15:32,USFQ,USFQ-PRODUCCION,p-esx-02.usfq.edu.ec,/USFQ/vm/INFRA-VM-PRODUCCION-BANNER,Oracle Linux 8 (64-bit),Oracle Linux 8 (64-bit),vm-3720,4206dade-20c5-cc89-1188-0de06b0a3be8,p-vc-01.usfq.edu.ec,b4509789-2388-4298-aee8-97cf83caf1ba
P-RADIUS-01,poweredOn,P-RADIUS-01_vm-506_1,Snapshot generated by VMware vSphere Lifecycle Manager at 2024-11-17 01:33:49.294 (Lifecycle Manager local time). Snapshot will not be automatically deleted.,2024-11-17T01:33:52.725478+00:00,[FS1-P-ESX-VM-07] P-RADIUS-01/P-RADIUS-01-Snapshot2.vmsn,0.02026081085205078,40960.02139186859,False,poweredOff,,OK,50342412-cab1-9954-3666-ffcc608f0194,2025-11-29 22:03:57,USFQ,USFQ-PRODUCCION,p-esx-02.usfq.edu.ec,/USFQ/vm,Oracle Linux 7 (64-bit),Ubuntu Linux (64-bit),vm-506,423479ac-59d3-fef7-efd3-265d1006def1,p-vc-01.usfq.edu.ec,b4509789-2388-4298-aee8-97cf83caf1ba
P-BAN9-APP-02,poweredOn,P-BAN9-APP-02_vm-3843_1,Snapshot generated by VMware vSphere Lifecycle Manager at 2024-10-28 15:06:12.659 (Lifecycle Manager local time). Snapshot will not be automatically deleted.,2024-10-28T15:06:12.667256+00:00,[FS1-P-ESX-VM-02] P-BAN9-APP-02/P-BAN9-APP-02-Snapshot1.vmsn,0.2809000015258789,163840.28204154968,False,poweredOff,,OK,5006c8fb-3f29-f745-cdfe-936c930be5cd,2025-12-10 04:29:37,USFQ,USFQ-PRODUCCION,p-esx-02.usfq.edu.ec,/USFQ/vm/INFRA-VM-PRODUCCION-BANNER,Oracle Linux 8 (64-bit),Oracle Linux 8 (64-bit),vm-3843,42061490-df56-2a78-be56-63502fef1fa6,p-vc-01.usfq.edu.ec,b4509789-2388-4298-aee8-97cf83caf1ba
P-BAN9-APP-02,poweredOn,"P-BAN9-APP-02 3/11/2025, 12:21:13",,2025-11-03T17:21:18.528562+00:00,[FS1-P-ESX-VM-02] P-BAN9-APP-02/P-BAN9-APP-02-Snapshot31.vmem,16384.0,306109.5518836975,False,poweredOn,,OK,5006c8fb-3f29-f745-cdfe-936c930be5cd,2025-12-10 04:29:37,USFQ,USFQ-PRODUCCION,p-esx-02.usfq.edu.ec,/USFQ/vm/INFRA-VM-PRODUCCION-BANNER,Oracle Linux 8 (64-bit),Oracle Linux 8 (64-bit),vm-3843,42061490-df56-2a78-be56-63502fef1fa6,p-vc-01.usfq.edu.ec,b4509789-2388-4298-aee8-97cf83caf1ba
T-APP-INFOREDESTI-01,poweredOn,"T-APP-INFOREDESTI-01 3/9/2025, 11:28:30",,2025-09-03T16:28:36.093157+00:00,[FS1-P-ESX-VM-03] T-APP-INFOREDESTI-01/T-APP-INFOREDESTI-01-Snapshot18.vmem,3072.0,44039.479555130005,False,poweredOn,,OK,5006e920-f09c-5c33-7075-273be9e1f17a,2025-12-19 16:03:35,USFQ,USFQ-PRODUCCION,p-esx-02.usfq.edu.ec,/USFQ/vm,Oracle Linux 9 (64-bit),Oracle Linux 9 (64-bit),vm-9526,42067476-c352-ef98-7594-35b81b2c30d3,p-vc-01.usfq.edu.ec,b4509789-2388-4298-aee8-97cf83caf1ba
P-WEBWORK-01,poweredOn,"VM Snapshot 1/8/2025, 11:04:02 AM",,2025-01-08T16:03:59.003053+00:00,[FS1-P-ESX-VM-01] P-WEBWORK-01/P-WEBWORK-01-Snapshot12.vmem,4096.0,116865.33946990967,False,poweredOn,,OK,50061de6-e924-120b-dacc-5c88f6f8e049,2025-12-06 06:03:40,USFQ,USFQ-PRODUCCION,p-esx-02.usfq.edu.ec,/USFQ/vm,Ubuntu Linux (64-bit),Ubuntu Linux (64-bit),vm-5908,42060956-1839-0cd6-d84d-efaca69e9825,p-vc-01.usfq.edu.ec,b4509789-2388-4298-aee8-97cf83caf1ba
P-WEBWORK-01,poweredOn,"P-WEBWORK-01 15/9/2025, 4:05:11",,2025-09-15T09:05:17.572450+00:00,[FS1-P-ESX-VM-01] P-WEBWORK-01/P-WEBWORK-01-Snapshot29.vmem,16384.0,145826.3551120758,False,poweredOn,,OK,50061de6-e924-120b-dacc-5c88f6f8e049,2025-12-06 06:03:40,USFQ,USFQ-PRODUCCION,p-esx-02.usfq.edu.ec,/USFQ/vm,Ubuntu Linux (64-bit),Ubuntu Linux (64-bit),vm-5908,42060956-1839-0cd6-d84d-efaca69e9825,p-vc-01.usfq.edu.ec,b4509789-2388-4298-aee8-97cf83caf1ba
P-WEBWORK-01,poweredOn,"P-WEBWORK-01 3/11/2025, 10:44:24",,2025-11-03T15:44:29.628580+00:00,[FS1-P-ESX-VM-01] P-WEBWORK-01/P-WEBWORK-01-Snapshot32.vmem,16384.0,154311.35722637177,False,poweredOn,,OK,50061de6-e924-120b-dacc-5c88f6f8e049,2025-12-06 06:03:40,USFQ,USFQ-PRODUCCION,p-esx-02.usfq.edu.ec,/USFQ/vm,Ubuntu Linux (64-bit),Ubuntu Linux (64-bit),vm-5908,42060956-1839-0cd6-d84d-efaca69e9825,p-vc-01.usfq.edu.ec,b4509789-2388-4298-aee8-97cf83caf1ba
P-APP-ANSIBLE-OL9-01,poweredOn,"P-APP-ANSIBLE-OL9-01 28/5/2025, 12:28:41",,2025-05-28T17:28:59.956050+00:00,[FS1-P-ESX-VM-02] P-APP-ANSIBLE-OL9-01/P-APP-ANSIBLE-OL9-01-Snapshot1.vmem,8192.0,69643.48997020721,False,poweredOn,,OK,500636c5-4294-5300-4091-6f448efdbb58,2025-12-20 00:09:26,USFQ,USFQ-PRODUCCION,p-esx-02.usfq.edu.ec,/USFQ/vm,Oracle Linux 9 (64-bit),Oracle Linux 9 (64-bit),vm-11085,4206a49f-49dd-99f2-d46b-08a94272ff1a,p-vc-01.usfq.edu.ec,b4509789-2388-4298-aee8-97cf83caf1ba
P-APP-ANSIBLE-OL9-01,poweredOn,"P-APP-ANSIBLE-OL9-01 29/7/2025, 10:45:58",,2025-07-29T15:46:15.403176+00:00,[FS1-P-ESX-VM-02] P-APP-ANSIBLE-OL9-01/P-APP-ANSIBLE-OL9-01-Snapshot7.vmem,8192.0,72672.49810028076,False,poweredOn,,OK,500636c5-4294-5300-4091-6f448efdbb58,2025-12-20 00:09:26,USFQ,USFQ-PRODUCCION,p-esx-02.usfq.edu.ec,/USFQ/vm,Oracle Linux 9 (64-bit),Oracle Linux 9 (64-bit),vm-11085,4206a49f-49dd-99f2-d46b-08a94272ff1a,p-vc-01.usfq.edu.ec,b4509789-2388-4298-aee8-97cf83caf1ba
P-APP-ANSIBLE-OL9-01,poweredOn,"VM Snapshot 11/10/2025, 12:21:55 PM","(temporal snapshot for testing, will be removed in the near future)",2025-11-10T12:22:31.150346+00:00,[FS1-P-ESX-VM-02] P-APP-ANSIBLE-OL9-01/P-APP-ANSIBLE-OL9-01-Snapshot26.vmem,8192.0,79782.49840831757,False,poweredOn,,OK,500636c5-4294-5300-4091-6f448efdbb58,2025-12-20 00:09:26,USFQ,USFQ-PRODUCCION,p-esx-02.usfq.edu.ec,/USFQ/vm,Oracle Linux 9 (64-bit),Oracle Linux 9 (64-bit),vm-11085,4206a49f-49dd-99f2-d46b-08a94272ff1a,p-vc-01.usfq.edu.ec,b4509789-2388-4298-aee8-97cf83caf1ba
P-APP-ANSIBLE-OL9-01,poweredOn,"VM Snapshot 11/12/2025, 7:01:54 PM","(temporal snapshot II for testing, will be removed in the near future)",2025-11-12T19:02:14.669509+00:00,[FS1-P-ESX-VM-02] P-APP-ANSIBLE-OL9-01/P-APP-ANSIBLE-OL9-01-Snapshot28.vmem,8192.0,80587.498752594,False,poweredOn,,OK,500636c5-4294-5300-4091-6f448efdbb58,2025-12-20 00:09:26,USFQ,USFQ-PRODUCCION,p-esx-02.usfq.edu.ec,/USFQ/vm,Oracle Linux 9 (64-bit),Oracle Linux 9 (64-bit),vm-11085,4206a49f-49dd-99f2-d46b-08a94272ff1a,p-vc-01.usfq.edu.ec,b4509789-2388-4298-aee8-97cf83caf1ba
P-BAN9-APP-01,poweredOn,P-BAN9-APP-01_vm-3724_1,Snapshot generated by VMware vSphere Lifecycle Manager at 2024-10-24 16:45:54.577 (Lifecycle Manager local time). Snapshot will not be automatically deleted.,2024-10-24T16:45:56.853535+00:00,[FS1-P-ESX-VM-02] P-BAN9-APP-01/P-BAN9-APP-01-Snapshot1.vmsn,0.28131771087646484,163840.28245925903,True,poweredOff,,OK,500623e9-5114-4189-395b-c66cf9fb341b,2025-12-10 01:05:47,USFQ,USFQ-PRODUCCION,p-esx-02.usfq.edu.ec,/USFQ/vm/INFRA-VM-PRODUCCION-BANNER,Oracle Linux 8 (64-bit),Oracle Linux 8 (64-bit),vm-3724,42062aab-a682-e143-4ed7-0b9c839f923f,p-vc-01.usfq.edu.ec,b4509789-2388-4298-aee8-97cf83caf1ba
P-BAN9-APP-01,poweredOn,"P-BAN9-APP-01 3/11/2025, 12:21:04",,2025-11-03T17:21:09.471324+00:00,[FS1-P-ESX-VM-02] P-BAN9-APP-01/P-BAN9-APP-01-Snapshot33.vmem,16384.0,320764.56981372833,False,poweredOn,,OK,500623e9-5114-4189-395b-c66cf9fb341b,2025-12-10 01:05:47,USFQ,USFQ-PRODUCCION,p-esx-02.usfq.edu.ec,/USFQ/vm/INFRA-VM-PRODUCCION-BANNER,Oracle Linux 8 (64-bit),Oracle Linux 8 (64-bit),vm-3724,42062aab-a682-e143-4ed7-0b9c839f923f,p-vc-01.usfq.edu.ec,b4509789-2388-4298-aee8-97cf83caf1ba
P-FIN-MS-01,poweredOn,"P-FIN-MS-01 17/11/2024, 13:49:20",,2024-11-17T18:49:18.239163+00:00,[FS1-P-ESX-VM-07] P-FIN-MS-01/P-FIN-MS-01-Snapshot39.vmem,16384.0,85025.22681331635,False,poweredOn,,OK,5034add2-ac81-216e-053c-08a30d61758e,2025-12-18 22:03:10,USFQ,USFQ-PRODUCCION,p-esx-02.usfq.edu.ec,/USFQ/vm/Discovered virtual machine,Other 2.6.x Linux (64-bit),Oracle Linux 8 (64-bit),vm-1307,423459e8-1fbc-2090-dbef-fd283b0431d3,p-vc-01.usfq.edu.ec,b4509789-2388-4298-aee8-97cf83caf1ba
P-FIN-MS-01,poweredOn,"P-FIN-MS-01 14/9/2025, 2:04:31",,2025-09-14T07:04:44.580005+00:00,[FS1-P-ESX-VM-07] P-FIN-MS-01/P-FIN-MS-01-Snapshot86.vmem,16384.0,159778.23111248016,False,poweredOn,,OK,5034add2-ac81-216e-053c-08a30d61758e,2025-12-18 22:03:10,USFQ,USFQ-PRODUCCION,p-esx-02.usfq.edu.ec,/USFQ/vm/Discovered virtual machine,Other 2.6.x Linux (64-bit),Oracle Linux 8 (64-bit),vm-1307,423459e8-1fbc-2090-dbef-fd283b0431d3,p-vc-01.usfq.edu.ec,b4509789-2388-4298-aee8-97cf83caf1ba
P-FIN-MS-01,poweredOn,"P-FIN-MS-01 26/10/2025, 22:11:10",,2025-10-27T03:11:16.905321+00:00,[FS1-P-ESX-VM-07] P-FIN-MS-01/P-FIN-MS-01-Snapshot98.vmem,16384.0,198271.23822307587,False,poweredOn,,OK,5034add2-ac81-216e-053c-08a30d61758e,2025-12-18 22:03:10,USFQ,USFQ-PRODUCCION,p-esx-02.usfq.edu.ec,/USFQ/vm/Discovered virtual machine,Other 2.6.x Linux (64-bit),Oracle Linux 8 (64-bit),vm-1307,423459e8-1fbc-2090-dbef-fd283b0431d3,p-vc-01.usfq.edu.ec,b4509789-2388-4298-aee8-97cf83caf1ba
P-EDUROAM-01,poweredOn,"P-EDUROAM-01 3/11/2025, 12:48:11",,2025-11-03T17:48:15.411081+00:00,[FS1-P-ESX-VM-04] P-EDUROAM-01/P-EDUROAM-01-Snapshot22.vmem,2048.0,19916.104334831238,False,poweredOn,,OK,50342bc5-0f8c-9110-4273-2b30bccda3ce,2025-11-29 22:01:57,USFQ,USFQ-PRODUCCION,p-esx-02.usfq.edu.ec,/USFQ/vm,CentOS 4/5/6/7 (64-bit),CentOS 7 (64-bit),vm-486,42342884-1f74-7bda-90b4-619b118cfedf,p-vc-01.usfq.edu.ec,b4509789-2388-4298-aee8-97cf83caf1ba
P-WWW4-OL-01,poweredOff,P-WWW4-OL-01_vm-557_1,Snapshot generated by VMware vSphere Lifecycle Manager at 2024-11-17 03:33:27.502 (Lifecycle Manager local time). Snapshot will not be automatically deleted.,2024-11-17T03:33:30.971517+00:00,[FS1-P-ESX-VM-07] P-WWW4-OL-01/P-WWW4-OL-01-Snapshot2.vmsn,0.020206451416015625,268505.0213947296,False,poweredOff,,OK,5034f0ec-7c95-9bf9-5036-c0c054e33a86,2025-12-06 06:03:28,USFQ,USFQ-PRODUCCION,p-esx-02.usfq.edu.ec,/USFQ/vm,Other 2.6.x Linux (64-bit),Oracle Linux 8 (64-bit),vm-557,423414cd-aeed-c317-2ad7-3319b1676ae3,p-vc-01.usfq.edu.ec,b4509789-2388-4298-aee8-97cf83caf1ba
P-BAN9-SSB-01,poweredOn,P-BAN9-SSB-01_vm-3722_1,Snapshot generated by VMware vSphere Lifecycle Manager at 2024-10-24 16:47:35.678 (Lifecycle Manager local time). Snapshot will not be automatically deleted.,2024-10-24T16:47:38.147220+00:00,[FS1-P-ESX-VM-04] P-BAN9-SSB-01/P-BAN9-SSB-01-Snapshot1.vmsn,0.28132057189941406,163840.28246212006,True,poweredOff,,OK,50063bdb-e4e3-453b-9e0c-060279d231c7,2025-12-10 01:04:34,USFQ,USFQ-PRODUCCION,p-esx-02.usfq.edu.ec,/USFQ/vm/INFRA-VM-PRODUCCION-BANNER,Oracle Linux 8 (64-bit),Oracle Linux 8 (64-bit),vm-3722,4206e807-646e-e6a5-5535-9f6f2415dbc4,p-vc-01.usfq.edu.ec,b4509789-2388-4298-aee8-97cf83caf1ba
P-BAN9-SSB-01,poweredOn,"P-BAN9-SSB-01 3/11/2025, 12:22:34",,2025-11-03T17:22:40.285675+00:00,[FS1-P-ESX-VM-04] P-BAN9-SSB-01/P-BAN9-SSB-01-Snapshot32.vmem,16384.0,302584.56174468994,False,poweredOn,,OK,50063bdb-e4e3-453b-9e0c-060279d231c7,2025-12-10 01:04:34,USFQ,USFQ-PRODUCCION,p-esx-02.usfq.edu.ec,/USFQ/vm/INFRA-VM-PRODUCCION-BANNER,Oracle Linux 8 (64-bit),Oracle Linux 8 (64-bit),vm-3722,4206e807-646e-e6a5-5535-9f6f2415dbc4,p-vc-01.usfq.edu.ec,b4509789-2388-4298-aee8-97cf83caf1ba
P-WS-EXT-02,poweredOn,"Snapshot de máquina virtual 15/2/2025, 14:50:51",,2025-02-15T19:50:58.430997+00:00,[FS1-P-ESX-VM-08] P-WS-EXT-02/P-WS-EXT-02-Snapshot21.vmem,49152.0,131586.73254680634,False,poweredOn,"Disks=000000010000000000000000,52 b2 77 af 77 99 7e 79-e6 b6 cc a6 4d 1b 25 63/1,\archpit(1AC998854F5B85CB05CDC996ED1045FF)\disk1_part1,2048,921600,\archpit(1AC998854F5B85CB05CDC996ED1045FF)\disk1_part2,923648,202752,\archpit(1AC998854F5B85CB05CDC996ED1045FF)\disk1_part3,1159168,265177088;
SliceId=1AC99885-85CB-4F5B-96C9-CD05FF4510ED
SourceArchive=10655756-3904-9215-A050-8CA59583D9BF
",OK,5034008a-fc5e-596b-1235-3db97af6af66,2025-12-17 21:06:03,USFQ,USFQ-PRODUCCION,p-esx-02.usfq.edu.ec,/USFQ/vm/SEGURIDAD-VM-PRODUCCION,Microsoft Windows Server 2016 (64-bit),Microsoft Windows Server 2019 (64-bit),vm-550,4234a6bd-bbb2-630e-3b66-b042170b6f25,p-vc-01.usfq.edu.ec,b4509789-2388-4298-aee8-97cf83caf1ba
P-WS-EXT-02,poweredOn,"Snapshot de máquina virtual 15/3/2025, 18:45:11",,2025-03-15T23:45:14.102832+00:00,[FS1-P-ESX-VM-08] P-WS-EXT-02/P-WS-EXT-02-Snapshot26.vmem,49152.0,144549.78279590607,False,poweredOn,"Disks=000000010000000000000000,52 b2 77 af 77 99 7e 79-e6 b6 cc a6 4d 1b 25 63/1,\archpit(1AC998854F5B85CB05CDC996ED1045FF)\disk1_part1,2048,921600,\archpit(1AC998854F5B85CB05CDC996ED1045FF)\disk1_part2,923648,202752,\archpit(1AC998854F5B85CB05CDC996ED1045FF)\disk1_part3,1159168,265177088;
SliceId=1AC99885-85CB-4F5B-96C9-CD05FF4510ED
SourceArchive=10655756-3904-9215-A050-8CA59583D9BF
",OK,5034008a-fc5e-596b-1235-3db97af6af66,2025-12-17 21:06:03,USFQ,USFQ-PRODUCCION,p-esx-02.usfq.edu.ec,/USFQ/vm/SEGURIDAD-VM-PRODUCCION,Microsoft Windows Server 2016 (64-bit),Microsoft Windows Server 2019 (64-bit),vm-550,4234a6bd-bbb2-630e-3b66-b042170b6f25,p-vc-01.usfq.edu.ec,b4509789-2388-4298-aee8-97cf83caf1ba
P-WS-EXT-02,poweredOn,P-WS-EXT-02_vm-550_1,Snapshot generated by VMware vSphere Lifecycle Manager at 2025-03-15 23:45:29.417 (Lifecycle Manager local time). Snapshot will not be automatically deleted.,2025-03-15T23:48:42.211760+00:00,[FS1-P-ESX-VM-08] P-WS-EXT-02/P-WS-EXT-02-Snapshot27.vmsn,0.34610462188720703,96916.34786510468,True,poweredOff,"Disks=000000010000000000000000,52 b2 77 af 77 99 7e 79-e6 b6 cc a6 4d 1b 25 63/1,\archpit(1AC998854F5B85CB05CDC996ED1045FF)\disk1_part1,2048,921600,\archpit(1AC998854F5B85CB05CDC996ED1045FF)\disk1_part2,923648,202752,\archpit(1AC998854F5B85CB05CDC996ED1045FF)\disk1_part3,1159168,265177088;
SliceId=1AC99885-85CB-4F5B-96C9-CD05FF4510ED
SourceArchive=10655756-3904-9215-A050-8CA59583D9BF
",OK,5034008a-fc5e-596b-1235-3db97af6af66,2025-12-17 21:06:03,USFQ,USFQ-PRODUCCION,p-esx-02.usfq.edu.ec,/USFQ/vm/SEGURIDAD-VM-PRODUCCION,Microsoft Windows Server 2016 (64-bit),Microsoft Windows Server 2019 (64-bit),vm-550,4234a6bd-bbb2-630e-3b66-b042170b6f25,p-vc-01.usfq.edu.ec,b4509789-2388-4298-aee8-97cf83caf1ba
P-EXPEDITION-PA-01,poweredOn,P-EXPEDITION-PA-01_vm-485_1,Snapshot generated by VMware vSphere Lifecycle Manager at 2024-11-19 13:41:23.045 (Lifecycle Manager local time). Snapshot will not be automatically deleted.,2024-11-19T13:41:27.708980+00:00,[FS1-P-ESX-VM-06] P-EXPEDITION-PA-01/P-EXPEDITION-PA-01-Snapshot1.vmsn,0.019890785217285156,40960.02040100098,False,poweredOff,"ExpeditionVM 1.1.6
Created by Tobias Rice
Last update: 2.22.2019
CLI user: expedition / paloalto
WebUI user: admin / paloalto
192.168.55.134",OK,5034741d-9f05-91c6-5d17-1b74d7a9238f,2025-12-07 04:28:45,USFQ,USFQ-PRODUCCION,p-esx-02.usfq.edu.ec,/USFQ/vm/SEGURIDAD-VM-PRODUCCION,Ubuntu Linux (64-bit),Ubuntu Linux (64-bit),vm-8033,4234070f-57ab-c9e6-591a-1705978685e0,p-vc-01.usfq.edu.ec,b4509789-2388-4298-aee8-97cf83caf1ba
P-QUALYS-SCAN-01,poweredOn,P-QUALYS-SCAN-01_vm-505_1,Snapshot generated by VMware vSphere Lifecycle Manager at 2024-11-19 14:15:56.263 (Lifecycle Manager local time). Snapshot will not be automatically deleted.,2024-11-19T14:16:00.937885+00:00,[FS1-P-ESX-VM-04] P-QUALYS-SCAN-01/P-QUALYS-SCAN-01-Snapshot3.vmsn,0.01974010467529297,57344.020318984985,False,poweredOff,"Qualys Virtual Scanner Appliance, build:qVSA-2.7.45-2",OK,50340415-b437-d1b4-4697-13f6d9f0364f,2025-12-07 04:29:02,USFQ,USFQ-PRODUCCION,p-esx-02.usfq.edu.ec,/USFQ/vm/SEGURIDAD-VM-PRODUCCION,Red Hat Enterprise Linux 6 (32-bit),Other 2.6.x Linux (32-bit),vm-8046,423471bc-7dd2-87dc-bbd1-c1935545626b,p-vc-01.usfq.edu.ec,b4509789-2388-4298-aee8-97cf83caf1ba
P-CUSTOM-OLNX-01,poweredOn,"P-CUSTOM-OLNX-01 3/8/2025, 1:49:55",,2025-08-03T06:50:01.559526+00:00,[FS1-P-ESX-VM-01] P-CUSTOM-OLNX-01/P-CUSTOM-OLNX-01-Snapshot159.vmem,12288.0,59023.28795623779,False,poweredOn,,OK,50340f89-beef-1698-588c-fcdbb59b7dcc,2025-12-19 22:03:19,USFQ,USFQ-PRODUCCION,p-esx-02.usfq.edu.ec,/USFQ/vm,Other 2.6.x Linux (64-bit),Oracle Linux 8 (64-bit),vm-476,42348b7a-bdf3-9b98-31f3-c5d16591d47d,p-vc-01.usfq.edu.ec,b4509789-2388-4298-aee8-97cf83caf1ba
P-CUSTOM-OLNX-01,poweredOn,"P-CUSTOM-OLNX-01 14/9/2025, 0:29:33",,2025-09-14T05:29:39.524945+00:00,[FS1-P-ESX-VM-01] P-CUSTOM-OLNX-01/P-CUSTOM-OLNX-01-Snapshot166.vmem,12288.0,79148.28922748566,False,poweredOn,,OK,50340f89-beef-1698-588c-fcdbb59b7dcc,2025-12-19 22:03:19,USFQ,USFQ-PRODUCCION,p-esx-02.usfq.edu.ec,/USFQ/vm,Other 2.6.x Linux (64-bit),Oracle Linux 8 (64-bit),vm-476,42348b7a-bdf3-9b98-31f3-c5d16591d47d,p-vc-01.usfq.edu.ec,b4509789-2388-4298-aee8-97cf83caf1ba
P-CUSTOM-OLNX-01,poweredOn,"P-CUSTOM-OLNX-01 26/10/2025, 21:54:10",,2025-10-27T02:54:16.465168+00:00,[FS1-P-ESX-VM-01] P-CUSTOM-OLNX-01/P-CUSTOM-OLNX-01-Snapshot173.vmem,12288.0,96964.2933473587,False,poweredOn,,OK,50340f89-beef-1698-588c-fcdbb59b7dcc,2025-12-19 22:03:19,USFQ,USFQ-PRODUCCION,p-esx-02.usfq.edu.ec,/USFQ/vm,Other 2.6.x Linux (64-bit),Oracle Linux 8 (64-bit),vm-476,42348b7a-bdf3-9b98-31f3-c5d16591d47d,p-vc-01.usfq.edu.ec,b4509789-2388-4298-aee8-97cf83caf1ba
P-CUSTOM-OLNX-01,poweredOn,"P-CUSTOM-OLNX-01 3/11/2025, 12:19:25",,2025-11-03T17:19:31.780930+00:00,[FS1-P-ESX-VM-01] P-CUSTOM-OLNX-01/P-CUSTOM-OLNX-01-Snapshot175.vmem,12288.0,102360.29458618164,False,poweredOn,,OK,50340f89-beef-1698-588c-fcdbb59b7dcc,2025-12-19 22:03:19,USFQ,USFQ-PRODUCCION,p-esx-02.usfq.edu.ec,/USFQ/vm,Other 2.6.x Linux (64-bit),Oracle Linux 8 (64-bit),vm-476,42348b7a-bdf3-9b98-31f3-c5d16591d47d,p-vc-01.usfq.edu.ec,b4509789-2388-4298-aee8-97cf83caf1ba
P-ZB-DB-01,poweredOn,P-ZB-DB-01_vm-556_1,Snapshot generated by VMware vSphere Lifecycle Manager at 2024-11-17 02:40:50.904 (Lifecycle Manager local time). Snapshot will not be automatically deleted.,2024-11-17T02:40:53.496821+00:00,[FS1-P-ESX-VM-07] P-ZB-DB-01/P-ZB-DB-01-Snapshot3.vmsn,0.27077674865722656,1082629.2731170654,False,poweredOff,,OK,503444f7-8197-4da3-8c2e-b9d6f08d65bb,2025-12-15 16:32:23,USFQ,USFQ-PRODUCCION,p-esx-02.usfq.edu.ec,/USFQ/vm/SEGURIDAD-VM-PRODUCCION,Other 2.6.x Linux (64-bit),Oracle Linux 8 (64-bit),vm-556,4234bbda-abfc-8e1a-2a92-d8b5d190b059,p-vc-01.usfq.edu.ec,b4509789-2388-4298-aee8-97cf83caf1ba
S-ACR-CLOUD-01,poweredOn,"Snapshot de máquina virtual 15/5/2025, 9:19:17",,2025-05-15T07:19:19.476495+00:00,[FS-S-ESX-VM-01] S-ACR-CLOUD-01_1/S-ACR-CLOUD-01-Snapshot1.vmem,16384.0,41989.17347049713,False,poweredOn,{AB53A0F1-AD54-480f-80BB-FC72DC41DF53},,5006f51c-904e-82f2-ffa0-baa8d1e97a37,,USFQ,USFQ-SANDBOX,s-esx-01.usfq.edu.ec,/USFQ/vm,Other 3.x Linux (64-bit),Other 6.x or later Linux (64-bit),vm-8315,42064c88-55df-28bb-f60c-e3eded223aaf,p-vc-01.usfq.edu.ec,b4509789-2388-4298-aee8-97cf83caf1ba
T-BAN-APP-04,poweredOn,"T-BAN-APP-04 4/8/2025, 1:21:35",,2025-08-04T06:21:46.178835+00:00,[FS1-T-ESX-VM-01] T-BAN-APP-04/T-BAN-APP-04-Snapshot17.vmem,16384.0,221191.5355014801,False,poweredOn,,Error,503427f1-b8a7-9aae-0583-bb148538b982,2025-12-06 01:15:52,USFQ,USFQ-TEST,t-esx-02.usfq.edu.ec,/USFQ/vm/Discovered virtual machine,Oracle Linux 8 (64-bit),Oracle Linux 8 (64-bit),vm-202,42349488-4481-dbac-5e3d-e87c86691cc6,p-vc-01.usfq.edu.ec,b4509789-2388-4298-aee8-97cf83caf1ba
T-BAN-BEPBRIM-01,poweredOn,"T-BAN-BEPBRIM-01 4/8/2025, 1:22:54",,2025-08-04T06:23:06.362106+00:00,[FS1-T-ESX-VM-01] T-BAN-BEPBRIM-01/T-BAN-BEPBRIM-01-Snapshot16.vmem,16384.0,221191.5453672409,False,poweredOn,,Error,5034e992-1a63-d1e9-aae0-65277acd1a6a,2025-12-06 01:19:18,USFQ,USFQ-TEST,t-esx-02.usfq.edu.ec,/USFQ/vm/Discovered virtual machine,Oracle Linux 8 (64-bit),Oracle Linux 8 (64-bit),vm-208,42343e95-9a7a-9d8e-868e-9f5ca1021b56,p-vc-01.usfq.edu.ec,b4509789-2388-4298-aee8-97cf83caf1ba
T-BAN-BEPBRIM-01,poweredOn,"T-BAN-BEPBRIM-01 3/11/2025, 10:43:06",,2025-11-03T15:43:10.801780+00:00,[FS1-T-ESX-VM-01] T-BAN-BEPBRIM-01/T-BAN-BEPBRIM-01-Snapshot21.vmem,16384.0,230820.582777977,False,poweredOn,,Error,5034e992-1a63-d1e9-aae0-65277acd1a6a,2025-12-06 01:19:18,USFQ,USFQ-TEST,t-esx-02.usfq.edu.ec,/USFQ/vm/Discovered virtual machine,Oracle Linux 8 (64-bit),Oracle Linux 8 (64-bit),vm-208,42343e95-9a7a-9d8e-868e-9f5ca1021b56,p-vc-01.usfq.edu.ec,b4509789-2388-4298-aee8-97cf83caf1ba
D-CUSTOM-01,poweredOn,"D-CUSTOM-01 21/3/2025, 11:46:07",,2025-03-21T16:46:21.079789+00:00,[FS1-T-ESX-VM-01] D-CUSTOM-01/D-CUSTOM-01-Snapshot75.vmem,12288.0,49987.2681350708,False,poweredOn,,OK,5034ec9f-fe95-9c95-240a-ac7c2a49b3a7,2025-12-16 23:04:30,USFQ,USFQ-TEST,t-esx-02.usfq.edu.ec,/USFQ/vm/Discovered virtual machine,Other 2.6.x Linux (64-bit),Oracle Linux 8 (64-bit),vm-218,423471f1-2494-7dba-d451-29b8470720c5,p-vc-01.usfq.edu.ec,b4509789-2388-4298-aee8-97cf83caf1ba
D-CUSTOM-01,poweredOn,"D-CUSTOM-01 30/10/2025, 8:17:38",,2025-10-30T13:17:43.881910+00:00,[FS1-T-ESX-VM-01] D-CUSTOM-01/D-CUSTOM-01-Snapshot109.vmem,12288.0,70730.26937007904,False,poweredOn,,OK,5034ec9f-fe95-9c95-240a-ac7c2a49b3a7,2025-12-16 23:04:30,USFQ,USFQ-TEST,t-esx-02.usfq.edu.ec,/USFQ/vm/Discovered virtual machine,Other 2.6.x Linux (64-bit),Oracle Linux 8 (64-bit),vm-218,423471f1-2494-7dba-d451-29b8470720c5,p-vc-01.usfq.edu.ec,b4509789-2388-4298-aee8-97cf83caf1ba
D-CUSTOM-01,poweredOn,"D-CUSTOM-01 3/11/2025, 10:09:41",,2025-11-03T15:09:47.835160+00:00,[FS1-T-ESX-VM-01] D-CUSTOM-01/D-CUSTOM-01-Snapshot110.vmem,12288.0,78971.27003479004,False,poweredOn,,OK,5034ec9f-fe95-9c95-240a-ac7c2a49b3a7,2025-12-16 23:04:30,USFQ,USFQ-TEST,t-esx-02.usfq.edu.ec,/USFQ/vm/Discovered virtual machine,Other 2.6.x Linux (64-bit),Oracle Linux 8 (64-bit),vm-218,423471f1-2494-7dba-d451-29b8470720c5,p-vc-01.usfq.edu.ec,b4509789-2388-4298-aee8-97cf83caf1ba
T-FIN-MS-01,poweredOn,T-FIN-MS-01_vm-199_1,Snapshot generated by VMware vSphere Lifecycle Manager at 2024-10-17 14:45:34.501 (Lifecycle Manager local time). Snapshot will not be automatically deleted.,2024-10-17T14:45:18.202602+00:00,[FS1-T-ESX-VM-01] T-FIN-MS-01/T-FIN-MS-01-Snapshot30.vmsn,0.028127670288085938,67549.02871799469,False,poweredOff,,OK,50340d57-d7f0-5952-3512-1534d37d13d8,2025-12-18 17:04:21,USFQ,USFQ-TEST,t-esx-02.usfq.edu.ec,/USFQ/vm/Discovered virtual machine,Other 2.6.x Linux (64-bit),Oracle Linux 8 (64-bit),vm-199,4234c2ba-e2e4-4151-e3c9-e508632241d3,p-vc-01.usfq.edu.ec,b4509789-2388-4298-aee8-97cf83caf1ba
T-FIN-MS-01,poweredOn,"T-FIN-MS-01 21/3/2025, 11:34:15",,2025-03-21T16:34:25.279734+00:00,[FS1-T-ESX-VM-01] T-FIN-MS-01/T-FIN-MS-01-Snapshot56.vmem,8192.0,122869.21755695343,False,poweredOn,,OK,50340d57-d7f0-5952-3512-1534d37d13d8,2025-12-18 17:04:21,USFQ,USFQ-TEST,t-esx-02.usfq.edu.ec,/USFQ/vm/Discovered virtual machine,Other 2.6.x Linux (64-bit),Oracle Linux 8 (64-bit),vm-199,4234c2ba-e2e4-4151-e3c9-e508632241d3,p-vc-01.usfq.edu.ec,b4509789-2388-4298-aee8-97cf83caf1ba
T-FIN-MS-01,poweredOn,"T-FIN-MS-01 29/5/2025, 12:46:23",,2025-05-29T17:46:29.614307+00:00,[FS1-T-ESX-VM-01] T-FIN-MS-01/T-FIN-MS-01-Snapshot66.vmem,8192.0,150787.18887901306,False,poweredOn,,OK,50340d57-d7f0-5952-3512-1534d37d13d8,2025-12-18 17:04:21,USFQ,USFQ-TEST,t-esx-02.usfq.edu.ec,/USFQ/vm/Discovered virtual machine,Other 2.6.x Linux (64-bit),Oracle Linux 8 (64-bit),vm-199,4234c2ba-e2e4-4151-e3c9-e508632241d3,p-vc-01.usfq.edu.ec,b4509789-2388-4298-aee8-97cf83caf1ba
T-FIN-MS-01,poweredOn,"T-FIN-MS-01 9/6/2025, 14:27:26",,2025-06-09T19:27:40.711527+00:00,[FS1-T-ESX-VM-01] T-FIN-MS-01/T-FIN-MS-01-Snapshot69.vmem,8192.0,164070.20961761475,False,poweredOn,,OK,50340d57-d7f0-5952-3512-1534d37d13d8,2025-12-18 17:04:21,USFQ,USFQ-TEST,t-esx-02.usfq.edu.ec,/USFQ/vm/Discovered virtual machine,Other 2.6.x Linux (64-bit),Oracle Linux 8 (64-bit),vm-199,4234c2ba-e2e4-4151-e3c9-e508632241d3,p-vc-01.usfq.edu.ec,b4509789-2388-4298-aee8-97cf83caf1ba
T-BAN-APP-05,poweredOn,"T-BAN-APP-05 4/8/2025, 1:21:53",,2025-08-04T06:22:03.400742+00:00,[FS1-T-ESX-VM-02] T-BAN-APP-05/T-BAN-APP-05-Snapshot17.vmem,16384.0,221191.53986167908,False,poweredOn,,Error,50347a7b-e862-cbde-ee5c-8cdd045d8246,2025-12-06 01:18:59,USFQ,USFQ-TEST,t-esx-02.usfq.edu.ec,/USFQ/vm/Discovered virtual machine,Oracle Linux 8 (64-bit),Oracle Linux 8 (64-bit),vm-211,42345d8f-a3a6-d0bb-5fdd-eecd0099cdfc,p-vc-01.usfq.edu.ec,b4509789-2388-4298-aee8-97cf83caf1ba
P-ANS-01,poweredOn,P-ANS-01_vm-469_1,Snapshot generated by VMware vSphere Lifecycle Manager at 2024-12-30 00:21:37.649 (Lifecycle Manager local time). Snapshot will not be automatically deleted.,2024-12-30T00:23:01.779371+00:00,[FS1-T-ESX-VM-03] P-ANS-01/P-ANS-01-Snapshot5.vmsn,0.2696704864501953,19000.270253181458,False,poweredOff,,OK,50349c71-e717-000f-442c-9f86413e56ac,2025-12-20 00:01:14,USFQ,USFQ-TEST,t-esx-02.usfq.edu.ec,/USFQ/vm,Other 2.6.x Linux (64-bit),Oracle Linux 7 (64-bit),vm-469,423493e0-6f6d-b6a1-dc30-e1efb751a1dc,p-vc-01.usfq.edu.ec,b4509789-2388-4298-aee8-97cf83caf1ba
T-BAN-ADMP-01,poweredOn,"T-BAN-ADMP-01 4/8/2025, 1:20:16",,2025-08-04T06:20:23.821301+00:00,[FS1-T-ESX-VM-02] T-BAN-ADMP-01/T-BAN-ADMP-01-Snapshot19.vmem,16384.0,221191.53942394257,False,poweredOn,,Error,5034213b-2202-ef02-3639-3f22e2a9c080,2025-12-06 01:15:41,USFQ,USFQ-TEST,t-esx-02.usfq.edu.ec,/USFQ/vm/Discovered virtual machine,Oracle Linux 8 (64-bit),Oracle Linux 8 (64-bit),vm-216,4234e8f3-2d87-9b49-96a1-153e417ce678,p-vc-01.usfq.edu.ec,b4509789-2388-4298-aee8-97cf83caf1ba
T-BAN-ADMP-01,poweredOn,"T-BAN-ADMP-01 3/11/2025, 10:43:46",,2025-11-03T15:43:52.140830+00:00,[FS1-T-ESX-VM-02] T-BAN-ADMP-01/T-BAN-ADMP-01-Snapshot24.vmem,16384.0,247690.5411157608,False,poweredOn,,Error,5034213b-2202-ef02-3639-3f22e2a9c080,2025-12-06 01:15:41,USFQ,USFQ-TEST,t-esx-02.usfq.edu.ec,/USFQ/vm/Discovered virtual machine,Oracle Linux 8 (64-bit),Oracle Linux 8 (64-bit),vm-216,4234e8f3-2d87-9b49-96a1-153e417ce678,p-vc-01.usfq.edu.ec,b4509789-2388-4298-aee8-97cf83caf1ba
T-BAN-SSB-01,poweredOn,"T-BAN-SSB-01 4/8/2025, 1:24:05",,2025-08-04T06:24:13.333676+00:00,[FS1-T-ESX-VM-01] T-BAN-SSB-01/T-BAN-SSB-01-Snapshot15.vmem,16384.0,221191.54061317444,False,poweredOn,,Error,50348d19-d055-2320-6f00-b0744ff369e0,2025-12-06 01:29:08,USFQ,USFQ-TEST,t-esx-01.usfq.edu.ec,/USFQ/vm/Discovered virtual machine,Oracle Linux 8 (64-bit),Oracle Linux 8 (64-bit),vm-210,42341d93-4b17-92e9-b4f9-22a2d61ee850,p-vc-01.usfq.edu.ec,b4509789-2388-4298-aee8-97cf83caf1ba
T-BAN-SSB-01,poweredOn,"T-BAN-SSB-01 3/11/2025, 10:42:37",,2025-11-03T15:42:42.185964+00:00,[FS1-T-ESX-VM-01] T-BAN-SSB-01/T-BAN-SSB-01-Snapshot20.vmem,16384.0,240553.5378293991,False,poweredOn,,Error,50348d19-d055-2320-6f00-b0744ff369e0,2025-12-06 01:29:08,USFQ,USFQ-TEST,t-esx-01.usfq.edu.ec,/USFQ/vm/Discovered virtual machine,Oracle Linux 8 (64-bit),Oracle Linux 8 (64-bit),vm-210,42341d93-4b17-92e9-b4f9-22a2d61ee850,p-vc-01.usfq.edu.ec,b4509789-2388-4298-aee8-97cf83caf1ba
T-BAN-APP-06,poweredOn,"T-BAN-APP-06 4/8/2025, 1:22:07",,2025-08-04T06:22:16.965340+00:00,[FS1-T-ESX-VM-01] T-BAN-APP-06/T-BAN-APP-06-Snapshot14.vmem,16384.0,221191.54079818726,False,poweredOn,,Error,5034be66-1d83-e9ea-fe8c-11e9d636305c,2025-12-06 01:32:13,USFQ,USFQ-TEST,t-esx-01.usfq.edu.ec,/USFQ/vm/Discovered virtual machine,Oracle Linux 8 (64-bit),Oracle Linux 8 (64-bit),vm-209,423488eb-3dbf-bc82-7ae0-2f891540a27e,p-vc-01.usfq.edu.ec,b4509789-2388-4298-aee8-97cf83caf1ba
D-HUBI-LNX-02,poweredOn,"D-HUBI-LNX-02 13/5/2025, 14:49:34",,2025-05-13T19:49:51.015304+00:00,[FS1-T-ESX-VM-03] D-HUBI-LNX-02/D-HUBI-LNX-02-Snapshot69.vmem,16384.0,477774.2464017868,False,poweredOn,,OK,5034ff00-3bb8-1420-a10a-fea6f35af345,2025-12-16 23:36:37,USFQ,USFQ-TEST,t-esx-01.usfq.edu.ec,/USFQ/vm,CentOS 7 (64-bit),CentOS 7 (64-bit),vm-175,4234faeb-a75f-8ac4-d742-c449dff85bcc,p-vc-01.usfq.edu.ec,b4509789-2388-4298-aee8-97cf83caf1ba
D-HUBI-LNX-02,poweredOn,"D-HUBI-LNX-02 20/5/2025, 9:11:07",,2025-05-20T14:11:23.225241+00:00,[FS1-T-ESX-VM-03] D-HUBI-LNX-02/D-HUBI-LNX-02-Snapshot70.vmem,16384.0,480503.24680137634,False,poweredOn,,OK,5034ff00-3bb8-1420-a10a-fea6f35af345,2025-12-16 23:36:37,USFQ,USFQ-TEST,t-esx-01.usfq.edu.ec,/USFQ/vm,CentOS 7 (64-bit),CentOS 7 (64-bit),vm-175,4234faeb-a75f-8ac4-d742-c449dff85bcc,p-vc-01.usfq.edu.ec,b4509789-2388-4298-aee8-97cf83caf1ba
D-HUBI-LNX-02,poweredOn,"D-HUBI-LNX-02 3/11/2025, 10:05:16",,2025-11-03T15:05:26.126306+00:00,[FS1-T-ESX-VM-03] D-HUBI-LNX-02/D-HUBI-LNX-02-Snapshot95.vmem,16384.0,491386.2745513916,False,poweredOn,,OK,5034ff00-3bb8-1420-a10a-fea6f35af345,2025-12-16 23:36:37,USFQ,USFQ-TEST,t-esx-01.usfq.edu.ec,/USFQ/vm,CentOS 7 (64-bit),CentOS 7 (64-bit),vm-175,4234faeb-a75f-8ac4-d742-c449dff85bcc,p-vc-01.usfq.edu.ec,b4509789-2388-4298-aee8-97cf83caf1ba
T-BAN-BATCH-01,poweredOn,T-BAN-BATCH-01_vm-214_1,Snapshot generated by VMware vSphere Lifecycle Manager at 2024-12-30 00:19:17.422 (Lifecycle Manager local time). Snapshot will not be automatically deleted.,2024-12-30T00:07:49.317295+00:00,[FS1-T-ESX-VM-02] T-BAN-BATCH-01/T-BAN-BATCH-01-Snapshot28.vmsn,0.2703075408935547,348160.27178287506,False,poweredOff,,Error,5034ee35-1faa-b135-0249-edc1e3c0660b,2025-12-06 01:32:24,USFQ,USFQ-TEST,t-esx-01.usfq.edu.ec,/USFQ/vm/Discovered virtual machine,Oracle Linux 8 (64-bit),Oracle Linux 8 (64-bit),vm-214,42347c7b-aa43-24d5-a6a4-cf2f0ad05d6a,p-vc-01.usfq.edu.ec,b4509789-2388-4298-aee8-97cf83caf1ba
T-BAN-BATCH-01,poweredOn,"T-BAN-BATCH-01 4/8/2025, 1:22:37",,2025-08-04T06:22:45.809790+00:00,[FS1-T-ESX-VM-02] T-BAN-BATCH-01/T-BAN-BATCH-01-Snapshot38.vmem,16384.0,404103.5413389206,False,poweredOn,,Error,5034ee35-1faa-b135-0249-edc1e3c0660b,2025-12-06 01:32:24,USFQ,USFQ-TEST,t-esx-01.usfq.edu.ec,/USFQ/vm/Discovered virtual machine,Oracle Linux 8 (64-bit),Oracle Linux 8 (64-bit),vm-214,42347c7b-aa43-24d5-a6a4-cf2f0ad05d6a,p-vc-01.usfq.edu.ec,b4509789-2388-4298-aee8-97cf83caf1ba
T-BAN-APP-02,poweredOn,T-BAN-APP-02_vm-198_1,Snapshot generated by VMware vSphere Lifecycle Manager at 2024-12-30 00:18:41.958 (Lifecycle Manager local time). Snapshot will not be automatically deleted.,2024-12-30T00:07:19.428781+00:00,[FS1-T-ESX-VM-01] T-BAN-APP-02/T-BAN-APP-02-Snapshot7.vmsn,0.2704172134399414,204800.27207279205,False,poweredOff,,Error,5034275a-781f-ca0a-7469-739b487105a0,2025-12-06 01:25:30,USFQ,USFQ-TEST,t-esx-01.usfq.edu.ec,/USFQ/vm/Discovered virtual machine,Oracle Linux 8 (64-bit),Oracle Linux 8 (64-bit),vm-198,42340a53-1fc2-c859-ff08-4e93abf5de12,p-vc-01.usfq.edu.ec,b4509789-2388-4298-aee8-97cf83caf1ba
T-BAN-APP-02,poweredOn,"T-BAN-APP-02 4/8/2025, 1:20:55",,2025-08-04T06:21:06.176462+00:00,[FS1-T-ESX-VM-01] T-BAN-APP-02/T-BAN-APP-02-Snapshot17.vmem,16384.0,270130.5371618271,False,poweredOn,,Error,5034275a-781f-ca0a-7469-739b487105a0,2025-12-06 01:25:30,USFQ,USFQ-TEST,t-esx-01.usfq.edu.ec,/USFQ/vm/Discovered virtual machine,Oracle Linux 8 (64-bit),Oracle Linux 8 (64-bit),vm-198,42340a53-1fc2-c859-ff08-4e93abf5de12,p-vc-01.usfq.edu.ec,b4509789-2388-4298-aee8-97cf83caf1ba
T-BAN-APP-02,poweredOn,"T-BAN-APP-02 7/10/2025, 10:36:22",,2025-10-07T15:36:30.965269+00:00,[FS1-T-ESX-VM-01] T-BAN-APP-02/T-BAN-APP-02-Snapshot20.vmem,16384.0,293905.5383205414,False,poweredOn,,Error,5034275a-781f-ca0a-7469-739b487105a0,2025-12-06 01:25:30,USFQ,USFQ-TEST,t-esx-01.usfq.edu.ec,/USFQ/vm/Discovered virtual machine,Oracle Linux 8 (64-bit),Oracle Linux 8 (64-bit),vm-198,42340a53-1fc2-c859-ff08-4e93abf5de12,p-vc-01.usfq.edu.ec,b4509789-2388-4298-aee8-97cf83caf1ba
T-BAN-APP-01,poweredOn,"T-BAN-APP-01 4/8/2025, 1:20:36",,2025-08-04T06:20:47.018237+00:00,[FS1-T-ESX-VM-02] T-BAN-APP-01/T-BAN-APP-01-Snapshot18.vmem,16384.0,262151.5402851105,False,poweredOn,,Error,503423aa-4e0e-955f-883f-0000ae2fa7e5,2025-12-06 01:22:20,USFQ,USFQ-TEST,t-esx-01.usfq.edu.ec,/USFQ/vm/Discovered virtual machine,Oracle Linux 8 (64-bit),Oracle Linux 8 (64-bit),vm-197,42340bde-6e72-a748-452a-6e514a70a428,p-vc-01.usfq.edu.ec,b4509789-2388-4298-aee8-97cf83caf1ba
T-BAN-APP-03,poweredOn,"T-BAN-APP-03 4/8/2025, 1:21:10",,2025-08-04T06:21:30.981371+00:00,[FS1-T-ESX-VM-03] T-BAN-APP-03/T-BAN-APP-03-Snapshot15.vmem,16384.0,221191.53985500336,False,poweredOn,,Error,5034372c-d32c-78e5-2acb-525ff245c5a6,2025-12-06 01:28:48,USFQ,USFQ-TEST,t-esx-01.usfq.edu.ec,/USFQ/vm/Discovered virtual machine,Oracle Linux 8 (64-bit),Oracle Linux 8 (64-bit),vm-196,423410f1-72dc-a378-ab90-9462fca74872,p-vc-01.usfq.edu.ec,b4509789-2388-4298-aee8-97cf83caf1ba
P-WIN-ADM-01,poweredOff,P-WIN-ADM-01_vm-1389_1,Snapshot generated by VMware vSphere Lifecycle Manager at 2024-11-20 15:43:59.411 (Lifecycle Manager local time). Snapshot will not be automatically deleted.,2024-11-20T15:46:52.067762+00:00,[FS1-T-ESX-VM-03] P-WIN-ADM-01/P-WIN-ADM-01-Snapshot4.vmsn,0.2699003219604492,92160.27035522461,False,poweredOff,,,5034cf2d-7274-7061-a1ef-c6cd0ab0658a,,USFQ,USFQ-TEST,t-esx-01.usfq.edu.ec,/USFQ/vm/COMUNICACIONES-VM-PRODUCCION,Microsoft Windows Server 2019 (64-bit),,vm-1389,4234f382-6961-70d8-6e60-04a901f1e030,p-vc-01.usfq.edu.ec,b4509789-2388-4298-aee8-97cf83caf1ba
T-BAN-ETHOS-01,poweredOn,"T-BAN-ETHOS-01 4/8/2025, 1:23:43",,2025-08-04T06:23:51.891985+00:00,[FS1-T-ESX-VM-01] T-BAN-ETHOS-01/T-BAN-ETHOS-01-Snapshot19.vmem,16384.0,221191.5393781662,False,poweredOn,,Error,50341aef-5a5e-1235-c8c2-84acf64e0fa7,2025-12-06 01:22:09,USFQ,USFQ-TEST,t-esx-01.usfq.edu.ec,/USFQ/vm/Discovered virtual machine,Oracle Linux 8 (64-bit),Oracle Linux 8 (64-bit),vm-200,4234f558-4247-4ecb-0219-1d7cc6c39db0,p-vc-01.usfq.edu.ec,b4509789-2388-4298-aee8-97cf83caf1ba
T-BAN-ETHOS-01,poweredOn,"T-BAN-ETHOS-01 3/11/2025, 10:42:23",,2025-11-03T15:42:28.435296+00:00,[FS1-T-ESX-VM-01] T-BAN-ETHOS-01/T-BAN-ETHOS-01-Snapshot24.vmem,16384.0,240262.54620552063,False,poweredOn,,Error,50341aef-5a5e-1235-c8c2-84acf64e0fa7,2025-12-06 01:22:09,USFQ,USFQ-TEST,t-esx-01.usfq.edu.ec,/USFQ/vm/Discovered virtual machine,Oracle Linux 8 (64-bit),Oracle Linux 8 (64-bit),vm-200,4234f558-4247-4ecb-0219-1d7cc6c39db0,p-vc-01.usfq.edu.ec,b4509789-2388-4298-aee8-97cf83caf1ba
T-RESERVAS-C7-01,poweredOn,"T-RESERVAS-C7-01 23/12/2024, 04:07:59",,2024-12-23T09:10:01.222433+00:00,[FS1-T-ESX-VM-01] T-RESERVAS-C7-01/T-RESERVAS-C7-01-Snapshot2.vmem,4096.0,249101.15920639038,False,poweredOn,,OK,500602f2-1d88-3635-df6e-8b6cf2691cd5,2025-12-19 16:09:25,USFQ,USFQ-TEST,t-esx-01.usfq.edu.ec,/USFQ/vm,CentOS 7 (64-bit),CentOS 7 (64-bit),vm-2137,420666a3-058e-613b-ec37-c9cc8bc609d4,p-vc-01.usfq.edu.ec,b4509789-2388-4298-aee8-97cf83caf1ba
T-RESERVAS-C7-01,poweredOn,"T-RESERVAS-C7-01 10/2/2025, 10:19:17",,2025-02-10T15:18:29.533605+00:00,[FS1-T-ESX-VM-01] T-RESERVAS-C7-01/T-RESERVAS-C7-01-Snapshot3.vmem,4096.0,256097.15954208374,False,poweredOn,,OK,500602f2-1d88-3635-df6e-8b6cf2691cd5,2025-12-19 16:09:25,USFQ,USFQ-TEST,t-esx-01.usfq.edu.ec,/USFQ/vm,CentOS 7 (64-bit),CentOS 7 (64-bit),vm-2137,420666a3-058e-613b-ec37-c9cc8bc609d4,p-vc-01.usfq.edu.ec,b4509789-2388-4298-aee8-97cf83caf1ba
T-RESERVAS-C7-01,poweredOn,"T-RESERVAS-C7-01 21/3/2025, 11:36:32",,2025-03-21T16:38:30.522215+00:00,[FS1-T-ESX-VM-01] T-RESERVAS-C7-01/T-RESERVAS-C7-01-Snapshot7.vmem,4096.0,260393.15988445282,False,poweredOn,,OK,500602f2-1d88-3635-df6e-8b6cf2691cd5,2025-12-19 16:09:25,USFQ,USFQ-TEST,t-esx-01.usfq.edu.ec,/USFQ/vm,CentOS 7 (64-bit),CentOS 7 (64-bit),vm-2137,420666a3-058e-613b-ec37-c9cc8bc609d4,p-vc-01.usfq.edu.ec,b4509789-2388-4298-aee8-97cf83caf1ba
T-BAN-ESM-01,poweredOn,"T-BAN-ESM-01 4/8/2025, 1:23:28",,2025-08-04T06:23:35.987149+00:00,[FS1-T-ESX-VM-02] T-BAN-ESM-01/T-BAN-ESM-01-Snapshot13.vmem,24576.0,475143.5533027649,False,poweredOn,,Error,50342b75-c1ec-5813-5440-ffa3e66cc24c,2025-12-06 01:25:52,USFQ,USFQ-TEST,t-esx-01.usfq.edu.ec,/USFQ/vm/Discovered virtual machine,Oracle Linux 8 (64-bit),Oracle Linux 8 (64-bit),vm-201,42341818-6662-296c-9f3f-476f6cf5113a,p-vc-01.usfq.edu.ec,b4509789-2388-4298-aee8-97cf83caf1ba
T-BAN-ESM-01,poweredOn,"T-BAN-ESM-01 3/11/2025, 10:42:52",,2025-11-03T15:42:57.080119+00:00,[FS1-T-ESX-VM-02] T-BAN-ESM-01/T-BAN-ESM-01-Snapshot18.vmem,24576.0,514214.5647163391,False,poweredOn,,Error,50342b75-c1ec-5813-5440-ffa3e66cc24c,2025-12-06 01:25:52,USFQ,USFQ-TEST,t-esx-01.usfq.edu.ec,/USFQ/vm/Discovered virtual machine,Oracle Linux 8 (64-bit),Oracle Linux 8 (64-bit),vm-201,42341818-6662-296c-9f3f-476f6cf5113a,p-vc-01.usfq.edu.ec,b4509789-2388-4298-aee8-97cf83caf1ba
T-APP-REDCAP-OLN-01,poweredOn,T-APP-REDCAP-OLN-01_vm-169_1,Snapshot generated by VMware vSphere Lifecycle Manager at 2024-10-14 19:16:18.938 (Lifecycle Manager local time). Snapshot will not be automatically deleted.,2024-10-14T19:16:18.959471+00:00,[FS1-T-ESX-VM-01] T-APP-REDCAP-OLN-01/T-APP-REDCAP-OLN-01-Snapshot20.vmsn,0.26994991302490234,102400.27053070068,False,poweredOff,,OK,503429f4-4f5f-fd26-e6bd-f7e6a885fb1b,2025-12-19 16:02:53,USFQ,USFQ-TEST,t-esx-01.usfq.edu.ec,/USFQ/vm/Discovered virtual machine,Oracle Linux 8 (64-bit),Oracle Linux 8 (64-bit),vm-169,42342a0a-a98f-d8b3-00a7-11bf3ed0e9ff,p-vc-01.usfq.edu.ec,b4509789-2388-4298-aee8-97cf83caf1ba
T-APP-REDCAP-OLN-01,poweredOn,"T-APP-REDCAP-OLN-01 24/11/2025, 14:27:19",,2025-11-24T19:27:24.860396+00:00,[FS1-T-ESX-VM-01] T-APP-REDCAP-OLN-01/T-APP-REDCAP-OLN-01-Snapshot90.vmem,4096.0,136309.53601646423,False,poweredOn,,OK,503429f4-4f5f-fd26-e6bd-f7e6a885fb1b,2025-12-19 16:02:53,USFQ,USFQ-TEST,t-esx-01.usfq.edu.ec,/USFQ/vm/Discovered virtual machine,Oracle Linux 8 (64-bit),Oracle Linux 8 (64-bit),vm-169,42342a0a-a98f-d8b3-00a7-11bf3ed0e9ff,p-vc-01.usfq.edu.ec,b4509789-2388-4298-aee8-97cf83caf1ba
T-HUBI-PYTHON-OLNX-01,poweredOn,T-HUBI-PYTHON-OLNX-01_vm-188_1,Snapshot generated by VMware vSphere Lifecycle Manager at 2024-10-17 14:45:02.062 (Lifecycle Manager local time). Snapshot will not be automatically deleted.,2024-10-17T14:44:35.479081+00:00,[FS1-T-ESX-VM-01] T-HUBI-PYTHON-OLNX-01/T-HUBI-PYTHON-OLNX-01-Snapshot38.vmsn,0.028174400329589844,26640.028783798218,False,poweredOff,,OK,5034e080-e0b4-af8d-5c2b-4aa1439e443a,2025-12-16 23:04:34,USFQ,USFQ-TEST,t-esx-01.usfq.edu.ec,/USFQ/vm/Discovered virtual machine,Other 2.6.x Linux (64-bit),Oracle Linux 8 (64-bit),vm-188,423472c6-dfd3-5c70-d63e-6332167f7b84,p-vc-01.usfq.edu.ec,b4509789-2388-4298-aee8-97cf83caf1ba
T-HUBI-PYTHON-OLNX-01,poweredOn,"T-HUBI-PYTHON-OLNX-01 10/11/2024, 09:58:54",,2024-11-10T14:55:09.998699+00:00,[FS1-T-ESX-VM-01] T-HUBI-PYTHON-OLNX-01/T-HUBI-PYTHON-OLNX-01-Snapshot43.vmem,8192.0,38240.24291610718,False,poweredOn,,OK,5034e080-e0b4-af8d-5c2b-4aa1439e443a,2025-12-16 23:04:34,USFQ,USFQ-TEST,t-esx-01.usfq.edu.ec,/USFQ/vm/Discovered virtual machine,Other 2.6.x Linux (64-bit),Oracle Linux 8 (64-bit),vm-188,423472c6-dfd3-5c70-d63e-6332167f7b84,p-vc-01.usfq.edu.ec,b4509789-2388-4298-aee8-97cf83caf1ba
T-HUBI-PYTHON-OLNX-01,poweredOn,"T-HUBI-PYTHOM-OLNX-01 23/12/2024, 02:36:56",,2024-12-23T07:26:52.251459+00:00,[FS1-T-ESX-VM-01] T-HUBI-PYTHON-OLNX-01/T-HUBI-PYTHON-OLNX-01-Snapshot50.vmem,8192.0,48525.24356174469,False,poweredOn,,OK,5034e080-e0b4-af8d-5c2b-4aa1439e443a,2025-12-16 23:04:34,USFQ,USFQ-TEST,t-esx-01.usfq.edu.ec,/USFQ/vm/Discovered virtual machine,Other 2.6.x Linux (64-bit),Oracle Linux 8 (64-bit),vm-188,423472c6-dfd3-5c70-d63e-6332167f7b84,p-vc-01.usfq.edu.ec,b4509789-2388-4298-aee8-97cf83caf1ba
